username;date;retweets;favorites;text;geo;mentions;hashtags;id;permalink
OmDennis;2019-01-22 12:01;0;0;"Pengen rasanya....";;;;"1087576072885923840";https://twitter.com/OmDennis/status/1087576072885923840
OmDennis;2019-01-22 11:47;6;5;"Cek jadwal #Supermoon tahun ini. Awas kelewatan, ntar baper! https:// twitter.com/infoBMKG/statu s/1087308953472516097 …";;;#Supermoon;"1087572353591128065";https://twitter.com/OmDennis/status/1087572353591128065
OmDennis;2019-01-22 11:19;17;40;"Kalo jadi series bakal keren nih! https:// twitter.com/BBCIndonesia/s tatus/1086820254918029312 …";;;;"1087565466430631936";https://twitter.com/OmDennis/status/1087565466430631936
OmDennis;2019-01-21 18:30;19;12;"#ColdplayPeduliPemilu https:// twitter.com/dirwanst/statu s/1087226746120765441 …";;;#ColdplayPeduliPemilu;"1087311477441286145";https://twitter.com/OmDennis/status/1087311477441286145
OmDennis;2019-01-21 12:45;2;11;"Miss me already, PSSI ? pic.twitter.com/CeQ8rmLpHa";;;;"1087224527963152384";https://twitter.com/OmDennis/status/1087224527963152384
OmDennis;2019-01-21 09:41;47;56;"Kejadian di komik ini hanya ilustrasi fiktif. Tapi cukup untuk memotret sebagian pola pikir orang di negeri ini. https:// twitter.com/IDkartunesia/s tatus/1087173118706081792 …";;;;"1087178455551098880";https://twitter.com/OmDennis/status/1087178455551098880
OmDennis;2019-01-19 22:28;2;2;"Sekarang i jadi tau... https:// twitter.com/senjatanuklir/ status/1086530152161468416 …";;;;"1086646479656079361";https://twitter.com/OmDennis/status/1086646479656079361
OmDennis;2019-01-19 22:24;0;0;"Maksudnya yg hewan. Tapi yg ini sepertinya juga menarik";;;;"1086645605814792192";https://twitter.com/OmDennis/status/1086645605814792192
OmDennis;2019-01-19 22:03;3;10;"AKU BARU TAHU DI INDONESIA ADA RED PANDA! https:// twitter.com/Bisniscom/stat us/1086639809798430723 …";;;;"1086640307217694727";https://twitter.com/OmDennis/status/1086640307217694727
OmDennis;2019-01-19 22:01;1;7;"Selamat ya! @NyneComics https:// twitter.com/the_magdalene/ status/1086146123792756736 …";;@NyneComics;;"1086639796812800000";https://twitter.com/OmDennis/status/1086639796812800000
OmDennis;2019-01-19 21:58;39;26;"Sudah ke sekian kali saya melihat manuver politik yang tidak sesuai harapan. Namun, apakah itu akan membuat saya untuk golput? Jelas tidak. Kurang lebih alasannya terwakili di tweet ini: https:// twitter.com/thedufresne/st atus/1086554734670934017 …";;;;"1086639087816036353";https://twitter.com/OmDennis/status/1086639087816036353
OmDennis;2019-01-19 15:47;18;34;"Setuju! https:// twitter.com/DiajengLrst/st atus/1086495290603917314 …";;;;"1086545792976842753";https://twitter.com/OmDennis/status/1086545792976842753
OmDennis;2019-01-18 17:10;6;5;"Emang bener nih @NetflixID sudah bisa ditonton lewat koneksi Indihome @TelkomCare ? Kalau bener iya, gue ganti keyakinan, nih!";;@NetflixID @TelkomCare;;"1086204223421706240";https://twitter.com/OmDennis/status/1086204223421706240
OmDennis;2019-01-18 13:58;1;3;"Semiga sudah sikat gigi https:// twitter.com/dissakamajaya/ status/1086042479302926336 …";;;;"1086155976938385408";https://twitter.com/OmDennis/status/1086155976938385408
OmDennis;2019-01-17 23:51;7;8;"Hmmm...bot dan admin akun fake-nya kerja keras sampai semalam ini juga, rupanya";;;;"1085942653789687809";https://twitter.com/OmDennis/status/1085942653789687809
OmDennis;2019-01-17 09:51;266;138;"Mental miskin-sok-kaya-masuk-surga inilah yang bikin negara susah majunya.";;;;"1085731372134588416";https://twitter.com/OmDennis/status/1085731372134588416
OmDennis;2019-01-17 09:45;4;1;"Diskusi singkat dan mencerahkan: https:// twitter.com/KFCINDONESIA/s tatus/1085132472591933440 …";;;;"1085729694400409600";https://twitter.com/OmDennis/status/1085729694400409600
OmDennis;2019-01-17 07:06;26;21;"Mestinya gini... https:// twitter.com/tiyokpras/stat us/1085393658067763200 …";;;;"1085689701661474816";https://twitter.com/OmDennis/status/1085689701661474816
OmDennis;2019-01-15 17:54;75;42;"Turut berduka atas wafatnya @gebiramadhan . Terimakasih atas segala tawa darimu. We will miss you. pic.twitter.com/DK0xTkhuvK";;@gebiramadhan;;"1085128058225385472";https://twitter.com/OmDennis/status/1085128058225385472
OmDennis;2019-01-14 22:59;0;0;"yoi buuu";;;;"1084842382665732102";https://twitter.com/OmDennis/status/1084842382665732102
OmDennis;2019-01-14 18:14;6;6;"Ngelihat ini aku ikut hepi! gerakannya super! https:// twitter.com/ryuhasan/statu s/1084736934839083009 …";;;;"1084770778720002048";https://twitter.com/OmDennis/status/1084770778720002048
OmDennis;2019-01-14 18:12;6;17;"Video klip lagu "Luruh" Ini ajaib sekali: Masuk ke kuping sebagai suara, Keluar dari mata sebagai air. @isyanasarasvati #rarasekar Nonton di sini: https:// youtu.be/5iZNTmBBfTs";;@isyanasarasvati;#rarasekar;"1084770140699283456";https://twitter.com/OmDennis/status/1084770140699283456
OmDennis;2019-01-13 07:57;18;20;"Bagi saya, beliau adalah seorang pegiat konten positif yang sangat murah senyum dan gemar membagi pengetahuan gratis. Kepergianmu kali ini terlalu mendadak, om @nukman Semoga amal baikmu bisa menjadi inspirasi kita semua #RIPNukman";;@nukman;#RIPNukman;"1084253042520641536";https://twitter.com/OmDennis/status/1084253042520641536
OmDennis;2019-01-12 14:13;5;8;"Misteri yg Akhirnya terungkap https:// twitter.com/si_enthon9/sta tus/1083668322804060160 …";;;;"1083985219282063360";https://twitter.com/OmDennis/status/1083985219282063360
OmDennis;2019-01-12 13:35;9;16;"Nah gini kek dari dulu! Hahahahaha https:// twitter.com/9genka/status/ 1083360152898625541 …";;;;"1083975857348079616";https://twitter.com/OmDennis/status/1083975857348079616
OmDennis;2019-01-10 22:35;0;0;"Ngeteh sambil DnD adalah ide bagus! https:// twitter.com/bilyakbar/stat us/1083370096641200132 …";;;;"1083386841598910464";https://twitter.com/OmDennis/status/1083386841598910464
OmDennis;2019-01-10 22:34;0;0;"Bisa lgsg rame sama anak Kpop dan Kdrama . Bagus juga sih pic.twitter.com/Sr97YlOPJ7";;;;"1083386626867265537";https://twitter.com/OmDennis/status/1083386626867265537
OmDennis;2019-01-10 21:36;0;0;"scene dnd masih niche sih. Gue populerin dulu sama temen2 yak";;;;"1083372038985637893";https://twitter.com/OmDennis/status/1083372038985637893
OmDennis;2019-01-10 21:36;0;0;"main pak ayo maiiin";;;;"1083371945993789440";https://twitter.com/OmDennis/status/1083371945993789440
OmDennis;2019-01-10 21:36;0;0;"manualnya aja sih yg versi indonesia. Kartunya tetep english";;;;"1083371894684827649";https://twitter.com/OmDennis/status/1083371894684827649
OmDennis;2019-01-10 20:58;0;0;"Yang kecil rata rata 25rb an lah";;;;"1083362409685835777";https://twitter.com/OmDennis/status/1083362409685835777
OmDennis;2019-01-10 20:55;0;0;"Udah punya yg packaging versi bahasa Indonesia?";;;;"1083361816942587904";https://twitter.com/OmDennis/status/1083361816942587904
OmDennis;2019-01-10 20:55;0;0;"Justru itu yg dicari";;;;"1083361682598944773";https://twitter.com/OmDennis/status/1083361682598944773
OmDennis;2019-01-10 20:54;0;0;"Bahasan tiap hari itu mah";;;;"1083361530589077504";https://twitter.com/OmDennis/status/1083361530589077504
OmDennis;2019-01-10 20:54;0;0;"AtAmerica belum oernah bahas DnD ya?";;;;"1083361460934213632";https://twitter.com/OmDennis/status/1083361460934213632
OmDennis;2019-01-10 20:54;0;0;"Ayolah ke kantorgue waktu itu";;;;"1083361378159624192";https://twitter.com/OmDennis/status/1083361378159624192
OmDennis;2019-01-10 20:54;0;0;"Kok nanggung!?";;;;"1083361329988001793";https://twitter.com/OmDennis/status/1083361329988001793
OmDennis;2019-01-10 20:53;0;0;"Hahaha iya main juga di Steam";;;;"1083361155693699074";https://twitter.com/OmDennis/status/1083361155693699074
OmDennis;2019-01-10 18:28;2;14;"Ngomongin board game dan Dungeons and Dragons: Ngapain diomongin?! Ayok main!! pic.twitter.com/fc6AZJG9aE";;;;"1083324580955971584";https://twitter.com/OmDennis/status/1083324580955971584
OmDennis;2019-01-10 18:25;0;0;"iya, buat yg dedek-dedek SD";;;;"1083324047784460289";https://twitter.com/OmDennis/status/1083324047784460289
OmDennis;2019-01-10 18:25;0;1;"Tiap hari! https:// twitter.com/AudreyChristab e/status/1083323015692091392 …";;;;"1083323852711591936";https://twitter.com/OmDennis/status/1083323852711591936
OmDennis;2019-01-10 18:13;3;7;"Ngomongin series & film: sampai weekend. Ngomongin gamer mobile vs gamer konsol: sampai dipisahin PC master race.";;;;"1083320888630472705";https://twitter.com/OmDennis/status/1083320888630472705
OmDennis;2019-01-10 18:11;0;1;"Sampai lusa";;;;"1083320490813345793";https://twitter.com/OmDennis/status/1083320490813345793
OmDennis;2019-01-10 18:11;0;1;"Masak ala ala kaya gini sih bisanya https:// youtu.be/fSbZc8E8bkM";;;;"1083320383585964032";https://twitter.com/OmDennis/status/1083320383585964032
OmDennis;2019-01-10 18:03;0;0;"Halo kakak botol vitamin favorit di minggu pagi";;;;"1083318313424306176";https://twitter.com/OmDennis/status/1083318313424306176
OmDennis;2019-01-10 18:00;22;44;"Teruntuk teman-teman wartawan, mohon maklum kalau saya tidak akan melayani wawancara seputar gosip seleb maupun ritual agama tertentu. Tapi kalau ngomongin sains, ayo ngobrol sampai pagi!";;;;"1083317565294669829";https://twitter.com/OmDennis/status/1083317565294669829
OmDennis;2019-01-10 09:29;2;4;"Nice! https:// twitter.com/spectatorindex /status/1083142251683799041 …";;;;"1083189170267287553";https://twitter.com/OmDennis/status/1083189170267287553
OmDennis;2019-01-10 09:22;6;25;"Mottonya sangat mengerti warga! https:// twitter.com/trialogy/statu s/1082495828290297856 …";;;;"1083187384919908354";https://twitter.com/OmDennis/status/1083187384919908354
OmDennis;2019-01-09 23:35;0;0;"Ayolah nang Jakarta. Sebulan aja";;;;"1083039501092511745";https://twitter.com/OmDennis/status/1083039501092511745
OmDennis;2019-01-09 09:38;2;4;"Sabar, mungkin harus bikin program wajib dipijet 2 hari sekali. https:// twitter.com/nurhadi_aldo/s tatus/1082698603959742466 …";;;;"1082828923979743232";https://twitter.com/OmDennis/status/1082828923979743232
OmDennis;2019-01-08 13:57;2;7;"Kok jadi kayak hewan linsang https:// twitter.com/9GAG/status/10 82442260426432517 …";;;;"1082531789183373312";https://twitter.com/OmDennis/status/1082531789183373312
OmDennis;2019-01-08 09:34;0;0;"hmmmmmmm ini menarik";;;;"1082465448761782272";https://twitter.com/OmDennis/status/1082465448761782272
OmDennis;2019-01-07 20:24;0;0;"amiin";;;;"1082266757237137409";https://twitter.com/OmDennis/status/1082266757237137409
OmDennis;2019-01-07 20:24;0;0;"Tapi genuk bantal sudah tidak ada yg main krn kalinya kotor";;;;"1082266711594684416";https://twitter.com/OmDennis/status/1082266711594684416
OmDennis;2019-01-07 20:22;0;2;"Iya bener, sehingga kru kita bisa makin enjoy kerjanya, dan terasah skill-nya, dan bisa ikut terlibat project skala internasional.....kayak kamu!";;;;"1082266243803959297";https://twitter.com/OmDennis/status/1082266243803959297
OmDennis;2019-01-07 19:38;25;57;"Film Indonesia lagi merajalela di Box Office bioskop Indonesia. Genre nya pun macem-macem. Kualitasnya juga bagus. Seneng deh lihatnya :))";;;;"1082255105242492928";https://twitter.com/OmDennis/status/1082255105242492928
OmDennis;2019-01-07 15:39;0;0;"makanya langganan jamu buyung upik";;;;"1082195063659089920";https://twitter.com/OmDennis/status/1082195063659089920
OmDennis;2019-01-07 15:39;0;0;"kok tahu saya pendukung paslon @nurhadi_aldo ?";;@nurhadi_aldo;;"1082194929823019008";https://twitter.com/OmDennis/status/1082194929823019008
OmDennis;2019-01-07 14:42;6;15;"EEEYOHLIDODADIDODADISKIBIDIPAPAPP pic.twitter.com/CUMi4OYRtl";;;;"1082180697178009601";https://twitter.com/OmDennis/status/1082180697178009601
OmDennis;2019-01-07 14:41;0;3;"EEE YOH! https:// twitter.com/goldenglobes/s tatus/1082129339406110720 …";;;;"1082180463815323649";https://twitter.com/OmDennis/status/1082180463815323649
OmDennis;2019-01-06 22:48;4;5;"Welcome, to the dark side of the moon. #abouttime https:// twitter.com/mashable/statu s/1081940202380320768 …";;;#abouttime;"1081940559734788096";https://twitter.com/OmDennis/status/1081940559734788096
OmDennis;2019-01-06 22:47;0;0;"pic.twitter.com/Tc69dY3C8P";;;;"1081940332168630272";https://twitter.com/OmDennis/status/1081940332168630272
OmDennis;2019-01-06 16:06;1;2;"Resiko doyan minum-minum (2) https:// twitter.com/Niloosy/status /1079686368438218752 …";;;;"1081839442669662210";https://twitter.com/OmDennis/status/1081839442669662210
OmDennis;2019-01-06 16:06;3;6;"Resiko doyan minum-minum (1) https:// twitter.com/bckwdd/status/ 1079480617836912640 …";;;;"1081839346611773440";https://twitter.com/OmDennis/status/1081839346611773440
OmDennis;2019-01-05 15:05;6;11;"Bisa buat ganjel laper? https:// twitter.com/DianOnno/statu s/1081446456387461120 …";;;;"1081461622554542080";https://twitter.com/OmDennis/status/1081461622554542080
OmDennis;2019-01-04 23:17;1;2;"Semangat, admin! Dari tadi saya ngintipin timeline kamu kok!";;;;"1081223079655665666";https://twitter.com/OmDennis/status/1081223079655665666
OmDennis;2019-01-04 22:34;0;3;"Terimakasiiiih :)) https:// twitter.com/RahmatAriaB/st atus/1081173965446340609 …";;;;"1081212158979989504";https://twitter.com/OmDennis/status/1081212158979989504
OmDennis;2019-01-04 22:33;27;29;"Capres favoritku masuk BBC karena memang B E R B O B O T https:// twitter.com/BBCIndonesia/s tatus/1080971450390114304 …";;;;"1081211931644444672";https://twitter.com/OmDennis/status/1081211931644444672
OmDennis;2019-01-04 13:19;0;1;"nah terus ke postingan bawah lagi...terus";;;;"1081072657838166017";https://twitter.com/OmDennis/status/1081072657838166017
OmDennis;2019-01-04 08:35;0;0;"Adanya jamoor pic.twitter.com/e5YoTReFyw";;;;"1081001205965381633";https://twitter.com/OmDennis/status/1081001205965381633
OmDennis;2019-01-04 08:29;0;0;"hahah baik! tinggal produsernya mau apa enggak";;;;"1080999555896770560";https://twitter.com/OmDennis/status/1080999555896770560
OmDennis;2019-01-04 08:28;1;4;"Aku nggak mau pamer biceps. Cek instagram saya @dennisadishwara untuk lebih banyak biceps https:// twitter.com/kunderemp/stat us/1080689209709494274 …";;@dennisadishwara;;"1080999422454951936";https://twitter.com/OmDennis/status/1080999422454951936
OmDennis;2019-01-03 21:08;0;2;"thank you banget!";;;;"1080828159610646530";https://twitter.com/OmDennis/status/1080828159610646530
OmDennis;2019-01-03 17:03;9;7;"Andai sepraktis ini... https:// twitter.com/flutulang__/st atus/1080432869602803712 …";;;;"1080766523004731392";https://twitter.com/OmDennis/status/1080766523004731392
OmDennis;2019-01-03 17:00;1;2;"Saat yang cocok buat marathon film Indonesia di bioskop. Jangan lupa, masukin #MillyMametMovie ke daftar nonton biar klop. https:// twitter.com/bicaraboxoffic e/status/1080716867109416960 …";;;#MillyMametMovie;"1080765764909420544";https://twitter.com/OmDennis/status/1080765764909420544
OmDennis;2019-01-03 09:44;9;2;"KERECEHAN APA LAGI INI ???!!!! https:// twitter.com/nurhadi_aldo/s tatus/1078991681431564288 …";;;;"1080656212683743232";https://twitter.com/OmDennis/status/1080656212683743232
OmDennis;2019-01-03 08:35;0;2;"Silakan... pic.twitter.com/fDiHTSFWjX";;;;"1080638835925479426";https://twitter.com/OmDennis/status/1080638835925479426
OmDennis;2019-01-03 08:20;139;94;"Senang lihat variasi genrenya, ada: - Horor adaptasi game - Drama adaptasi serial TV - Komedi semi-otobiografi - Teen flick adaptasi webtoon Semoga penonton membanjiri bioskop! https:// twitter.com/paradigmafilm/ status/1080444624299151360 …";;;;"1080635083134922752";https://twitter.com/OmDennis/status/1080635083134922752
OmDennis;2019-01-02 20:17;4;6;"Untung gak ada pilihan: "Lempar kesalahan ke Mamet" https:// twitter.com/NetflixID/stat us/1080448627661664257 …";;;;"1080453121497649152";https://twitter.com/OmDennis/status/1080453121497649152
OmDennis;2019-01-02 13:00;0;1;"Wah terimakasih sudah nonton dan berbagi kesan. Semoga jadi bahan diskusi. Btw kita udah lama gak ketemu lho!";;;;"1080342969528463361";https://twitter.com/OmDennis/status/1080342969528463361
OmDennis;2019-01-01 14:39;1;1;"Semangat mencoba ya. Kalau gagal dan dirasa gak cocok, ya jd pelajaran aja";;;;"1080005574064914432";https://twitter.com/OmDennis/status/1080005574064914432
OmDennis;2019-01-01 14:36;0;1;"Hahhaha spoilerrr";;;;"1080004726656163841";https://twitter.com/OmDennis/status/1080004726656163841
OmDennis;2019-01-01 10:47;0;2;"Terimakasih sudah mereview,btw selamat tahun baru! https:// twitter.com/KanzKanz/statu s/1079946124398456832 …";;;;"1079947272505286656";https://twitter.com/OmDennis/status/1079947272505286656
OmDennis;2019-01-01 10:14;0;0;"Hahahaha, Milly Mamet pasangan pengertian. Happy new year too!!! All the best buat keluarga & bisnis di 2019!";;;;"1079938864129556483";https://twitter.com/OmDennis/status/1079938864129556483
OmDennis;2019-01-01 09:59;5;22;"Happy New Year! Semoga tahun ini kita semua bisa lebih dekat dengan cita-cita! pic.twitter.com/5XtCNiH9FI";;;;"1079935101981548545";https://twitter.com/OmDennis/status/1079935101981548545
OmDennis;2018-12-31 13:41;0;2;"Wah habis movie marathon nih! Thank you! https:// twitter.com/uberfunk/statu s/1078624379720724481 …";;;;"1079628599571824641";https://twitter.com/OmDennis/status/1079628599571824641
OmDennis;2018-12-31 10:18;0;1;"Mamah Itje juarak!";;;;"1079577565105287169";https://twitter.com/OmDennis/status/1079577565105287169
OmDennis;2018-12-30 22:41;0;0;"Thanks to arahan sutradara dan editor yg sudah memilih adegan yg terbaik. Acting yg gagal diumpetin hihihihi";;;;"1079401989950267393";https://twitter.com/OmDennis/status/1079401989950267393
OmDennis;2018-12-30 22:03;1;15;"Mewujudkan @millymametmovie adalah kerjasama tim. Jadi, aku juga mau terimakasih kepada seluruh kru produksi dan pasca produksi yang terlibat";;@millymametmovie;;"1079392447753416705";https://twitter.com/OmDennis/status/1079392447753416705
OmDennis;2018-12-30 21:57;0;0;"Mukaku sudah masuk komersil rupanya";;;;"1079391108315004928";https://twitter.com/OmDennis/status/1079391108315004928
OmDennis;2018-12-30 21:56;0;2;"aduh, ini pertama kali saya dibilang keren sama Menteri Agama di Indonesia. Terimakasiiih lagi";;;;"1079390860179980290";https://twitter.com/OmDennis/status/1079390860179980290
OmDennis;2018-12-30 21:34;2;8;"Alhamdulillah, terimakasih sudah menonton. Senang sekali film kami bisa jd bahan diskusi https:// twitter.com/lukmansaifuddi n/status/1079381479006687233 …";;;;"1079385248771727360";https://twitter.com/OmDennis/status/1079385248771727360
OmDennis;2018-12-30 14:45;0;0;"hola, terimakasih sudah nonton dan enjoy filmnya :))";;;;"1079282324632625153";https://twitter.com/OmDennis/status/1079282324632625153
OmDennis;2018-12-30 10:38;0;1;"Waaah jd senang dengernya. Terimakasih!";;;;"1079220212728119296";https://twitter.com/OmDennis/status/1079220212728119296
OmDennis;2018-12-30 00:10;3;1;"Kasus yang mirip juga pernah terjadi awal 2000-an di temen gue.Dia menamakan kucingnya “Bunny” . Sekarang saat sudah berkeluarga, dia punya anak laki dan dinamakan “Bani” https:// twitter.com/ernestprakasa/ status/1078160394433093632 …";;;;"1079062025743953920";https://twitter.com/OmDennis/status/1079062025743953920
OmDennis;2018-12-30 00:00;0;0;"Hahaha terimakasih. Btw salam buat si anjing, eh kucing, ....eh siapa sih nama peliharaanya yg bener?";;;;"1079059659762225152";https://twitter.com/OmDennis/status/1079059659762225152
OmDennis;2018-12-29 23:55;0;1;"Mata anda jeli Terimakasih ya";;;;"1079058325004664832";https://twitter.com/OmDennis/status/1079058325004664832
OmDennis;2018-12-29 23:52;0;1;"terimakasiiih";;;;"1079057545665232896";https://twitter.com/OmDennis/status/1079057545665232896
OmDennis;2018-12-29 14:31;11;14;"Terimakasih Disneyland Paris. Anda berhasil buat saya berpikir untuk jd vegetarian. https:// twitter.com/umenumen/statu s/1078574817475932160 …";;;;"1078916427707383808";https://twitter.com/OmDennis/status/1078916427707383808
OmDennis;2018-12-29 11:30;1;2;"BGZT https:// twitter.com/ArditErwandha/ status/1078867507534954497 …";;;;"1078870781013053440";https://twitter.com/OmDennis/status/1078870781013053440
OmDennis;2018-12-28 13:07;0;2;"...tapi aslinya kurang lebih masih gini gini aja kok pic.twitter.com/bl4Yei2gqU";;;;"1078532764368945158";https://twitter.com/OmDennis/status/1078532764368945158
OmDennis;2018-12-27 23:32;0;0;"aku biasanya konsul minta saran juga kok ke dokter hewan dekat rumah";;;;"1078327678288113664";https://twitter.com/OmDennis/status/1078327678288113664
OmDennis;2018-12-27 17:51;4;14;"Melihat vlog ini jadi auto-ngiri... https:// twitter.com/pandji/status/ 1078100926752161792 …";;;;"1078241890938413062";https://twitter.com/OmDennis/status/1078241890938413062
OmDennis;2018-12-27 05:33;0;0;"Holaaaa terimakasih!";;;;"1078056294538342401";https://twitter.com/OmDennis/status/1078056294538342401
OmDennis;2018-12-25 22:31;0;0;"Wiiihhh thank youuuu kak Adhit!";;;;"1077587747265626112";https://twitter.com/OmDennis/status/1077587747265626112
OmDennis;2018-12-25 22:03;0;0;"kami syutingnya gak pake pelet kok. Sumpah";;;;"1077580577916612609";https://twitter.com/OmDennis/status/1077580577916612609
OmDennis;2018-12-25 20:12;0;2;"Hahahaha terimakasiiih! https:// twitter.com/jefrinichol/st atus/1077417071347027968 …";;;;"1077552626554744834";https://twitter.com/OmDennis/status/1077552626554744834
OmDennis;2018-12-25 17:57;0;0;"Yesss terimakasih banget";;;;"1077518644886757377";https://twitter.com/OmDennis/status/1077518644886757377
OmDennis;2018-12-25 17:57;0;0;"mantaaaab! Terimakasih sudah nemenin kita juga";;;;"1077518577513549824";https://twitter.com/OmDennis/status/1077518577513549824
OmDennis;2018-12-25 17:56;0;0;"Woohoo thank you!";;;;"1077518424450854912";https://twitter.com/OmDennis/status/1077518424450854912
OmDennis;2018-12-25 17:09;2;2;"Sebuah review singkat tanpa spoiler: https:// twitter.com/TakoyakiMura/s tatus/1077502511500541952 …";;;;"1077506594630299649";https://twitter.com/OmDennis/status/1077506594630299649
OmDennis;2018-12-25 13:30;63;52;"Selamat Natal untuk saudaraku umat Kristiani yang merayakan. Selamat menyambut Galungan bagi saudaraku umat Hindu yang sebentar lagi akan merayakan. Dan, selamat merayakan liburan akhir tahun bagi saudaraku semua yang lainnya!";;;;"1077451512492617728";https://twitter.com/OmDennis/status/1077451512492617728
OmDennis;2018-12-25 09:39;4;2;"Oiya! https:// twitter.com/ko2w/status/10 77376684813299717 …";;;;"1077393444434112512";https://twitter.com/OmDennis/status/1077393444434112512
OmDennis;2018-12-24 21:54;5;11;"Salam sehat selalu untuk Bu Risma dan warga Surabaya! https:// twitter.com/BanggaSurabaya /status/1076645978097119232 …";;;;"1077216068374908928";https://twitter.com/OmDennis/status/1077216068374908928
OmDennis;2018-12-24 21:01;26;81;"Terimakasiiih!!! #sambilangkatlightstick https:// twitter.com/R_AmelJKT48/st atus/1077171937632149505 …";;;#sambilangkatlightstick;"1077202648334446595";https://twitter.com/OmDennis/status/1077202648334446595
OmDennis;2018-12-24 17:04;0;0;"Santai Ruby. Santaiii";;;;"1077142979859628032";https://twitter.com/OmDennis/status/1077142979859628032
OmDennis;2018-12-24 15:07;1;1;"Thank you sudah sharing ini, Ruby! Salam buat penulisnya. https:// twitter.com/rubyastari/sta tus/1077068292798373888 …";;;;"1077113548554219520";https://twitter.com/OmDennis/status/1077113548554219520
OmDennis;2018-12-24 11:37;0;1;"Tapi waktu itu bioskop sebelah gak penuh-penuh :(((";;;;"1077060674805587969";https://twitter.com/OmDennis/status/1077060674805587969
OmDennis;2018-12-24 11:36;0;2;"Terimakasiih https:// twitter.com/hipwee/status/ 1077053257560645634 …";;;;"1077060538788532224";https://twitter.com/OmDennis/status/1077060538788532224
OmDennis;2018-12-23 22:16;0;0;"namanya juga mamet";;;;"1076859009661980672";https://twitter.com/OmDennis/status/1076859009661980672
OmDennis;2018-12-23 21:38;4;4;"Salaman yuk mas... https:// twitter.com/AriOtnaigus/st atus/1076811846894608385 …";;;;"1076849483290275842";https://twitter.com/OmDennis/status/1076849483290275842
OmDennis;2018-12-23 21:35;0;2;"Terimakasih sudah menyempatkan review dan kasih masukan https:// twitter.com/koko8dibb/stat us/1076147053779050496 …";;;;"1076848701966958592";https://twitter.com/OmDennis/status/1076848701966958592
OmDennis;2018-12-23 21:31;0;2;"Thanks for the input! https:// twitter.com/farizihsan/sta tus/1076835997818675201 …";;;;"1076847812741029888";https://twitter.com/OmDennis/status/1076847812741029888
OmDennis;2018-12-23 21:26;1;4;"Thank you untuk masukannya :)) https:// twitter.com/zoelfick/statu s/1076760554138521600 …";;;;"1076846484308484096";https://twitter.com/OmDennis/status/1076846484308484096
OmDennis;2018-12-23 13:37;1;3;"Terimakasih maaas https:// twitter.com/fajarnugros/st atus/1076719403817873408 …";;;;"1076728438474436609";https://twitter.com/OmDennis/status/1076728438474436609
OmDennis;2018-12-23 11:56;0;1;"i just reached diamond-level membership.";;;;"1076703089699151872";https://twitter.com/OmDennis/status/1076703089699151872
OmDennis;2018-12-23 10:36;0;0;"iya...aku lihat si anak juga :(";;;;"1076682898579705856";https://twitter.com/OmDennis/status/1076682898579705856
OmDennis;2018-12-23 10:33;0;3;"Ya, semoga... https:// twitter.com/nda_herdian/st atus/1076679037882265600 …";;;;"1076682101796200448";https://twitter.com/OmDennis/status/1076682101796200448
OmDennis;2018-12-23 10:16;0;0;"Terimakasih jugaaa";;;;"1076677962093608960";https://twitter.com/OmDennis/status/1076677962093608960
OmDennis;2018-12-23 10:16;0;0;"KAN NGGAK BILANG MUNCULNYA PAS FILM APAAAA";;;;"1076677787107250176";https://twitter.com/OmDennis/status/1076677787107250176
OmDennis;2018-12-23 10:05;27;19;"Tidak menyangka tsunami kembali terjadi di penghujung tahun ini. Semoga keluarga korban tabah menghadapi musibah ini. Mari kita bantu agar segera pulih.";;;;"1076675243979112448";https://twitter.com/OmDennis/status/1076675243979112448
