username;date;retweets;favorites;text;geo;mentions;hashtags;id;permalink
gmarthagraciela;2019-01-23 15:03;0;26;"i DO what i want, what i wanna post so i DON’T care what u say. :) . feeds ku :’) https://www. instagram.com/p/Bs-DycoBTqt/ ?utm_source=ig_twitter_share&igshid=rj1ov6ol8nc1 …";;;;"1087984205047496704";https://twitter.com/gmarthagraciela/status/1087984205047496704
gmarthagraciela;2019-01-23 11:25;12;40;"lupakan dulu soal pertikaian-pertikaian politik, mari kita berdoa untuk saudara-saudara kita yang disana :) #PrayForSulsel #PrayForGowa #PrayForMakassar";;;#PrayForSulsel #PrayForGowa #PrayForMakassar;"1087929276203188224";https://twitter.com/gmarthagraciela/status/1087929276203188224
gmarthagraciela;2019-01-23 11:23;0;14;"kurang lebih kayak gitu.. https:// twitter.com/rxlmnn/status/ 1087926710153240576 …";;;;"1087928744126353409";https://twitter.com/gmarthagraciela/status/1087928744126353409
gmarthagraciela;2019-01-23 11:22;10;43;"ternyata diwaktu kecil saya pernah merokok ada yang ingat permen rokok ini? kalo makan permen ini waktu sd berasa keren anjir wkwkwk #Gosip90an pic.twitter.com/6dgeWdjVsR";;;#Gosip90an;"1087928568401801217";https://twitter.com/gmarthagraciela/status/1087928568401801217
gmarthagraciela;2019-01-23 11:13;1;34;"baru bangun dan mimpi balik jadi anak sd lagi, wakakaka. jadi flashback deh";;;;"1087926337619271683";https://twitter.com/gmarthagraciela/status/1087926337619271683
gmarthagraciela;2019-01-22 23:49;1;24;"“n0tail” beneran bikin pengen disayangin. awto pindah dr pendukung liquid ke OG tapi di liquid ada “twitzz” begini ya rasanya mengidolakan tapi bingung mau yang mana :((";;;;"1087754038672670720";https://twitter.com/gmarthagraciela/status/1087754038672670720
gmarthagraciela;2019-01-22 20:39;1;19;"infinite . cr : mikhaeltamosee https://www. instagram.com/p/Bs8FXpDBSO4/ ?utm_source=ig_twitter_share&igshid=3bsssao3bmz9 …";;;;"1087706322760593408";https://twitter.com/gmarthagraciela/status/1087706322760593408
gmarthagraciela;2019-01-22 10:13;2;28;"waking up and this is my worst nightmare. i don’t understand it. daze-_-";;;;"1087548743459590144";https://twitter.com/gmarthagraciela/status/1087548743459590144