username;date;retweets;favorites;text;geo;mentions;hashtags;id;permalink
Lqrqs;2019-01-24 06:27;1;2;"The migraine remains";;;;"1088216634630725632";https://twitter.com/Lqrqs/status/1088216634630725632
Lqrqs;2019-01-24 00:57;0;0;"Iya kayanya... tadi kegerimisan";;;;"1088133527541932033";https://twitter.com/Lqrqs/status/1088133527541932033
Lqrqs;2019-01-24 00:56;0;0;"Itu mah buat batuk pilek";;;;"1088133490598588417";https://twitter.com/Lqrqs/status/1088133490598588417
Lqrqs;2019-01-24 00:42;0;2;"Had 2 pills of paracetamol but still my migraine won't go away";;;;"1088129825347297280";https://twitter.com/Lqrqs/status/1088129825347297280
Lqrqs;2019-01-24 00:38;0;0;"Usam anaknya persistent pic.twitter.com/laUWNAT2p5";;;;"1088128768827305984";https://twitter.com/Lqrqs/status/1088128768827305984
Lqrqs;2019-01-24 00:14;0;0;"Dah ku adddd";;;;"1088122864673251328";https://twitter.com/Lqrqs/status/1088122864673251328
Lqrqs;2019-01-24 00:13;0;2;"Korbannya janda, punya anak umur 2 tahun, dan punya hutang 1,5 jt ke salah satu pelaku. Sedih banget";;;;"1088122570883264512";https://twitter.com/Lqrqs/status/1088122570883264512
Lqrqs;2019-01-24 00:12;0;2;"Di Sumsel ada orang dibunuh, mayatnya "digilir", terus dibakar.....";;;;"1088122406009372672";https://twitter.com/Lqrqs/status/1088122406009372672
Lqrqs;2019-01-24 00:12;0;0;"Nickname-mu aja. Aku yg add";;;;"1088122265261137920";https://twitter.com/Lqrqs/status/1088122265261137920
Lqrqs;2019-01-24 00:09;0;0;"Sama aku Sam. Nickname Laras. Gambar cowok kacamata (adekku)";;;;"1088121525373349889";https://twitter.com/Lqrqs/status/1088121525373349889
Lqrqs;2019-01-24 00:08;0;1;"Kenapa yaaaa pengen marah-marah teruuus >.< kaya ada yang mau keluar dari badan";;;;"1088121341117530112";https://twitter.com/Lqrqs/status/1088121341117530112
Lqrqs;2019-01-23 23:57;0;0;"Iya nanti aja kalo daily life-ku sudah gak di Depok";;;;"1088118493994602496";https://twitter.com/Lqrqs/status/1088118493994602496
Lqrqs;2019-01-23 23:56;1;1;""This is not oppression." https:// twitter.com/PakatDayak/sta tus/1088051663015895040 …";;;;"1088118246664880128";https://twitter.com/Lqrqs/status/1088118246664880128
Lqrqs;2019-01-23 23:53;0;0;"Aku pengen tapi ga kenal sama yg jual";;;;"1088117580169076736";https://twitter.com/Lqrqs/status/1088117580169076736
Lqrqs;2019-01-23 23:44;0;2;"Di tv ada acara ruqyah karena orang ini suka "mendengar bisikan ghaib"... what if WHAT IF... he's schizophrenic.............. masa solusinya exorcism... Ditanya dulu pula, "Pak Hadi pernah marah dengan orang tua? Ini sepertinya ditunggangi oleh anak buahnya dajjal."";;;;"1088115200308391941";https://twitter.com/Lqrqs/status/1088115200308391941
Lqrqs;2019-01-23 21:18;0;1;"Review Shopee makin hari makin ga waras pic.twitter.com/lsUjjGGNXP";;;;"1088078472298164225";https://twitter.com/Lqrqs/status/1088078472298164225
Lqrqs;2019-01-23 19:31;0;1;"Anne with an E kinda ruins my imagination about Anne of Green Gables. But it's still goooood";;;;"1088051719433445376";https://twitter.com/Lqrqs/status/1088051719433445376
Lqrqs;2019-01-23 19:17;0;1;"Biggest Bladder Stone Ever! https:// youtu.be/9-83n-615Rw I love dr. Matt bless his soul";;;;"1088048129553850369";https://twitter.com/Lqrqs/status/1088048129553850369
Lqrqs;2019-01-23 17:32;0;0;"Apaan. PS4 cuma 4,5 juta. Itu berapa yang dia ancurin";;;;"1088021731048976384";https://twitter.com/Lqrqs/status/1088021731048976384
Lqrqs;2019-01-23 17:23;0;0;"Emang maksud hashtag nya tu gosip yg beredar di 90an? Kirain gosip yg disebar orang2 yg lahir 90an...";;;;"1088019335077982209";https://twitter.com/Lqrqs/status/1088019335077982209
Lqrqs;2019-01-23 14:12;0;0;"Bikin thread mz";;;;"1087971430682243073";https://twitter.com/Lqrqs/status/1087971430682243073
Lqrqs;2019-01-23 14:12;0;0;"this is straight up harrassment. I can't imagine her trauma";;;;"1087971250486562816";https://twitter.com/Lqrqs/status/1087971250486562816
Lqrqs;2019-01-23 13:44;0;0;"@cantiksitta";;@cantiksitta;;"1087964199840559105";https://twitter.com/Lqrqs/status/1087964199840559105
Lqrqs;2019-01-23 13:27;0;0;"Banget";;;;"1087960111820218368";https://twitter.com/Lqrqs/status/1087960111820218368
Lqrqs;2019-01-23 12:48;0;1;"6 https:// twitter.com/SortaBad/statu s/1087943163057180673 …";;;;"1087950092991107072";https://twitter.com/Lqrqs/status/1087950092991107072
Lqrqs;2019-01-23 12:32;0;0;"Aku nonton ni, dia cerita di videonya Raditya Dika katanya anjingnya udah seminggu murung... dibawa ke dokter tapi ternyata sehat. Kata pembantunya, kangen kang sule. Sule tengokin, terus tbtb ceria. Besoknya mati";;;;"1087946074239758336";https://twitter.com/Lqrqs/status/1087946074239758336
Lqrqs;2019-01-23 10:51;0;0;"Belum pernah denger soalnya, kepow";;;;"1087920619176542208";https://twitter.com/Lqrqs/status/1087920619176542208
Lqrqs;2019-01-23 10:48;0;0;"pic.twitter.com/WpmOc2v8YD";;;;"1087919964135350274";https://twitter.com/Lqrqs/status/1087919964135350274
Lqrqs;2019-01-23 10:41;0;0;"Aku pernah baca itu tergantung jenis kulit juga. Ada kan tuh orang yang mandi pagi, siang kulitnya masih bau sabun???";;;;"1087918315459072001";https://twitter.com/Lqrqs/status/1087918315459072001
Lqrqs;2019-01-23 10:35;0;0;"Jangan siksa kami";;;;"1087916801877364736";https://twitter.com/Lqrqs/status/1087916801877364736
Lqrqs;2019-01-23 10:22;0;0;"Main Evoland, Kak";;;;"1087913539195396098";https://twitter.com/Lqrqs/status/1087913539195396098
Lqrqs;2019-01-23 10:20;0;0;"I don't see why that's an exception... emang kalo dalam negeri kenapa? ._.";;;;"1087912902676250624";https://twitter.com/Lqrqs/status/1087912902676250624
Lqrqs;2019-01-23 09:42;1;1;"I teared up a bit... https:// twitter.com/chicohakim/sta tus/1087701552616226816 …";;;;"1087903397112471553";https://twitter.com/Lqrqs/status/1087903397112471553
Lqrqs;2019-01-23 09:40;0;0;"Alias tidak mau sebarisan dengan yang "Apa? [insert a famous indie band here] bagus? Ah lu pasti belum pernah denger rex ora-";;;;"1087902791316566017";https://twitter.com/Lqrqs/status/1087902791316566017
Lqrqs;2019-01-23 09:23;3;4;"Kata guru SMP-ku, boleh kredit kalo barangnya dipakai untuk menghasilkan uang lagi... kalo buat beli handphone, jangan.";;;;"1087898590716936192";https://twitter.com/Lqrqs/status/1087898590716936192
Lqrqs;2019-01-23 09:20;3;1;"Malu mau admit rex orange county bagus. Ga sengaja keputer karena Sunflower-nya Spiderman. Next-nya ROC.";;;;"1087897812216438784";https://twitter.com/Lqrqs/status/1087897812216438784
Lqrqs;2019-01-22 23:24;0;0;"Coba gimana";;;;"1087747796399050752";https://twitter.com/Lqrqs/status/1087747796399050752
Lqrqs;2019-01-22 22:53;0;0;"Ditusuk dari belakang terus dipanas-panasin";;;;"1087740024622276610";https://twitter.com/Lqrqs/status/1087740024622276610
Lqrqs;2019-01-22 22:49;0;0;"Duren juga... apaan anjir jadi es krim, dodol, biskuit hhhh";;;;"1087739020379967494";https://twitter.com/Lqrqs/status/1087739020379967494
Lqrqs;2019-01-22 22:44;0;3;"Aneh bat dulu temen-temenku pada yakin banget... jd aku ikut percaya Untung ga ikut-ikutan beli tas/tempat pensil minmie";;;;"1087737817063661569";https://twitter.com/Lqrqs/status/1087737817063661569
Lqrqs;2019-01-22 22:41;1;1;"Minmie dulu dibunuh sama suaminya. Lidahnya dijepit di pintu Lawang Sewu, makanya menjulur terus. #Gosip90an pic.twitter.com/zMLi85xaek";;;#Gosip90an;"1087737024423972864";https://twitter.com/Lqrqs/status/1087737024423972864
Lqrqs;2019-01-22 22:35;0;0;"Dulu pas live in di Pelabuhan Ratu, ada kelompok yang dapet rumah sangat sederhana. Toiletnya berupa bak pasir, kalo pup cuma dikubur. https:// twitter.com/spectatorindex /status/1087719032277647362 …";;;;"1087735628412973057";https://twitter.com/Lqrqs/status/1087735628412973057
Lqrqs;2019-01-22 22:22;1;1;"Tadi aku makan Bakmi GM cuma 20rb pake DANA https:// twitter.com/altairquaria/s tatus/1087699983149584384 …";;;;"1087732164047896577";https://twitter.com/Lqrqs/status/1087732164047896577
Lqrqs;2019-01-22 22:08;0;0;"Kamu reply 2 orang tapi akunnya dikunci";;;;"1087728648914903040";https://twitter.com/Lqrqs/status/1087728648914903040
Lqrqs;2019-01-22 21:53;0;0;"Iya, makasih ya. Tadi udah nanyain, diliatin rekamannya juga. Turned out I wasn't the first to worry";;;;"1087724882547347456";https://twitter.com/Lqrqs/status/1087724882547347456
Lqrqs;2019-01-22 20:51;0;0;"Oo kirain kaya temenku, gara-gara lahirnya jam tiga pagi haha...";;;;"1087709295171399681";https://twitter.com/Lqrqs/status/1087709295171399681
Lqrqs;2019-01-22 20:14;2;0;"Di timeline Facebook-ku nasionalis disamakan dengan kaum Quraisy yang ngajak rasul untuk "Tahun ini kamu sembah tuhanku, tahun depan akan kusembah tuhanmu." Terus di akhir postingan bilang "Inilah inti dari Bhinneka Tunggal Ika. Jangan tertipu." Hadeeeechhhh";;;;"1087699937414926337";https://twitter.com/Lqrqs/status/1087699937414926337
Lqrqs;2019-01-22 19:19;0;0;"Emang pagit apaan sih sil";;;;"1087686297542549504";https://twitter.com/Lqrqs/status/1087686297542549504
Lqrqs;2019-01-22 19:19;0;0;"I'd lose my shit kalo sekali lagi aku liat plesetan manajemen cold brew";;;;"1087686184644431879";https://twitter.com/Lqrqs/status/1087686184644431879
Lqrqs;2019-01-22 18:49;7;1;"Generasi gampang ilfeel";;;;"1087678709459349504";https://twitter.com/Lqrqs/status/1087678709459349504
Lqrqs;2019-01-22 16:15;1;1;"Rasa-rasanya aku telah keliru memilih kamu sebagai kekasihku- https:// twitter.com/aldee_1003/sta tus/1087528303169175552 …";;;;"1087639778227412993";https://twitter.com/Lqrqs/status/1087639778227412993
Lqrqs;2019-01-22 15:00;0;0;"Perlu ngomong ke seseorang yang in charge gak ya?";;;;"1087621034075811841";https://twitter.com/Lqrqs/status/1087621034075811841
Lqrqs;2019-01-22 14:58;0;0;"Nugi, kemarin aku di KRL liat orang muirip kamuu. Udah kudeketin, mau kusapa... Eh bukan";;;;"1087620386110332928";https://twitter.com/Lqrqs/status/1087620386110332928
Lqrqs;2019-01-22 14:49;9;2;"Aku lagi di suatu tempat percetakan 24 jam di Margonda dan numpang ke toilet. Selesai 'urusan', aku lihat atas dan ada CCTV di luar kamar mandi. Ini fotonya. Is there a chance that I was in the camera's viewing range? pic.twitter.com/RfR6PTWts0";;;;"1087618328711946242";https://twitter.com/Lqrqs/status/1087618328711946242
Lqrqs;2019-01-22 14:32;0;0;"Misery is the best muse... or as I'd like to call it... (wait for it) Musery";;;;"1087613913988980736";https://twitter.com/Lqrqs/status/1087613913988980736
Lqrqs;2019-01-22 14:27;0;0;"Ya Allah";;;;"1087612660521127936";https://twitter.com/Lqrqs/status/1087612660521127936
Lqrqs;2019-01-22 14:24;0;0;"Oooh... Apa lagi diare dan pneumonia itu katanya short term effect dr nggak ASI-E ya. Langsung kerasa dan terukur biayanya";;;;"1087612017320505344";https://twitter.com/Lqrqs/status/1087612017320505344
Lqrqs;2019-01-22 13:36;0;0;"Kenapa milihnya diarrhea dan pneumonia, Kak?";;;;"1087599858398023680";https://twitter.com/Lqrqs/status/1087599858398023680
Lqrqs;2019-01-22 13:28;1;1;"I teared up a bit... https:// twitter.com/wwfsg/status/1 086195595298037761 …";;;;"1087597877084344322";https://twitter.com/Lqrqs/status/1087597877084344322
Lqrqs;2019-01-22 13:00;0;2;"She didn't try to hurt anyone's feelings when she said, "Aku cuma takut dia gak bisa nurunin standar hidupnya dan gak bahagia nantinya." She's 100% right.";;;;"1087590797120221184";https://twitter.com/Lqrqs/status/1087590797120221184
Lqrqs;2019-01-22 12:16;2;5;"As a man, what are the struggles of dating a very wealthy woman? by Patrick Ross https://www. quora.com/As-a-man-what- are-the-struggles-of-dating-a-very-wealthy-woman/answer/Patrick-Ross-89?ch=2&share=b5f05fe7&srid=u9M6v … I have a crazy rich girl friend. This is what I see, too. Especially how she thinks of her sister's "working class" boyfriend.";;;;"1087579611003670528";https://twitter.com/Lqrqs/status/1087579611003670528
Lqrqs;2019-01-22 12:02;1;1;"My anak daerah self can't relate https:// twitter.com/askmenfess/sta tus/1087404548031897600 …";;;;"1087576311927697408";https://twitter.com/Lqrqs/status/1087576311927697408
Lqrqs;2019-01-22 11:53;0;0;"PrevRT makes me feel bad for all the fish I've eaten!!!";;;;"1087573881806671872";https://twitter.com/Lqrqs/status/1087573881806671872
Lqrqs;2019-01-22 11:39;1;0;"Rodrick/ Devon Bostick with eyeliner. My forever crush https:// twitter.com/it_meirl_bot/s tatus/1087556249036644353 …";;;;"1087570423473000448";https://twitter.com/Lqrqs/status/1087570423473000448
Lqrqs;2019-01-22 11:21;0;0;"Kalo makannya bareng daging, tomat, selada, saos, sama mayo jadi ga aneh";;;;"1087565797084487680";https://twitter.com/Lqrqs/status/1087565797084487680
Lqrqs;2019-01-21 22:22;0;0;"Aku tadi kepikiran gini, tapi kutahan lho ran";;;;"1087369754464051200";https://twitter.com/Lqrqs/status/1087369754464051200
Lqrqs;2019-01-21 22:08;0;1;"ICJR kirain Iqbaale Coboy Junior";;;;"1087366255831437317";https://twitter.com/Lqrqs/status/1087366255831437317
Lqrqs;2019-01-21 18:38;1;2;"Tiap agustus harusnya dibikin jd chastity month tu";;;;"1087313448340353024";https://twitter.com/Lqrqs/status/1087313448340353024
Lqrqs;2019-01-21 17:35;0;0;"Jauh banget gaaan~";;;;"1087297523197177857";https://twitter.com/Lqrqs/status/1087297523197177857
Lqrqs;2019-01-21 17:32;0;0;"Demana neee";;;;"1087296818331828224";https://twitter.com/Lqrqs/status/1087296818331828224
Lqrqs;2019-01-21 13:28;0;0;"I am not good with melee weapons, that's all.";;;;"1087235385082634242";https://twitter.com/Lqrqs/status/1087235385082634242
Lqrqs;2019-01-21 13:27;0;1;"*dheg* https:// twitter.com/hipstermaid/st atus/1086882009870299137 …";;;;"1087235306443616256";https://twitter.com/Lqrqs/status/1087235306443616256
Lqrqs;2019-01-21 12:56;0;0;"Knp Prabs ga bisa maju lagi?";;;;"1087227502013992960";https://twitter.com/Lqrqs/status/1087227502013992960
Lqrqs;2019-01-21 12:45;0;1;"Summer vibe banget nee";;;;"1087224570703040512";https://twitter.com/Lqrqs/status/1087224570703040512
Lqrqs;2019-01-21 11:52;0;0;"Anjir JessNoLimit pedofil pic.twitter.com/MlpQZ5uyAC";;;;"1087211324617052160";https://twitter.com/Lqrqs/status/1087211324617052160
Lqrqs;2019-01-21 11:03;0;0;"Kaya ga biasa di-mansplain aja";;;;"1087198975898210304";https://twitter.com/Lqrqs/status/1087198975898210304
Lqrqs;2019-01-21 10:12;0;0;"Did novemberdad tweet this";;;;"1087186025271590912";https://twitter.com/Lqrqs/status/1087186025271590912
Lqrqs;2019-01-21 09:33;0;0;"Iya. Sempoa kan latihannya berulang-ulaaang terus sampe lama-lama hafal.";;;;"1087176394587557888";https://twitter.com/Lqrqs/status/1087176394587557888
Lqrqs;2019-01-21 09:26;0;0;"Sempoa";;;;"1087174446375301128";https://twitter.com/Lqrqs/status/1087174446375301128
Lqrqs;2019-01-21 09:22;0;0;"8 and 6 laaa. Baru ngeh deh, kirain caraku ya cara yang default";;;;"1087173559447805952";https://twitter.com/Lqrqs/status/1087173559447805952
Lqrqs;2019-01-21 02:24;0;1;"https://www. google.com/amp/s/amp.redd it.com/r/Poetry/comments/6gjh08/general_he_visits_my_town_once_a_year_by_amir/ …";;;;"1087068423933181952";https://twitter.com/Lqrqs/status/1087068423933181952
Lqrqs;2019-01-20 14:00;0;0;"Semoga ga ada orang kurang kerjaan begini lagi pic.twitter.com/9hL6mnDCcO";;;;"1086881063350071297";https://twitter.com/Lqrqs/status/1086881063350071297
Lqrqs;2019-01-20 13:59;0;0;"Si riska amalia itu udah suspended yhaaaaaa";;;;"1086880771472732161";https://twitter.com/Lqrqs/status/1086880771472732161
Lqrqs;2019-01-20 13:54;0;2;"Mimpi makan se'i :((";;;;"1086879703342841857";https://twitter.com/Lqrqs/status/1086879703342841857
Lqrqs;2019-01-20 00:12;0;0;"Gofood dkt humz~~";;;;"1086672669221675010";https://twitter.com/Lqrqs/status/1086672669221675010
Lqrqs;2019-01-19 23:58;0;0;"Ih jangan gitu!";;;;"1086669284644839425";https://twitter.com/Lqrqs/status/1086669284644839425
Lqrqs;2019-01-19 23:54;0;1;"Beli es duren 15 ribu kirain bakal zonkkk. Ternyata enak, durennya gede banget TT~TT";;;;"1086668271619735552";https://twitter.com/Lqrqs/status/1086668271619735552
Lqrqs;2019-01-19 23:16;0;1;"Is this an euphemism for yesterday's presidential debate? (i.e. "Korupsi nggak seberapa") https:// twitter.com/SoniaEryka/sta tus/1085926935807442944 …";;;;"1086658616441024518";https://twitter.com/Lqrqs/status/1086658616441024518
Lqrqs;2019-01-19 22:26;0;0;"Uwu";;;;"1086646133185597440";https://twitter.com/Lqrqs/status/1086646133185597440
Lqrqs;2019-01-19 22:25;2;4;"Tp ingat kalo pun mau golput harus tetap datang ke TPS yha ~";;;;"1086645859972898816";https://twitter.com/Lqrqs/status/1086645859972898816
Lqrqs;2019-01-19 22:15;0;0;"";;;;"1086643251837206529";https://twitter.com/Lqrqs/status/1086643251837206529
Lqrqs;2019-01-19 20:34;0;0;"Ooo yg sampe ngasih tau versi OS gt ya. Thank you penjelasan dan link firefox-nya";;;;"1086617889728167936";https://twitter.com/Lqrqs/status/1086617889728167936
Lqrqs;2019-01-19 19:59;0;0;"Trackers tu apa? Tp kalo halaman kan bisa edit link jadi page=all biar ga klik2 terus";;;;"1086609023892213760";https://twitter.com/Lqrqs/status/1086609023892213760
Lqrqs;2019-01-19 19:48;0;0;"Ga ngerti. Summon @shandya dan @anima https:// twitter.com/kangmasai/stat us/1086604639145992193 …";;@shandya @anima;;"1086606267987025920";https://twitter.com/Lqrqs/status/1086606267987025920
Lqrqs;2019-01-19 19:46;0;0;"Hotdog kentang tau hotang tuu";;;;"1086605899660111875";https://twitter.com/Lqrqs/status/1086605899660111875
Lqrqs;2019-01-19 19:13;0;0;"Admin Aldo dan admin Reza kelimpungan, akhirnya cuma jawab pake emot :) https:// twitter.com/smartfrencare/ status/1086581840868184066 …";;;;"1086597542203150337";https://twitter.com/Lqrqs/status/1086597542203150337
Lqrqs;2019-01-19 17:18;0;0;"Lagi di carls jr";;;;"1086568488842346496";https://twitter.com/Lqrqs/status/1086568488842346496
Lqrqs;2019-01-19 17:14;0;0;"Aku dah seminggu pengen mcd tp ga jadi2 :(";;;;"1086567502312685568";https://twitter.com/Lqrqs/status/1086567502312685568
Lqrqs;2019-01-19 17:12;0;0;"Nanti ceritain yah";;;;"1086566951709663232";https://twitter.com/Lqrqs/status/1086566951709663232
Lqrqs;2019-01-19 16:03;1;0;"Iya, mb iren, makanya minta https:// twitter.com/Lqrqs/status/1 027868916821897216 …";;;;"1086549625517953024";https://twitter.com/Lqrqs/status/1086549625517953024
Lqrqs;2019-01-19 15:58;0;0;"@HaloBCA ayo mana fitur buat top up flazz di m-bca";;@HaloBCA;;"1086548350139195393";https://twitter.com/Lqrqs/status/1086548350139195393
Lqrqs;2019-01-19 12:54;8;4;""Maaf, kamu gak cukup spark joy buat aku."";;;;"1086502194369576963";https://twitter.com/Lqrqs/status/1086502194369576963
Lqrqs;2019-01-19 12:53;0;0;"";;;;"1086501947484471297";https://twitter.com/Lqrqs/status/1086501947484471297
Lqrqs;2019-01-19 12:47;0;1;"Challenge me on Tahu Tempe pic.twitter.com/MqVtbWiBtv";;;;"1086500348267622401";https://twitter.com/Lqrqs/status/1086500348267622401
Lqrqs;2019-01-18 21:38;0;0;"Ke counter aja~~~";;;;"1086271709026562048";https://twitter.com/Lqrqs/status/1086271709026562048
Lqrqs;2019-01-18 21:32;0;0;"Aku jg baru bikin ni~ karena dapet kartu flazz warna ijo muda lucuw. Dapet pouch makeup jg";;;;"1086270209223053314";https://twitter.com/Lqrqs/status/1086270209223053314
Lqrqs;2019-01-18 21:31;0;1;"O MY GOD Look at this mess https:// twitter.com/jermracela/sta tus/1086159090592575488 …";;;;"1086269811695378432";https://twitter.com/Lqrqs/status/1086269811695378432
Lqrqs;2019-01-18 21:30;0;0;"Kalo member di watson, bulan ini promonya lagi buy 1 get 1 bioderma";;;;"1086269521969573894";https://twitter.com/Lqrqs/status/1086269521969573894
Lqrqs;2019-01-18 21:28;3;5;"Bagus. Enjoyable. But did not leave a strong impression after we left the studio. https:// twitter.com/newsplatter/st atus/1086267520363819009 …";;;;"1086269207623262210";https://twitter.com/Lqrqs/status/1086269207623262210
Lqrqs;2019-01-18 21:23;3;6;"Girls going into a toxic relationship: https:// twitter.com/juliamacfarlan e/status/1086250994021867522 …";;;;"1086267877043273730";https://twitter.com/Lqrqs/status/1086267877043273730
Lqrqs;2019-01-18 21:16;0;1;"AND WHY DOES THE OPPOSITION APPLAUDS JOKOWI FOR DOING THIS??? HHHHH Sebel banget tadi liat ABB lagi ngunyah kacang di Kompas https:// twitter.com/HayatIndriyatn o/status/1086243540345081856 …";;;;"1086266116098351104";https://twitter.com/Lqrqs/status/1086266116098351104
Lqrqs;2019-01-18 21:10;0;0;"Ada film baru, promosinya norak norak. Jayus pol.";;;;"1086264471922794502";https://twitter.com/Lqrqs/status/1086264471922794502
Lqrqs;2019-01-18 21:08;0;0;"Maaci ♡";;;;"1086264013321695232";https://twitter.com/Lqrqs/status/1086264013321695232
Lqrqs;2019-01-18 20:52;0;1;"How do I mute a hashtag?";;;;"1086260076715728896";https://twitter.com/Lqrqs/status/1086260076715728896
Lqrqs;2019-01-18 19:05;0;0;"Hadee kalo ini mah namanya menghukum aq juga~~";;;;"1086233092832948231";https://twitter.com/Lqrqs/status/1086233092832948231
Lqrqs;2019-01-18 19:04;0;1;"This is it. The most effective cough syrup is Oroxin. Really knocks me off and should be taken 4x a day. Kinda dehydrating, but very effective.";;;;"1086232870689984512";https://twitter.com/Lqrqs/status/1086232870689984512
Lqrqs;2019-01-18 15:18;0;0;"Romo-romo > olilet";;;;"1086176001430716416";https://twitter.com/Lqrqs/status/1086176001430716416
Lqrqs;2019-01-18 15:12;0;0;"Kaya jualan roti tapi alergi gluten";;;;"1086174456114864128";https://twitter.com/Lqrqs/status/1086174456114864128
Lqrqs;2019-01-18 15:10;0;0;"Tolong ni ada yang marahin bg faril dong, aku cape";;;;"1086174089402769408";https://twitter.com/Lqrqs/status/1086174089402769408
Lqrqs;2019-01-18 15:06;0;0;"Keren banget ni olilet. Tattoo artist tp tattoo-free";;;;"1086173080458674176";https://twitter.com/Lqrqs/status/1086173080458674176
Lqrqs;2019-01-18 14:55;0;0;"33 laachh";;;;"1086170204814532608";https://twitter.com/Lqrqs/status/1086170204814532608
Lqrqs;2019-01-18 14:49;0;0;"That's greed";;;;"1086168788754522112";https://twitter.com/Lqrqs/status/1086168788754522112
Lqrqs;2019-01-17 22:17;1;4;"Potongan diktatooooor";;;;"1085919166492696576";https://twitter.com/Lqrqs/status/1085919166492696576
Lqrqs;2019-01-17 21:22;0;0;"Tapi bukannya zaman ahok, walaupun anggaran diperketat, tapi jg gaji dinaikkin ya?";;;;"1085905320856018944";https://twitter.com/Lqrqs/status/1085905320856018944
Lqrqs;2019-01-17 21:10;1;1;"Cuma kan kita cari wapres ya, bukan cari model. Tapi San-";;;;"1085902244749299712";https://twitter.com/Lqrqs/status/1085902244749299712
Lqrqs;2019-01-17 21:05;37;16;"See? Random names. The story isn't even correct. Link berita: https:// twitter.com/AyoJo_Official /status/1085899454807302145 …";;;;"1085901023045009409";https://twitter.com/Lqrqs/status/1085901023045009409
Lqrqs;2019-01-17 20:59;0;0;"Ngakak aq";;;;"1085899288931008512";https://twitter.com/Lqrqs/status/1085899288931008512
Lqrqs;2019-01-17 20:51;0;0;"Throwing random names + random kampung names.";;;;"1085897477394329601";https://twitter.com/Lqrqs/status/1085897477394329601
Lqrqs;2019-01-17 20:49;2;2;"Sandi dari jaman dia debat pilgub, andalannya case-case spesifik yang gak tau bener apa enggak.";;;;"1085896856389865474";https://twitter.com/Lqrqs/status/1085896856389865474
Lqrqs;2019-01-17 20:46;0;1;"Yang paling bagus saja gambarnya";;;;"1085896040224456704";https://twitter.com/Lqrqs/status/1085896040224456704
Lqrqs;2019-01-17 20:42;9;3;"Prabowo's accent is so Soeharto-esque. ((Keun))";;;;"1085895167326879744";https://twitter.com/Lqrqs/status/1085895167326879744
Lqrqs;2019-01-17 20:41;1;2;""Ya... saya mendukong."";;;;"1085894923524530176";https://twitter.com/Lqrqs/status/1085894923524530176
Lqrqs;2019-01-17 20:40;0;2;"Ignorant";;;;"1085894521202733056";https://twitter.com/Lqrqs/status/1085894521202733056
Lqrqs;2019-01-17 20:31;273;194;"Ga ada itu swing voter. Semua sudah ditentukan ketika dia pilih nonton di TV ONE atau Metro TV.";;;;"1085892297772883969";https://twitter.com/Lqrqs/status/1085892297772883969
Lqrqs;2019-01-17 20:22;0;0;"Kapan ya enaknya chill dimulai? Pas babak 3 pertanyaan terbuka kali ya";;;;"1085890209076600834";https://twitter.com/Lqrqs/status/1085890209076600834
Lqrqs;2019-01-17 20:16;0;1;"Jokowi abis cukur hahaha buang sial ya";;;;"1085888681708154881";https://twitter.com/Lqrqs/status/1085888681708154881
Lqrqs;2019-01-17 20:13;26;15;"Debat capres and chill";;;;"1085887897033560064";https://twitter.com/Lqrqs/status/1085887897033560064
Lqrqs;2019-01-17 18:51;0;1;"That excalated quickly";;;;"1085867115276423168";https://twitter.com/Lqrqs/status/1085867115276423168
Lqrqs;2019-01-17 16:54;0;2;"LINE-ku pic.twitter.com/6Br5NwaCfi";;;;"1085837721636036610";https://twitter.com/Lqrqs/status/1085837721636036610
Lqrqs;2019-01-17 16:51;0;0;"Ooo aku kira kukunya anjing tu ga tajem";;;;"1085836977818132480";https://twitter.com/Lqrqs/status/1085836977818132480
Lqrqs;2019-01-17 15:20;0;0;"Yes. Yg pink isi 3. Yg biru isi 3+1. Jd murah biru kemana2";;;;"1085814101341724672";https://twitter.com/Lqrqs/status/1085814101341724672
Lqrqs;2019-01-17 15:16;0;0;"Mahalan yang pink sis. Akubpake yang biru. The aloe strip is also thicker di yang biru";;;;"1085813000945070080";https://twitter.com/Lqrqs/status/1085813000945070080
Lqrqs;2019-01-17 12:51;17;14;"pic.twitter.com/4ozqmSltaS";;;;"1085776633745690624";https://twitter.com/Lqrqs/status/1085776633745690624
Lqrqs;2019-01-17 12:04;1;0;"#TIL ada sunnah sekufu. Sama harta, sama rupawan, sama usia. https:// twitter.com/drlrst/status/ 1085725741038198784 …";;;#TIL;"1085764701277962240";https://twitter.com/Lqrqs/status/1085764701277962240
Lqrqs;2019-01-17 11:59;40;28;"That "Lihat sini kalau lagi dikasih tau." is 100% me scolding my cat.";;;;"1085763508040388614";https://twitter.com/Lqrqs/status/1085763508040388614
Lqrqs;2019-01-17 10:52;2;1;"Alias protecting the fragile http:// m.sc .l.n.ty";;;;"1085746769055473664";https://twitter.com/Lqrqs/status/1085746769055473664
Lqrqs;2019-01-17 10:02;0;0;"Ga percaya takhayul karena kemaren gak sengaja pake baju kebalik tapi malah kehilangan uang dari kantong jaket >.<";;;;"1085734065087557632";https://twitter.com/Lqrqs/status/1085734065087557632
