username;date;retweets;favorites;text;geo;mentions;hashtags;id;permalink
Lqrqs;2019-01-11 11:46;0;0;"Udah brp tahun ya pengen Blenger Burger, tapi ga jadi-jadi https:// twitter.com/anomdanas/stat us/1083566019057078272 …";;;;"1083585999240814592";https://twitter.com/Lqrqs/status/1083585999240814592
Lqrqs;2019-01-11 10:42;1;0;"Knp sih dede dede umur seginian pada seneng banget catfishing https:// twitter.com/k3ntangmekdi/s tatus/1083448162759540736 …";;;;"1083569928563638272";https://twitter.com/Lqrqs/status/1083569928563638272
Lqrqs;2019-01-11 10:27;0;0;"Tul tu mb, marahin aja ni";;;;"1083566018293690368";https://twitter.com/Lqrqs/status/1083566018293690368
Lqrqs;2019-01-11 09:41;0;0;"And take the first born away from her. 9 bln hamil ngapaen aja ga disapih";;;;"1083554348385193986";https://twitter.com/Lqrqs/status/1083554348385193986
Lqrqs;2019-01-11 09:29;0;0;"Inget gak sih thread yg tentang bayi umur 19 minggu meninggal karena disuapin pisang sama neneknya? Ibunya gak bisa apa-apa karena mertuanya itu maksa.";;;;"1083551467011624960";https://twitter.com/Lqrqs/status/1083551467011624960
Lqrqs;2019-01-11 09:22;0;0;"Why do those dedek dedek bloon always believe in extravagant stories sih? Harvard, mualaf, Boston, tp ke Jkt jualan followers. Apa karena dasarnya mereka emang halu, jadi disodorin cerita halu mereka juga jadi percaya-percaya aja?";;;;"1083549722055340032";https://twitter.com/Lqrqs/status/1083549722055340032
Lqrqs;2019-01-11 09:17;21;7;"Early marriage + not enough proper education = ibu-ibu muda bloon https:// twitter.com/kyeomdongie/st atus/1082836298539266048 …";;;;"1083548408361582592";https://twitter.com/Lqrqs/status/1083548408361582592
Lqrqs;2019-01-10 23:17;0;0;"https:// twitter.com/febrymaulana/s tatus/1083368451710713857 …";;;;"1083397354403749889";https://twitter.com/Lqrqs/status/1083397354403749889
Lqrqs;2019-01-10 21:11;0;0;"Setengah hari, gan~";;;;"1083365627518013440";https://twitter.com/Lqrqs/status/1083365627518013440
Lqrqs;2019-01-10 21:03;3;1;"That's uncanny Snoop dogg vs Snoop Catt pic.twitter.com/dAPxtkGEKA";;;;"1083363628978335747";https://twitter.com/Lqrqs/status/1083363628978335747
Lqrqs;2019-01-10 20:45;0;0;"Haha silly you. That's Nelson Mandela";;;;"1083359112916652032";https://twitter.com/Lqrqs/status/1083359112916652032
Lqrqs;2019-01-10 19:21;0;0;"Despite your reputation, I'm rather surprised this tweet actually comes from you";;;;"1083338091266371584";https://twitter.com/Lqrqs/status/1083338091266371584
Lqrqs;2019-01-10 19:19;0;0;"Does this shirt make you go doki doki desuka? https:// twitter.com/ZackDavisson/s tatus/1082938420924624899 …";;;;"1083337620560596992";https://twitter.com/Lqrqs/status/1083337620560596992
Lqrqs;2019-01-10 19:09;0;6;"Maaf aku ga cukup awewe Bandung buat kamu";;;;"1083335122269523969";https://twitter.com/Lqrqs/status/1083335122269523969
Lqrqs;2019-01-10 18:50;0;0;"That's relieving";;;;"1083330327714525186";https://twitter.com/Lqrqs/status/1083330327714525186
Lqrqs;2019-01-10 18:46;0;0;"What disposables ._.";;;;"1083329110674292736";https://twitter.com/Lqrqs/status/1083329110674292736
Lqrqs;2019-01-10 18:43;3;0;"The truth is I've seen all the memes you sent me.";;;;"1083328524117655552";https://twitter.com/Lqrqs/status/1083328524117655552
Lqrqs;2019-01-10 18:04;0;0;"Ini Mbak Rismakill yang dulu jualannya di Facebook yaa?";;;;"1083318658263179267";https://twitter.com/Lqrqs/status/1083318658263179267
Lqrqs;2019-01-10 15:50;0;1;"Adanya a shoulder to cry on. Sini, sini~ pic.twitter.com/H5JgjmFziz";;;;"1083284965972893696";https://twitter.com/Lqrqs/status/1083284965972893696
Lqrqs;2019-01-10 15:23;4;2;"I suddenly remember that one time my teacher called me out in front of the class because I couldn't remember the word "poor" and ended up writing "povertitious".";;;;"1083278249470222336";https://twitter.com/Lqrqs/status/1083278249470222336
Lqrqs;2019-01-10 12:46;3;1;"Heterophobia pic.twitter.com/6SvBmyo5OK";;;;"1083238743887106049";https://twitter.com/Lqrqs/status/1083238743887106049
Lqrqs;2019-01-10 11:56;0;0;"It is NOT advisable to chug your cup of coffee. #shaky #jittery #anxious";;;#shaky #jittery #anxious;"1083226034382618625";https://twitter.com/Lqrqs/status/1083226034382618625
Lqrqs;2019-01-10 11:39;1;2;"Pasti malu. Soalnya salah grammar. https:// twitter.com/menghanyurkan/ status/1082198123710017537 …";;;;"1083221837872390145";https://twitter.com/Lqrqs/status/1083221837872390145
Lqrqs;2019-01-10 10:19;4;1;"I hope the likes you're getting on the internet are worth my suffering, Andrew pic.twitter.com/KY1xfGO949";;;;"1083201660627775488";https://twitter.com/Lqrqs/status/1083201660627775488
Lqrqs;2019-01-10 10:17;1;0;"Are you just going to watch!? pic.twitter.com/uhdHeeN0A4";;;;"1083201011253096448";https://twitter.com/Lqrqs/status/1083201011253096448
Lqrqs;2019-01-10 10:10;0;0;"SHAREit ini berguna banget tapi push notifications-nya malesin parah. Full of sexual innuendos and cheap clickbaits.";;;;"1083199261695664129";https://twitter.com/Lqrqs/status/1083199261695664129
Lqrqs;2019-01-10 10:06;0;0;"Dulu anak SMA bilangnya "benteng"";;;;"1083198397341872130";https://twitter.com/Lqrqs/status/1083198397341872130
Lqrqs;2019-01-10 10:01;0;0;"I STILL SEE YOUR SHADOWS IN MY ROOM https:// twitter.com/askmenfess/sta tus/1083176662206824449 …";;;;"1083197213944143872";https://twitter.com/Lqrqs/status/1083197213944143872
Lqrqs;2019-01-10 08:54;0;0;"SHOPEE GRENDPRIZE!! Selamat! anda adalah pemenang JUTAWAN SHOPEE mendapatkan hadiah Rp.125jt dgn kode ID: ( AAQ2099 ) Info hadiah klik: http://www. hasindonesia.tk";;;;"1083180231924506624";https://twitter.com/Lqrqs/status/1083180231924506624
Lqrqs;2019-01-10 07:28;0;0;"TOO LATE https:// twitter.com/softsadsatan/s tatus/1082797399469420546 …";;;;"1083158643426582528";https://twitter.com/Lqrqs/status/1083158643426582528
Lqrqs;2019-01-10 07:08;1;0;"Exactly. You can't jail people just because you are offended";;;;"1083153550945923073";https://twitter.com/Lqrqs/status/1083153550945923073
Lqrqs;2019-01-09 23:35;0;0;"Kaya poodle versi kucing haha Jd rada minder gt sih.. tp sehari jg lgsg biasa lagi. Kaya kita kalo abis potong poni kependekan aja";;;;"1083039519799013381";https://twitter.com/Lqrqs/status/1083039519799013381
Lqrqs;2019-01-09 22:58;0;2;"Kucingku lg pada gundul semua yg satu gimbal yg satu kutuan. Jd buruk rupa tapi ku ttp syg pic.twitter.com/mifPYCQQJE";;;;"1083030166467538944";https://twitter.com/Lqrqs/status/1083030166467538944
Lqrqs;2019-01-09 12:11;0;0;"Gak ngerti teh hehe, aku pake ini seminggu sekali doang (gantian sama yg peach) karena mukaku kering banget ga boleh banyak2 scrub >.<";;;;"1082867468551348224";https://twitter.com/Lqrqs/status/1082867468551348224
Lqrqs;2019-01-09 11:58;0;0;"Setelah purchase kan dapet e-mail... Cocokin tanggal & nominalnya aja";;;;"1082864099128631297";https://twitter.com/Lqrqs/status/1082864099128631297
Lqrqs;2019-01-09 11:55;2;1;"Suka backlash juga... kalo liat sesuatu, suka randomly thinking, "This can be a good murder weapon." Terus mentally nge-list kelemahan dan kelebihannya...";;;;"1082863526702592001";https://twitter.com/Lqrqs/status/1082863526702592001
Lqrqs;2019-01-09 11:52;0;0;"Aqqqq. Tulisannya sih masker. Jd tak usuk-usuk di muka, terus tunggu sebentar. Exfoliating dan moisturizing";;;;"1082862775930482689";https://twitter.com/Lqrqs/status/1082862775930482689
Lqrqs;2019-01-09 02:54;0;0;"I didn't drink enough water and had too much coffee. Now my bladder hurts like hell.";;;;"1082727252515639296";https://twitter.com/Lqrqs/status/1082727252515639296
Lqrqs;2019-01-09 02:49;2;3;"Drink water. Do your bladder a favor.";;;;"1082726072775569408";https://twitter.com/Lqrqs/status/1082726072775569408
Lqrqs;2019-01-09 02:03;0;0;"Berarti kalo gak ada daging bisa nih makan nasi sama kecap aja";;;;"1082714415911251968";https://twitter.com/Lqrqs/status/1082714415911251968
Lqrqs;2019-01-09 01:52;0;1;"Kecap itu protein bukan sih, kan kedelai";;;;"1082711613767966720";https://twitter.com/Lqrqs/status/1082711613767966720
Lqrqs;2019-01-09 00:43;0;0;"#TIL kereta ekonomi gerbang restorasinya bentuknya bar. Mejanya kecil, stools only.";;;#TIL;"1082694283717570560";https://twitter.com/Lqrqs/status/1082694283717570560
Lqrqs;2019-01-09 00:05;0;0;"IYAAAAAA banget nget tuinggi lhoo aslinya. Istrinya jg uwu bgt";;;;"1082684769056378880";https://twitter.com/Lqrqs/status/1082684769056378880
Lqrqs;2019-01-08 23:23;2;1;"Dipikir matang-matang kalo kelamaan juga gosong, gan~";;;;"1082674059001778176";https://twitter.com/Lqrqs/status/1082674059001778176
Lqrqs;2019-01-08 23:19;0;0;"Wih hebadddd bisa tidur cuma sebentaar";;;;"1082673261471617025";https://twitter.com/Lqrqs/status/1082673261471617025
Lqrqs;2019-01-08 23:10;1;0;"Kuncinya cuma satu: bangun pagi Bangun siang pikirannya pasti kusut";;;;"1082670788338016256";https://twitter.com/Lqrqs/status/1082670788338016256
Lqrqs;2019-01-08 23:09;0;0;"Mas Kosa kalo pup pasti bawa HP, ga pernah baca2 botol sampo ya";;;;"1082670532711960576";https://twitter.com/Lqrqs/status/1082670532711960576
Lqrqs;2019-01-08 23:08;0;0;"Shampoo yg lgsg dibilas~ Sampoan>bilas>condi> sabunan>bilas";;;;"1082670343775444992";https://twitter.com/Lqrqs/status/1082670343775444992
Lqrqs;2019-01-08 23:05;0;0;"Aq af. Sambil nungguin conditioner ngeresep";;;;"1082669581284462592";https://twitter.com/Lqrqs/status/1082669581284462592
Lqrqs;2019-01-08 22:35;0;0;"Abis liburan ke mana kaakk";;;;"1082662044409757697";https://twitter.com/Lqrqs/status/1082662044409757697
Lqrqs;2019-01-08 19:56;0;0;"It IS trending pic.twitter.com/2FSxxcVxxf";;;;"1082621945508638721";https://twitter.com/Lqrqs/status/1082621945508638721
Lqrqs;2019-01-08 17:55;0;2;"Mukanya pake watermark :((((";;;;"1082591507519963136";https://twitter.com/Lqrqs/status/1082591507519963136
Lqrqs;2019-01-08 17:34;5;5;"Imagine there will come the Earth's doomsday and aliens from neighboring planets just go, "Pictures of Earth being smashed by a massive rock -- it's beautiful." https:// twitter.com/MetroUK/status /1082562607578603520 …";;;;"1082586352019955712";https://twitter.com/Lqrqs/status/1082586352019955712
Lqrqs;2019-01-08 17:01;0;0;"#TIL";;;#TIL;"1082577982697304065";https://twitter.com/Lqrqs/status/1082577982697304065
Lqrqs;2019-01-08 15:54;0;0;"Itu ceplok :(";;;;"1082561293205135361";https://twitter.com/Lqrqs/status/1082561293205135361
Lqrqs;2019-01-08 11:39;1;1;"Neee aku ss in. Namanya Lego lucu bat >.< pic.twitter.com/XekvPdrY4n";;;;"1082497116700794880";https://twitter.com/Lqrqs/status/1082497116700794880
Lqrqs;2019-01-08 11:12;0;0;"Ke IG nya bg~";;;;"1082490319235559426";https://twitter.com/Lqrqs/status/1082490319235559426
Lqrqs;2019-01-08 11:04;0;0;"I, too, have mixed feelings abt this haha";;;;"1082488299199987712";https://twitter.com/Lqrqs/status/1082488299199987712
Lqrqs;2019-01-08 11:03;0;0;"Anies Baswedan punya kucing rescue tripod, dulu katanya korban animal abuse TT~TT";;;;"1082487937059540993";https://twitter.com/Lqrqs/status/1082487937059540993
Lqrqs;2019-01-08 10:45;0;0;""Aku capek nyampur saos tomat sama saos sambel. Bikin species tomat baru ah yg pedes." -scientists, probably https:// twitter.com/kinggary/statu s/1082466677722439680 …";;;;"1082483306153762816";https://twitter.com/Lqrqs/status/1082483306153762816
Lqrqs;2019-01-08 10:00;0;0;"Ya allah gini amat";;;;"1082472141654614016";https://twitter.com/Lqrqs/status/1082472141654614016
Lqrqs;2019-01-08 02:08;0;0;"What a coincidence, I just finished watching this TT__TT https:// twitter.com/everydaylouie/ status/1082349848295161856 …";;;;"1082353248437133313";https://twitter.com/Lqrqs/status/1082353248437133313
Lqrqs;2019-01-08 01:47;0;0;"Inginnya lgsg kiamat sj ya mbnoi, biar meninggal sj semua bersama";;;;"1082347998175055877";https://twitter.com/Lqrqs/status/1082347998175055877
Lqrqs;2019-01-07 23:19;0;0;"Lebih keren Mas GP ah";;;;"1082310850352840704";https://twitter.com/Lqrqs/status/1082310850352840704
Lqrqs;2019-01-07 22:31;0;0;"Editannya jg kurang rapih. Di bawah hemline lengan ibu-ibu itu masih ada barcode nya";;;;"1082298754760245250";https://twitter.com/Lqrqs/status/1082298754760245250
Lqrqs;2019-01-07 22:30;1;0;"Did Zaadit Taqwa tweet this https:// twitter.com/kontol_kabeh/s tatus/1082199578538098688 …";;;;"1082298459577737216";https://twitter.com/Lqrqs/status/1082298459577737216
Lqrqs;2019-01-07 22:07;0;0;"Di Purwokerto 300rb, non subsidi. Di sini emg murah hehe";;;;"1082292740598026246";https://twitter.com/Lqrqs/status/1082292740598026246
Lqrqs;2019-01-07 22:07;0;0;"Throwback to when we first got him https:// twitter.com/Lqrqs/status/1 009818705855836161 …";;;;"1082292534716420096";https://twitter.com/Lqrqs/status/1082292534716420096
Lqrqs;2019-01-07 21:58;0;0;"Fatshaming";;;;"1082290423681273857";https://twitter.com/Lqrqs/status/1082290423681273857
Lqrqs;2019-01-07 21:55;0;0;"Dulu pas maba @nyosafat suka manggil aku kencot :( https:// twitter.com/mojokdotco/sta tus/1082230366012887042 …";;@nyosafat;;"1082289530378407936";https://twitter.com/Lqrqs/status/1082289530378407936
Lqrqs;2019-01-07 21:54;0;1;"Speaking abt steril, Mickey abis steril lho. Steril pagi, sore udah lari-lari. pic.twitter.com/ptDCqWwoce";;;;"1082289298852929541";https://twitter.com/Lqrqs/status/1082289298852929541
Lqrqs;2019-01-07 21:53;3;1;"Razia kucing di Jakarta ini bener2 sebuah pengingat pentingnya steril untuk jaga populasi kucing biar gak berlebihan (dan berujung terlantarnya banyak kucing).";;;;"1082289087476715520";https://twitter.com/Lqrqs/status/1082289087476715520
Lqrqs;2019-01-07 00:31;0;0;"Adekku baru aja td nginstall di handphoneku >.<";;;;"1081966491329646593";https://twitter.com/Lqrqs/status/1081966491329646593
Lqrqs;2019-01-07 00:26;0;0;"Aku becanda :(";;;;"1081965348654469120";https://twitter.com/Lqrqs/status/1081965348654469120
Lqrqs;2019-01-06 23:58;0;0;"Gimme some";;;;"1081958169042010112";https://twitter.com/Lqrqs/status/1081958169042010112
Lqrqs;2019-01-06 23:54;1;0;"What am I after";;;;"1081957262866825217";https://twitter.com/Lqrqs/status/1081957262866825217
Lqrqs;2019-01-06 23:24;0;0;"Maunya http:// cucirca.cu";;;;"1081949678139101185";https://twitter.com/Lqrqs/status/1081949678139101185
Lqrqs;2019-01-06 23:21;0;0;"Aku jg masuk story-nya >.< tp ya gapapa, ga rugi apa2 haha baik orangnya, trans gt sempet bingung mau mbak/mas. Tak panggil nama aja, mbuh";;;;"1081948798933299200";https://twitter.com/Lqrqs/status/1081948798933299200
Lqrqs;2019-01-06 23:13;0;0;"Padahal kata Devi kamu suka ke Dona >.<";;;;"1081946889384189952";https://twitter.com/Lqrqs/status/1081946889384189952
Lqrqs;2019-01-06 23:04;0;0;"Kalo maskernya udh incl cuci catok. Td aku masker + potong";;;;"1081944508567187458";https://twitter.com/Lqrqs/status/1081944508567187458
Lqrqs;2019-01-06 23:01;0;0;"60 kalo sm Dona. Less kalo sama karyawannya~";;;;"1081943750476148737";https://twitter.com/Lqrqs/status/1081943750476148737
Lqrqs;2019-01-06 20:50;0;0;"Don't offend Tubbs, biLLY https:// twitter.com/kittiesbot/sta tus/1081716233957974018 …";;;;"1081910760077283328";https://twitter.com/Lqrqs/status/1081910760077283328
Lqrqs;2019-01-06 20:34;2;0;"I aspire to have this much confidence in 2019 https:// twitter.com/AlannaBennett/ status/1081668089970937862 …";;;;"1081906877552746496";https://twitter.com/Lqrqs/status/1081906877552746496
Lqrqs;2019-01-06 18:15;0;0;"Kalo pun pervert... masa cium2 kerudung sih ._. Atau buat kebanggaan sendiri aja..?";;;;"1081871947871399936";https://twitter.com/Lqrqs/status/1081871947871399936
Lqrqs;2019-01-06 18:15;0;0;"Sekarang sih aku seneng. Besok ga tau :(";;;;"1081871793298624512";https://twitter.com/Lqrqs/status/1081871793298624512
Lqrqs;2019-01-06 18:14;0;0;"Makasih Dani";;;;"1081871716584808449";https://twitter.com/Lqrqs/status/1081871716584808449
Lqrqs;2019-01-06 18:09;0;1;"Tujuannya apa? ._. https:// twitter.com/soshialisasi/s tatus/1081572806033268736 …";;;;"1081870323467735040";https://twitter.com/Lqrqs/status/1081870323467735040
Lqrqs;2019-01-06 17:37;0;10;"I hope I won't regret this >.< pic.twitter.com/xNyWdxziFm";;;;"1081862336585953281";https://twitter.com/Lqrqs/status/1081862336585953281
Lqrqs;2019-01-06 15:58;0;0;"He's the kind that uploads a selfie to a Google review";;;;"1081837509208727552";https://twitter.com/Lqrqs/status/1081837509208727552
Lqrqs;2019-01-06 14:41;0;0;"Blocked";;;;"1081818095138697217";https://twitter.com/Lqrqs/status/1081818095138697217
Lqrqs;2019-01-06 14:40;0;0;"Iya. Pak Jodi namanya";;;;"1081817779320238080";https://twitter.com/Lqrqs/status/1081817779320238080
Lqrqs;2019-01-06 14:32;0;0;"Pas SD guruku bilang teteku gede (I was an early bloomer). Sampe sekarang kalo inget pengen tak bejek2 mulutmu pak";;;;"1081815832060059648";https://twitter.com/Lqrqs/status/1081815832060059648
Lqrqs;2019-01-06 14:15;0;0;"Driving stick with a sprained ankle is not a good idea.";;;;"1081811397191716865";https://twitter.com/Lqrqs/status/1081811397191716865
Lqrqs;2019-01-06 12:19;0;0;"Ada Bintik7 https:// twitter.com/springzero/sta tus/1081302698346057730 …";;;;"1081782319541698560";https://twitter.com/Lqrqs/status/1081782319541698560
Lqrqs;2019-01-06 10:41;0;0;"Shadis also used to bully Eren during his training. He sabotaged his 3D maneuver. Snape also jinxed Harry's broom. But Shadis/Snape did all that to protect Eren/Harry TT~TT";;;;"1081757585248681984";https://twitter.com/Lqrqs/status/1081757585248681984
Lqrqs;2019-01-06 10:38;0;1;"OH!!! And the fact that Eren's former instructor, Keith Shadis, is in love with Eren's (dead) mother. And the way that Eren's eyes remind Shadis of her. It's like Severus Snape and Lily Potter all over again. But this time, Shadis does not hate Grisha Jaeger, he feels inferior.";;;;"1081756758689763333";https://twitter.com/Lqrqs/status/1081756758689763333
Lqrqs;2019-01-05 22:59;0;0;"Sesering apa rumahnya kebanjiran sampe dikasih drain";;;;"1081580907285209089";https://twitter.com/Lqrqs/status/1081580907285209089
Lqrqs;2019-01-05 22:56;0;1;"Tinggal di mana sih? They've got a drain in the bedroom. https:// twitter.com/SpaceCatPics/s tatus/1081349307658366976 …";;;;"1081580175010127872";https://twitter.com/Lqrqs/status/1081580175010127872
Lqrqs;2019-01-05 22:54;0;0;"Pake advance notice minimal 3 bulan gak?";;;;"1081579630102892544";https://twitter.com/Lqrqs/status/1081579630102892544
Lqrqs;2019-01-05 22:37;0;1;"I wasn't wrong pic.twitter.com/I0YvtHlWsD";;;;"1081575328110206981";https://twitter.com/Lqrqs/status/1081575328110206981
Lqrqs;2019-01-05 22:28;0;0;"Ya masa spoiler bg~~~";;;;"1081573040142438400";https://twitter.com/Lqrqs/status/1081573040142438400
Lqrqs;2019-01-05 22:17;0;0;"Anime aja akuuu. Udah keungkap sejarah keluarga Reiss di S3";;;;"1081570286367961089";https://twitter.com/Lqrqs/status/1081570286367961089
Lqrqs;2019-01-05 22:02;3;7;"Kalo dipikir-pikir Harry Potter ni kaya Eren Jaeger. Not the rightful heir but somehow they have a hereditary power. And they get it through evil and dishonest means... (although it's not their fault)";;;;"1081566566108393472";https://twitter.com/Lqrqs/status/1081566566108393472
Lqrqs;2019-01-05 21:07;11;9;"I simply don't want because I know I wouldn't get it Sadar diri is self care~";;;;"1081552660111585280";https://twitter.com/Lqrqs/status/1081552660111585280
Lqrqs;2019-01-05 20:57;1;10;"I learn a new insult it's UNSEASONED";;;;"1081550185845542912";https://twitter.com/Lqrqs/status/1081550185845542912
Lqrqs;2019-01-05 20:22;0;0;"Moh (2)";;;;"1081541416021413890";https://twitter.com/Lqrqs/status/1081541416021413890
Lqrqs;2019-01-05 19:52;0;0;"Ni aku mau marathon di iflix.";;;;"1081533871852666882";https://twitter.com/Lqrqs/status/1081533871852666882
Lqrqs;2019-01-05 19:16;0;1;"Nggak papa lah. Yang penting kotanya islami. https:// twitter.com/arientia/statu s/1081401660109287424 …";;;;"1081524906766946304";https://twitter.com/Lqrqs/status/1081524906766946304
Lqrqs;2019-01-05 19:02;0;0;"Delete";;;;"1081521242987913217";https://twitter.com/Lqrqs/status/1081521242987913217
Lqrqs;2019-01-05 16:08;0;1;"Ada nga neeee yg dr military https:// twitter.com/spectatorindex /status/1081441043097083905 …";;;;"1081477618938011649";https://twitter.com/Lqrqs/status/1081477618938011649
Lqrqs;2019-01-05 12:07;0;0;"Oh iya 4 berarti :3";;;;"1081416916730707968";https://twitter.com/Lqrqs/status/1081416916730707968
Lqrqs;2019-01-05 11:59;0;0;"Kroketnya pic.twitter.com/RJvvcp2G0r";;;;"1081414944325754880";https://twitter.com/Lqrqs/status/1081414944325754880
Lqrqs;2019-01-05 11:51;0;1;"IBU BARUSAN NGOMONG PAKE FERGUSO HADEEEH WHO'S RESPONSIBLE FOR THIS "Ibu bikin kroket, Ferguso."";;;;"1081412975838191616";https://twitter.com/Lqrqs/status/1081412975838191616
Lqrqs;2019-01-05 11:35;0;0;"Anjirlah ternyata yg ninggalin Harry ke keluarga Dursley itu Dumbledore sendiri!!! >.<";;;;"1081408801712947201";https://twitter.com/Lqrqs/status/1081408801712947201
Lqrqs;2019-01-05 11:15;0;0;"I'm afraid to admit that I haven't watched all Harry Potter movies. Cuma yang kedua (chamber of secrets) dan lima (yg ada Sirius dan Lupin-nya).";;;;"1081403795068743680";https://twitter.com/Lqrqs/status/1081403795068743680
Lqrqs;2019-01-05 08:46;0;0;"Sedih banget reply nya gak ada yang jawab Jeruk https:// twitter.com/askmenfess/sta tus/1081264055241723904 …";;;;"1081366378567786496";https://twitter.com/Lqrqs/status/1081366378567786496
Lqrqs;2019-01-05 02:07;0;0;"Kalian ᵐᵒⁿᶜʰ Harus ᵐᵒⁿᶜʰ Coba ᵐᵒⁿᶜʰ ᵐᵒⁿᶜʰ ᵐᵒⁿᶜʰ";;;;"1081265932876402690";https://twitter.com/Lqrqs/status/1081265932876402690
Lqrqs;2019-01-04 23:38;0;0;"My sprained ankle diurut Bapak. Magically lgsg mendingan";;;;"1081228441846837248";https://twitter.com/Lqrqs/status/1081228441846837248
Lqrqs;2019-01-04 22:19;8;5;"Emmm ᵐᵒⁿᶜʰ ᵐᵒⁿᶜʰ Enak banget guys ᵐᵒⁿᶜʰ ₘₒₙ𝒸ₕ ᵐᵒⁿᶜʰ Ga boong mmhhh parah ᵐᵒⁿᶜʰ [Selebgram nge-review makanan]";;;;"1081208513248915456";https://twitter.com/Lqrqs/status/1081208513248915456
Lqrqs;2019-01-04 20:39;0;0;"Seblak bukan nama makanan btw. Tp nama kombinasi bumbu... pernah baca tweetnya siapa gt";;;;"1081183417293668352";https://twitter.com/Lqrqs/status/1081183417293668352
Lqrqs;2019-01-04 20:33;0;0;"No thx~";;;;"1081181895306633216";https://twitter.com/Lqrqs/status/1081181895306633216
Lqrqs;2019-01-04 20:29;0;0;"Biasanya di Youtube ada, bg~";;;;"1081180897917919232";https://twitter.com/Lqrqs/status/1081180897917919232
Lqrqs;2019-01-04 20:28;1;0;"Nasi goreng pake kencur hhhhhhh iya sih Sunda tp gak semua dikencurin juga";;;;"1081180619357343744";https://twitter.com/Lqrqs/status/1081180619357343744
Lqrqs;2019-01-04 20:04;0;0;"Sudah nih, thanks ya";;;;"1081174494700396544";https://twitter.com/Lqrqs/status/1081174494700396544
Lqrqs;2019-01-04 20:04;0;0;"Iya udah DM nih di IG. Thank you";;;;"1081174461250826241";https://twitter.com/Lqrqs/status/1081174461250826241
Lqrqs;2019-01-04 19:22;5;4;"DOES IT STILL BRING YOU JOY!!?? HAS IT SERVED ITS PURPOSE!!??";;;;"1081164061092372482";https://twitter.com/Lqrqs/status/1081164061092372482
Lqrqs;2019-01-04 16:25;3;0;"Kalo tempat servis analog nintendo switch yang drifting di mana ya? Preferably Jakarta/Tangerang. Sudah Google. Sudah cari di Lippo Karawaci dan ITC Fatmawati.";;;;"1081119506745815040";https://twitter.com/Lqrqs/status/1081119506745815040
Lqrqs;2019-01-04 13:10;0;0;"Can't you do something? @jack @TwitterSupport https:// twitter.com/OXlACID/status /1080597895781470208 …";;@jack @TwitterSupport;;"1081070449952342016";https://twitter.com/Lqrqs/status/1081070449952342016
Lqrqs;2019-01-04 11:20;0;0;"Link nya berguna banget! Thanks!";;;;"1081042622787940354";https://twitter.com/Lqrqs/status/1081042622787940354
Lqrqs;2019-01-04 10:51;3;2;"Cara jadi operator crane gimana sih? Pendidikannya apa? Trainingnya apa?";;;;"1081035299654840321";https://twitter.com/Lqrqs/status/1081035299654840321
Lqrqs;2019-01-04 10:06;0;0;"Jangan bikin sedih gitu ah :(";;;;"1081024070412468224";https://twitter.com/Lqrqs/status/1081024070412468224
Lqrqs;2019-01-04 10:03;0;0;"Maksudku sih sushi bar :p kaitenzushi gitu";;;;"1081023352016232448";https://twitter.com/Lqrqs/status/1081023352016232448
Lqrqs;2019-01-04 09:59;0;0;"Duduk di bar kalo hadap-hadapan nanti diusir keluar lho";;;;"1081022162310320128";https://twitter.com/Lqrqs/status/1081022162310320128
Lqrqs;2019-01-04 09:36;2;0;"Face to face: lots of communication dan observation of facial expression. Minimum touching.";;;;"1081016471440900096";https://twitter.com/Lqrqs/status/1081016471440900096
Lqrqs;2019-01-04 09:29;0;1;"the dedication";;;;"1081014638735552512";https://twitter.com/Lqrqs/status/1081014638735552512
Lqrqs;2019-01-04 09:17;0;1;"Raft";;;;"1081011596560805888";https://twitter.com/Lqrqs/status/1081011596560805888
Lqrqs;2019-01-03 21:39;0;1;"BIG CHUNGUS https:// twitter.com/thisisinsider/ status/1080834937350164480 …";;;;"1080835947925712897";https://twitter.com/Lqrqs/status/1080835947925712897
Lqrqs;2019-01-03 20:26;0;0;"Glad someone gets it pic.twitter.com/A14JmfaL79";;;;"1080817694390153216";https://twitter.com/Lqrqs/status/1080817694390153216
Lqrqs;2019-01-03 20:06;0;0;"Is it wise to seek relationship advice to your mom?";;;;"1080812581462265856";https://twitter.com/Lqrqs/status/1080812581462265856
Lqrqs;2019-01-03 19:48;0;0;"Pernah nonton Live Take nya aja. Terus masukin Spotify, ga pernah didenger lagi. MV nya bagus banget";;;;"1080808034929074178";https://twitter.com/Lqrqs/status/1080808034929074178
Lqrqs;2019-01-03 19:41;0;0;"Bagus banget, sesenggukan aku :(";;;;"1080806320549187584";https://twitter.com/Lqrqs/status/1080806320549187584
Lqrqs;2019-01-03 19:03;1;4;"Kalo yg diajarkan orang tuaku... Adam bukan manusia pertama, tp memang kaum Adam yg menerima kitab (Al-Asma) pertama kali... makes sense kalo ternyata Hawa jg bkn istri pertama";;;;"1080796680881037313";https://twitter.com/Lqrqs/status/1080796680881037313
Lqrqs;2019-01-03 14:44;1;1;"Will your mom be sad if she knew you're like this";;;;"1080731699011497984";https://twitter.com/Lqrqs/status/1080731699011497984
