username;date;retweets;favorites;text;geo;mentions;hashtags;id;permalink
Lqrqs;2018-12-24 17:27;0;0;"Emang drummernya udah pasti meninggal?";;;;"1077148872181338114";https://twitter.com/Lqrqs/status/1077148872181338114
Lqrqs;2018-12-24 12:00;414;262;"Mahasiswa Universitas Cendrawasih kalo nge-search kampusnya (Uncen) di Twitter keluarnya bokep semua.";;;;"1077066394716401666";https://twitter.com/Lqrqs/status/1077066394716401666
Lqrqs;2018-12-23 13:36;0;0;"Haha iya kayaknya maksudnya flower itu dulu yg invite aku";;;;"1076728129022906369";https://twitter.com/Lqrqs/status/1076728129022906369
Lqrqs;2018-12-23 13:25;0;0;"Usernameku Laras, yang gambar kucing";;;;"1076725481976688640";https://twitter.com/Lqrqs/status/1076725481976688640
Lqrqs;2018-12-23 13:17;0;4;"Nyi Roro Kidul pic.twitter.com/PmRKkXVCiz";;;;"1076723475727888384";https://twitter.com/Lqrqs/status/1076723475727888384
Lqrqs;2018-12-23 13:11;0;0;"Maju bersama Allah!";;;;"1076722027782782977";https://twitter.com/Lqrqs/status/1076722027782782977
Lqrqs;2018-12-23 12:41;3;1;"Prestige is also rational.";;;;"1076714468766212104";https://twitter.com/Lqrqs/status/1076714468766212104
Lqrqs;2018-12-23 10:15;1;1;"Cita-citaku adalah memborong _toisu_";;;;"1076677554759553024";https://twitter.com/Lqrqs/status/1076677554759553024
Lqrqs;2018-12-23 08:48;8;1;"Amir Khusrow (1253 - 1325) pic.twitter.com/nwgoWpYhlv";;;;"1076655807217856515";https://twitter.com/Lqrqs/status/1076655807217856515
Lqrqs;2018-12-23 03:22;1;0;"I HAD TO GOOGLE IT TO MAKE SURE IT'S NOT FAKE IT'S NOT!!! IT REALLY IS THE EYEBALL!!! https:// twitter.com/41Strange/stat us/1076557545966231552 …";;;;"1076573615380811777";https://twitter.com/Lqrqs/status/1076573615380811777
Lqrqs;2018-12-22 13:07;0;0;"Aku beli ini sale di ace 150";;;;"1076358667320975361";https://twitter.com/Lqrqs/status/1076358667320975361
Lqrqs;2018-12-22 12:38;0;1;"Ibuku pic.twitter.com/Hcbq7GLuUX";;;;"1076351143955943424";https://twitter.com/Lqrqs/status/1076351143955943424
Lqrqs;2018-12-22 11:21;39;18;"Remember all the lies we told our mother. Damn. Aren't we all ungrateful children";;;;"1076331779768778758";https://twitter.com/Lqrqs/status/1076331779768778758
Lqrqs;2018-12-22 11:04;33;8;"Hogwarts sama hog warts artinya beda banget ya. Yang satu sekolah sihir, yang satu kutil babi.";;;;"1076327637478297600";https://twitter.com/Lqrqs/status/1076327637478297600
Lqrqs;2018-12-21 23:55;0;0;"Lho bukannya sudah biasa";;;;"1076159190056394752";https://twitter.com/Lqrqs/status/1076159190056394752
Lqrqs;2018-12-21 23:52;1;1;"HAHAHAHAHHAHAHA BAND APA";;;;"1076158583438340097";https://twitter.com/Lqrqs/status/1076158583438340097
Lqrqs;2018-12-21 23:18;0;0;"Aneh amat -_-";;;;"1076149819901497345";https://twitter.com/Lqrqs/status/1076149819901497345
Lqrqs;2018-12-21 23:16;0;0;"Rani nih emang";;;;"1076149397702926336";https://twitter.com/Lqrqs/status/1076149397702926336
Lqrqs;2018-12-21 22:40;0;0;"Premisnya gmn ini, Kakris";;;;"1076140322743144448";https://twitter.com/Lqrqs/status/1076140322743144448
Lqrqs;2018-12-21 22:39;1;1;"Makan daging anjing dengan sayur key opinion leader https:// twitter.com/umenumen/statu s/1076136145078050817 …";;;;"1076140141058482176";https://twitter.com/Lqrqs/status/1076140141058482176
Lqrqs;2018-12-21 22:33;0;1;"Orang-orang sih udah tau aku ga pernah kiss and tell";;;;"1076138531574112256";https://twitter.com/Lqrqs/status/1076138531574112256
Lqrqs;2018-12-21 22:26;5;7;"Ih maaf aku suka ga sengaja ngelike...";;;;"1076136762735439874";https://twitter.com/Lqrqs/status/1076136762735439874
Lqrqs;2018-12-21 22:14;0;0;"Kalo di kalangan mahasiswa masih laku kok. Es kepal jari jadi tinju~ https:// twitter.com/abdelachrian/s tatus/1076094731862437888 …";;;;"1076133706354458625";https://twitter.com/Lqrqs/status/1076133706354458625
Lqrqs;2018-12-21 21:58;0;0;"Atau ke tempat sampah? Ke tanah?";;;;"1076129844092592130";https://twitter.com/Lqrqs/status/1076129844092592130
Lqrqs;2018-12-21 21:58;0;0;"Emang kalo ke wastafel kenapa Ces";;;;"1076129738005966849";https://twitter.com/Lqrqs/status/1076129738005966849
Lqrqs;2018-12-21 21:57;0;0;"Uhuy";;;;"1076129628836683776";https://twitter.com/Lqrqs/status/1076129628836683776
Lqrqs;2018-12-21 21:12;0;0;"Shao kao bukan dude?";;;;"1076118306065604608";https://twitter.com/Lqrqs/status/1076118306065604608
Lqrqs;2018-12-21 21:02;2;2;"Aku baca ini pake suara dubbing film RCTI minggu pagi... https:// twitter.com/HistoriDunia/s tatus/1075765814949666816 …";;;;"1076115793392201730";https://twitter.com/Lqrqs/status/1076115793392201730
Lqrqs;2018-12-21 16:24;1;9;"The fact that this is a news only proves that Indonesians really godify the Arabic language https:// twitter.com/BakarSmith/sta tus/1075917766731808768 …";;;;"1076045841209581568";https://twitter.com/Lqrqs/status/1076045841209581568
Lqrqs;2018-12-21 14:13;5;0;"You lost me at pic.twitter.com/r6J5dAcvqg";;;;"1076012732573315072";https://twitter.com/Lqrqs/status/1076012732573315072
Lqrqs;2018-12-21 13:50;0;0;"Di cgv ya?";;;;"1076006997974081537";https://twitter.com/Lqrqs/status/1076006997974081537
Lqrqs;2018-12-21 13:48;0;0;"Iya aku jg ga share karena pas ku google ga ada hasilnya... Cerita aslinya gmn?";;;;"1076006499174907905";https://twitter.com/Lqrqs/status/1076006499174907905
Lqrqs;2018-12-21 13:41;0;0;"Kok yg jaga malah yg natalan ya kakbon :(";;;;"1076004776456769536";https://twitter.com/Lqrqs/status/1076004776456769536
Lqrqs;2018-12-21 13:36;0;0;"Ada korek api juga https:// twitter.com/SammiSoh/statu s/1075997181247553536 …";;;;"1076003431523835904";https://twitter.com/Lqrqs/status/1076003431523835904
Lqrqs;2018-12-21 11:34;0;0;"It counts laa";;;;"1075972834755661825";https://twitter.com/Lqrqs/status/1075972834755661825
Lqrqs;2018-12-21 11:32;0;1;"Judulnya aneh bangeeeet";;;;"1075972185594900480";https://twitter.com/Lqrqs/status/1075972185594900480
Lqrqs;2018-12-21 11:30;0;0;"Kok bisa >.< masak gak kerasa haha lucu";;;;"1075971869864472577";https://twitter.com/Lqrqs/status/1075971869864472577
Lqrqs;2018-12-21 11:29;0;0;"Never heard of it, will give it a try some time hehehehhh";;;;"1075971510186106880";https://twitter.com/Lqrqs/status/1075971510186106880
Lqrqs;2018-12-21 11:14;0;0;"That makes sense";;;;"1075967748080001024";https://twitter.com/Lqrqs/status/1075967748080001024
Lqrqs;2018-12-21 11:14;0;0;"Are you an australian yourself";;;;"1075967709169340416";https://twitter.com/Lqrqs/status/1075967709169340416
Lqrqs;2018-12-21 11:14;0;0;"Iyah aku juga. Stay hydrated brother";;;;"1075967619528675328";https://twitter.com/Lqrqs/status/1075967619528675328
Lqrqs;2018-12-21 11:09;0;0;"Do you drink for the taste or they really have an effect on you ._.";;;;"1075966466149605376";https://twitter.com/Lqrqs/status/1075966466149605376
Lqrqs;2018-12-21 10:41;0;0;"Nanti kalo dibangunkan dan malah marah gimana?";;;;"1075959431538532353";https://twitter.com/Lqrqs/status/1075959431538532353
Lqrqs;2018-12-21 10:37;0;0;"I don't like fizzy drinks. Sparkling water, soda, & beer";;;;"1075958429976387584";https://twitter.com/Lqrqs/status/1075958429976387584
Lqrqs;2018-12-21 10:33;0;1;"Do people really drink beer on a daily basis";;;;"1075957400321040385";https://twitter.com/Lqrqs/status/1075957400321040385
Lqrqs;2018-12-21 10:21;0;0;"Ni bopung dikasih makan sekali, lgsg sok ikrib manja banget ga pergi-pergi. Dengan terpaksa q bilang, "Yaudaa gapapaaa, tp jangan ngerepotin yhaaa." Bener. Makan apa aja mau. Mandiinnya gampang. Pupnya juga tertib di box. Uwuwuwu";;;;"1075954311388061696";https://twitter.com/Lqrqs/status/1075954311388061696
Lqrqs;2018-12-21 10:04;1;2;"Mau ikut pic.twitter.com/iz52PW1SQ6";;;;"1075950070531387392";https://twitter.com/Lqrqs/status/1075950070531387392
Lqrqs;2018-12-21 09:45;0;0;"Anjir lah. Jadi Aladdin hahahahaha";;;;"1075945327125880832";https://twitter.com/Lqrqs/status/1075945327125880832
Lqrqs;2018-12-21 09:42;0;0;"Chinese muslim ya Baim Wong laa https:// twitter.com/RuffneckRefuge e/status/1075426851709947904 …";;;;"1075944608188624896";https://twitter.com/Lqrqs/status/1075944608188624896
Lqrqs;2018-12-21 08:52;0;0;"Simak thread ini https:// twitter.com/kzahras/status /1075711207426781184 …";;;;"1075932019186528257";https://twitter.com/Lqrqs/status/1075932019186528257
Lqrqs;2018-12-21 08:29;0;0;"Untung aku juga udah 103";;;;"1075926321291681792";https://twitter.com/Lqrqs/status/1075926321291681792
Lqrqs;2018-12-20 21:56;0;1;"Ini juga harum ena, sobat. Kayanya baru ya pic.twitter.com/NwryYmsImQ";;;;"1075766980064337920";https://twitter.com/Lqrqs/status/1075766980064337920
Lqrqs;2018-12-20 18:16;0;0;"Sebenernya gapapa. Malah mild banget kan kaya sampo bayi, tida pedih di mata~";;;;"1075711495034462208";https://twitter.com/Lqrqs/status/1075711495034462208
Lqrqs;2018-12-20 17:41;0;0;"Oo ternyata bukan di utara ya, okesip dicatat";;;;"1075702764116668416";https://twitter.com/Lqrqs/status/1075702764116668416
Lqrqs;2018-12-20 17:39;0;0;"Hmm lucu ya... menunya apa aja? Aku ga doyan sayur sop, apalagi jagung >.<";;;;"1075702339099475970";https://twitter.com/Lqrqs/status/1075702339099475970
Lqrqs;2018-12-20 17:09;2;2;"Ini enak dude. Sampe lupa difoto pic.twitter.com/qyqQL5r7eN";;;;"1075694715335397376";https://twitter.com/Lqrqs/status/1075694715335397376
Lqrqs;2018-12-20 16:03;0;0;"Tempat makan apa sih ini? ._.";;;;"1075678046575718402";https://twitter.com/Lqrqs/status/1075678046575718402
Lqrqs;2018-12-20 15:13;1;7;"Soalnya ga bisa nyontek pas ditanya "Man Robbuka?" https:// twitter.com/ko2w/status/10 75663594161762305 …";;;;"1075665418843414528";https://twitter.com/Lqrqs/status/1075665418843414528
Lqrqs;2018-12-20 14:31;0;1;"Touch the shoulder!! pic.twitter.com/R4iemkpICF";;;;"1075654787457110021";https://twitter.com/Lqrqs/status/1075654787457110021
Lqrqs;2018-12-20 14:22;0;0;"Terancam kenapa";;;;"1075652736601927680";https://twitter.com/Lqrqs/status/1075652736601927680
Lqrqs;2018-12-20 14:21;2;5;"Alias iyadeeeechhhhh hidup u paling beraddd";;;;"1075652282568470529";https://twitter.com/Lqrqs/status/1075652282568470529
Lqrqs;2018-12-20 14:13;102;69;"Same energy pic.twitter.com/B2nl0n9sA5";;;;"1075650463326908416";https://twitter.com/Lqrqs/status/1075650463326908416
Lqrqs;2018-12-20 10:54;10;13;"http:// Dichotomytests.com dan UMR Ga cuma Jogja sih. Aku juga kaget pas baru pindah dari Purwokerto, rasanya apa-apa muahaaaal~ pic.twitter.com/0V17skCg0y";;;;"1075600267565948928";https://twitter.com/Lqrqs/status/1075600267565948928
Lqrqs;2018-12-20 10:49;4;5;"Adekku yang tinggal di Yogya bilang aku hedon. Padahal mah emang harganya aja yg beda :(";;;;"1075599101801025536";https://twitter.com/Lqrqs/status/1075599101801025536
Lqrqs;2018-12-20 09:56;1;0;"Iya >.< duduk di teras, di dipan rotan";;;;"1075585801289752578";https://twitter.com/Lqrqs/status/1075585801289752578
Lqrqs;2018-12-20 09:45;1;2;"Orang-oramg sadar gak sih, dibalik account yang avatarnya jilbab cantik dan suka dukung oposisi gini tu biasanya isinya mas-mas goatee dan kopyah gitu?? Hhhhh https:// twitter.com/InfoTwitwor/st atus/1075275031679184898 …";;;;"1075582935070236672";https://twitter.com/Lqrqs/status/1075582935070236672
Lqrqs;2018-12-20 00:57;0;0;"Feeding Piranhas!! (Cow Head) https:// youtu.be/sEitbDE7hh0";;;;"1075449938522173441";https://twitter.com/Lqrqs/status/1075449938522173441
Lqrqs;2018-12-20 00:18;0;0;""Yang suka cuddling"-nya mana?";;;;"1075440177684705284";https://twitter.com/Lqrqs/status/1075440177684705284
Lqrqs;2018-12-20 00:13;0;0;"Oooo ya, aku pernah disuguhi kopi susu yg susunya busa-busa gitu...";;;;"1075438870907351041";https://twitter.com/Lqrqs/status/1075438870907351041
Lqrqs;2018-12-19 23:56;2;0;"Why are you proud to be rude";;;;"1075434698862542849";https://twitter.com/Lqrqs/status/1075434698862542849
Lqrqs;2018-12-19 23:55;0;0;"Emang itu guna aslinya buat apa";;;;"1075434507539427328";https://twitter.com/Lqrqs/status/1075434507539427328
Lqrqs;2018-12-19 23:47;0;0;"Triggered ya gah hahaha";;;;"1075432563697569793";https://twitter.com/Lqrqs/status/1075432563697569793
Lqrqs;2018-12-19 23:39;0;0;"Yang kesel pas Arthur sama adenya berantem, ibunya baru ngelerai di akhir. Mana baju+rambutnya udah bagus. Dari tadi dandan ternyata";;;;"1075430528130506752";https://twitter.com/Lqrqs/status/1075430528130506752
Lqrqs;2018-12-19 23:20;0;0;"I think my favorite genre is SAD";;;;"1075425608161648640";https://twitter.com/Lqrqs/status/1075425608161648640
Lqrqs;2018-12-19 23:08;0;0;"Ordinary Fool by Paul Williams • Bugsy Malone https:// open.spotify.com/track/2tmXx87U oT35yLOGwvntWD?si=421U6WEiTtOfCfYXAksimA …";;;;"1075422557736587264";https://twitter.com/Lqrqs/status/1075422557736587264
Lqrqs;2018-12-19 22:13;0;0;"Hehe iya... everything sounds easy when it happens to anybody but us. "Loh kan tinggal xxx atau yyy."";;;;"1075408693536014338";https://twitter.com/Lqrqs/status/1075408693536014338
Lqrqs;2018-12-19 22:03;10;17;"Advice is really hard to follow. As logical as it may sound... Our mind keeps making excuses, creating imaginary barriers, paralyzing and doubting ourselves.";;;;"1075406239553675265";https://twitter.com/Lqrqs/status/1075406239553675265
Lqrqs;2018-12-19 21:20;0;0;"LeTS c0nFuSE b0Ys https:// twitter.com/rlthingy/statu s/1075338770210185217 …";;;;"1075395441653559296";https://twitter.com/Lqrqs/status/1075395441653559296
Lqrqs;2018-12-19 17:36;0;0;"Earphone kiri i rusak, suaranya keciiil banget. Tp skrg jadi enak lagi karena dah di-adapt~ pic.twitter.com/QDnnlRXjtU";;;;"1075339006420803584";https://twitter.com/Lqrqs/status/1075339006420803584
Lqrqs;2018-12-19 17:30;0;0;"Sounds and Vibrations > Sound Quality and Effects > Adapt Sound. Tentu saja dilakukan sembari dipake earphone-nya ya lur";;;;"1075337504360783872";https://twitter.com/Lqrqs/status/1075337504360783872
Lqrqs;2018-12-19 17:28;0;0;"Sedih bat ikut lomba dibilang judi. Kayak gak ngehargain bakat/usaha anaknya https:// twitter.com/DiajengLrst/st atus/1075058799034064897 …";;;;"1075337121764798466";https://twitter.com/Lqrqs/status/1075337121764798466
Lqrqs;2018-12-19 17:27;1;5;"Kalo earphone u rusak (kecil sebelah suaranya, misalnya), ke Settings > Sounds > Adapt Sound aja. Nanti nyaman lagi #PSA";;;#PSA;"1075336845615976448";https://twitter.com/Lqrqs/status/1075336845615976448
Lqrqs;2018-12-19 12:41;0;1;"Full chronology: https:// m.facebook.com/story.php?stor y_fbid=10156988754602458&id=693492457 … Sumbernya Kompas, Detik, sama CNN.";;;;"1075264769127460864";https://twitter.com/Lqrqs/status/1075264769127460864
Lqrqs;2018-12-19 12:38;0;1;"Wajah Korban Penganiayaan Bahar Smith Lebam Bercucur Darah http:// cnn.id/354779 NOT SURPRISED";;;;"1075264168154914817";https://twitter.com/Lqrqs/status/1075264168154914817
Lqrqs;2018-12-19 12:07;3;0;"Siang-siang emosi liat orang jualan seblak kering gataunya cuma kerupuk biasa digoreng dikasih bon cabe. Seblak kering!!!";;;;"1075256249283792897";https://twitter.com/Lqrqs/status/1075256249283792897
Lqrqs;2018-12-19 10:24;4;0;"Heartbreaker of Cliff, Kai, Doctor, Rick, and Gray. https:// twitter.com/shitegoblin/st atus/1074662357832425474 …";;;;"1075230430293458944";https://twitter.com/Lqrqs/status/1075230430293458944
Lqrqs;2018-12-19 10:20;1;1;"Agamaku agama mayo...nnaise";;;;"1075229331465486337";https://twitter.com/Lqrqs/status/1075229331465486337
Lqrqs;2018-12-18 23:37;0;0;"Makes me wonder... does blatantly asking for it really work?";;;;"1075067635421736962";https://twitter.com/Lqrqs/status/1075067635421736962
Lqrqs;2018-12-18 21:29;0;0;"░░░░░░░░░░ ░ Eternal sadness ░ ░░░░░░░░░░";;;;"1075035435347468288";https://twitter.com/Lqrqs/status/1075035435347468288
Lqrqs;2018-12-18 21:28;0;0;"Aq pernah, terus muntah enegggg kebanyakan minyak";;;;"1075034978151469057";https://twitter.com/Lqrqs/status/1075034978151469057
Lqrqs;2018-12-18 21:26;0;0;"Atau [insert cerita inspirasi di sini] Good morning all,, pic.twitter.com/v3HMDURU1s";;;;"1075034661888425986";https://twitter.com/Lqrqs/status/1075034661888425986
Lqrqs;2018-12-18 21:22;0;0;"░I░a░m░s░a░d░";;;;"1075033448153300992";https://twitter.com/Lqrqs/status/1075033448153300992
Lqrqs;2018-12-18 21:16;1;0;"Emang ngapain sih, kok pake berlutut segala?";;;;"1075032102788198400";https://twitter.com/Lqrqs/status/1075032102788198400
Lqrqs;2018-12-18 21:15;0;0;"Kasian pacarmu :(";;;;"1075031761438920704";https://twitter.com/Lqrqs/status/1075031761438920704
Lqrqs;2018-12-18 21:09;5;1;"Oh itu pacar kamu yang tiap hari ngechat "Pagi... Selamat beraktivitas..." ke whatsapp group.";;;;"1075030201178836993";https://twitter.com/Lqrqs/status/1075030201178836993
Lqrqs;2018-12-18 15:52;11;2;"Semoga ntar malem gerombolan yang gergaji nisan dihantui sama Pak Albertus. Suzzanna style, alias sampe meninggal.";;;;"1074950404985708544";https://twitter.com/Lqrqs/status/1074950404985708544
Lqrqs;2018-12-18 15:07;1;2;"Juara banget bapak ini. Garing tapi becandaannya pake skill :(";;;;"1074939131816366081";https://twitter.com/Lqrqs/status/1074939131816366081
Lqrqs;2018-12-18 14:37;0;0;"D-dari google ._.";;;;"1074931687098699776";https://twitter.com/Lqrqs/status/1074931687098699776
Lqrqs;2018-12-18 13:29;0;0;"Haha iya cobain deh ke kucingnya";;;;"1074914595205144577";https://twitter.com/Lqrqs/status/1074914595205144577
Lqrqs;2018-12-18 13:08;18;34;"Tadi malem kucingku gelisah parah di kandangin. Aku setelin musik dari Youtube yg 2 hours soothing music for cats. Dia udah tidur, terus ads!!!! Kucingnya kaget, bangun!!!!";;;;"1074909336776757249";https://twitter.com/Lqrqs/status/1074909336776757249
Lqrqs;2018-12-18 11:33;0;0;"Nimbrung... kalo di luar engagement yg ada batunya. Wedding yg cuma band-nya. Semua di manis kiri. Wedding ring di dalem, engagement di luar. pic.twitter.com/0Q4Iz0DqCp";;;;"1074885365150801925";https://twitter.com/Lqrqs/status/1074885365150801925
Lqrqs;2018-12-18 11:27;0;0;"Aku suka liat Tank. Gentle giant";;;;"1074883898398535681";https://twitter.com/Lqrqs/status/1074883898398535681
Lqrqs;2018-12-17 22:22;0;1;"Merknya Easecox. Dia beli sepaket sampe 20+ kayanya >.<";;;;"1074686256766869504";https://twitter.com/Lqrqs/status/1074686256766869504
Lqrqs;2018-12-17 22:17;0;2;"Temenku pake waist trainer (sepaket sama bra dan untuk kompress lengan) karena skoliosis ringan. Dipake tiap hari, dr bangun sampe tidur. Sekarang langsing parah...";;;;"1074685144588464138";https://twitter.com/Lqrqs/status/1074685144588464138
Lqrqs;2018-12-17 12:24;0;0;"I know right";;;;"1074535910748745728";https://twitter.com/Lqrqs/status/1074535910748745728
Lqrqs;2018-12-17 11:53;0;1;"My high school ex threatened to run over my brother if we didn't get back together https:// twitter.com/TaranaBurke/st atus/1074478517138714626 …";;;;"1074527903990177792";https://twitter.com/Lqrqs/status/1074527903990177792
Lqrqs;2018-12-17 09:40;0;0;"Sama katanya di Bible gini dad pic.twitter.com/VF9vsm3RVy";;;;"1074494465249660928";https://twitter.com/Lqrqs/status/1074494465249660928
Lqrqs;2018-12-17 09:39;0;0;"Iya, sama. Asal dibunuh untuk dimakan and the death isn't made to be slow. Dogs are boiled alive (which is wrong) but so are lobsters, crabs, insects, monkey de el el oysters are even eaten alive";;;;"1074494200089989120";https://twitter.com/Lqrqs/status/1074494200089989120
Lqrqs;2018-12-17 09:34;0;1;"Buat pecinta tokek kelinci kodok kuda, pasti aku kejam karena makan daging mereka... I don't eat dogs and cats because I *believe* they are pets. Some men's pets are some men's food.";;;;"1074493087349563393";https://twitter.com/Lqrqs/status/1074493087349563393
Lqrqs;2018-12-17 09:30;1;0;"Why do the Chinese eat dogs? by Anonymous https://www. quora.com/Why-do-the-Chi nese-eat-dogs/answers/97666594?ch=2&share=eaf5e385&srid=u9M6v … Baca ini jadi pengen vegan aja. Tapi lebih enak living in ignorance >.< What's right vs what's convenient";;;;"1074492075083587585";https://twitter.com/Lqrqs/status/1074492075083587585
Lqrqs;2018-12-17 08:50;0;0;"What is the most disturbing thing you have allowed someone to do to you? by Kaylee Meyers https://www. quora.com/What-is-the-mo st-disturbing-thing-you-have-allowed-someone-to-do-to-you/answer/Kaylee-Meyers-2?ch=2&share=621ca7c2&srid=u9M6v …";;;;"1074481884778848256";https://twitter.com/Lqrqs/status/1074481884778848256
Lqrqs;2018-12-17 08:27;1;0;"Soalnya aku ga pernah denger orang gereja atau vihara ngebakar hidup-hidup orang yang dituduh nyuri speaker masjid dan gebukin tertuduh maling kaya gini sih. Religion of peace my ass";;;;"1074476047335182337";https://twitter.com/Lqrqs/status/1074476047335182337
Lqrqs;2018-12-17 08:20;0;4;"When used together, they cancel each other out";;;;"1074474360964931584";https://twitter.com/Lqrqs/status/1074474360964931584
Lqrqs;2018-12-17 08:06;1;2;"Akhir-akhir ini bitter banget. Kenapa ya";;;;"1074470938433904641";https://twitter.com/Lqrqs/status/1074470938433904641
Lqrqs;2018-12-17 08:06;0;3;"Asyik bisa bergaya sesuka hati. Yang penting istriku mung burqaaa tok item https:// twitter.com/howtodressvvel l/status/1074318848260620288 …";;;;"1074470884079853568";https://twitter.com/Lqrqs/status/1074470884079853568
Lqrqs;2018-12-17 08:04;0;2;"Billy Bat (Naoki Urasawa) https:// twitter.com/41Strange/stat us/1073271945553006593 …";;;;"1074470245765603329";https://twitter.com/Lqrqs/status/1074470245765603329
Lqrqs;2018-12-16 17:39;1;0;"People in America are using cough syrup Pei Pa Koa to make “holiday-themed” bubble tea https:// mothership.sg/2018/12/pi-pa- gao-nin-jiom-bubble-tea/ … White people really be using obat batuk cap ibu-anak for tea";;;;"1074252620896776192";https://twitter.com/Lqrqs/status/1074252620896776192
Lqrqs;2018-12-16 15:24;0;1;"Wihh, natal banget nuansanyaa";;;;"1074218588024655874";https://twitter.com/Lqrqs/status/1074218588024655874
Lqrqs;2018-12-16 11:38;0;0;"Nice new ava";;;;"1074161778009862144";https://twitter.com/Lqrqs/status/1074161778009862144
Lqrqs;2018-12-16 11:04;0;0;"Sebel aku. Dikira aku nanya pa gmn :(";;;;"1074153354882834432";https://twitter.com/Lqrqs/status/1074153354882834432
Lqrqs;2018-12-16 10:38;0;0;"An unpopular opinion that really got me like: https:// twitter.com/escoaloplop/st atus/1073844421605580801 …";;;;"1074146830739374080";https://twitter.com/Lqrqs/status/1074146830739374080
Lqrqs;2018-12-16 10:35;0;3;"Istri suruh di rumah aja ga boleh kerja. Tp begitu istrinya hamil, cuma boleh ke SpOG perempuan. Cih.";;;;"1074145925424021504";https://twitter.com/Lqrqs/status/1074145925424021504
Lqrqs;2018-12-16 09:43;0;0;"Kak Etna add aku dong hehe CrabbyFishy";;;;"1074132895810215937";https://twitter.com/Lqrqs/status/1074132895810215937
Lqrqs;2018-12-15 23:15;0;0;"Stupid me. Dogs can swim";;;;"1073974847942778882";https://twitter.com/Lqrqs/status/1073974847942778882
Lqrqs;2018-12-15 23:15;0;0;"The dog would drown if it didn't stand on two feet https:// twitter.com/RespectfulMeme s/status/1073972057426284545 …";;;;"1073974794889060353";https://twitter.com/Lqrqs/status/1073974794889060353
Lqrqs;2018-12-15 22:49;0;0;"Kaya muntahan haha";;;;"1073968226520915969";https://twitter.com/Lqrqs/status/1073968226520915969
Lqrqs;2018-12-15 22:21;1;0;"Wanjeng najis https:// twitter.com/oureolatte/sta tus/1073824943958151170 …";;;;"1073961213082529794";https://twitter.com/Lqrqs/status/1073961213082529794
Lqrqs;2018-12-15 22:03;0;0;"Iyaa tu dari story nya Melawai, ga kecapture aja~";;;;"1073956816881475585";https://twitter.com/Lqrqs/status/1073956816881475585
Lqrqs;2018-12-15 21:53;0;0;"Selalu ada yg pertama untuk apapun~ btw ni enak lho, isinya 6 (3 pairs). 1 bulan/pair. Dan gak kering. 180k. Kalo yg warna2 tuh per 3-6 bulan/pair dan biasanya keringgg";;;;"1073954111362482176";https://twitter.com/Lqrqs/status/1073954111362482176
Lqrqs;2018-12-15 21:38;0;1;"PSA tuk sobat mblereng q pic.twitter.com/Xe9pwXoq4t";;;;"1073950354184712192";https://twitter.com/Lqrqs/status/1073950354184712192
Lqrqs;2018-12-15 21:08;0;0;"Aspaan bg suruh nabok istri pake sapu lidi";;;;"1073942980333993984";https://twitter.com/Lqrqs/status/1073942980333993984
Lqrqs;2018-12-15 18:03;0;0;"Aq af";;;;"1073896273210617857";https://twitter.com/Lqrqs/status/1073896273210617857
Lqrqs;2018-12-15 17:02;268;106;"Kalo cuma minta dihalalin mah ga usah nikah. Menista agama aja, nanti darahnya halal.";;;;"1073880883881361408";https://twitter.com/Lqrqs/status/1073880883881361408
Lqrqs;2018-12-15 13:57;0;0;"Matrix kan Indosat juga";;;;"1073834388104728578";https://twitter.com/Lqrqs/status/1073834388104728578
Lqrqs;2018-12-15 00:58;0;1;"Are all americans as xenophobic as Sarah Summers. How did she even win and get to represent USA";;;;"1073638437599629313";https://twitter.com/Lqrqs/status/1073638437599629313
Lqrqs;2018-12-14 21:50;0;1;"Mungkin u bilang mahal karena u bukan a functioning, responsible adult :((";;;;"1073590978454278146";https://twitter.com/Lqrqs/status/1073590978454278146
Lqrqs;2018-12-14 21:47;1;2;"Emang bener ya, orang bisa ilfeel kalo nomorku IM3..? ._. Pengen ganti Telkomsel biar keliatan kaya a fUncTioNinG, rEspoNsibLe adULt tapi mahal :(";;;;"1073590251975671809";https://twitter.com/Lqrqs/status/1073590251975671809
Lqrqs;2018-12-14 21:42;0;0;"Toh yg protes GardaSatwaIndonesia, emang kerjaan mereka begitu... Masa mereka mau ikut nyanyi >.<";;;;"1073589035480768513";https://twitter.com/Lqrqs/status/1073589035480768513
Lqrqs;2018-12-14 21:41;1;1;"Hehehe but the song can also be an opportunity to raise awareness on cruelty against dogs alias ndak papa gan sante wae~ https:// twitter.com/Gustika/status /1073028508866162688 …";;;;"1073588891972624385";https://twitter.com/Lqrqs/status/1073588891972624385
Lqrqs;2018-12-14 21:31;0;0;"Iya sama nih, pada rontok ternyata jamuran >.< biar ngurangin lembab juga";;;;"1073586279558696961";https://twitter.com/Lqrqs/status/1073586279558696961
Lqrqs;2018-12-14 20:10;0;2;"Dari kemarin kok pada di Claypot Popo";;;;"1073565813573963777";https://twitter.com/Lqrqs/status/1073565813573963777
Lqrqs;2018-12-14 20:07;0;0;"Wiih kucingmu yhaa haha lucu, knp dicukuuurr";;;;"1073565107207122945";https://twitter.com/Lqrqs/status/1073565107207122945
