username;date;retweets;favorites;text;geo;mentions;hashtags;id;permalink
Lqrqs;2019-01-03 13:41;1;1;"Or worse, anaknya ditelantarkan. Bininya ga tau. https:// twitter.com/Lqrqs/status/1 080687347606245376 …";;;;"1080715650098593792";https://twitter.com/Lqrqs/status/1080715650098593792
Lqrqs;2019-01-03 11:58;0;0;"Exhibit C https:// twitter.com/Matarael/statu s/1080659590012796929 … You can easily find others in the replies (or quoting my original tweet) These men exist";;;;"1080689715819335680";https://twitter.com/Lqrqs/status/1080689715819335680
Lqrqs;2019-01-03 11:56;0;0;"Exhibit B https:// twitter.com/KOODINERY/stat us/1080688603607425024 …";;;;"1080689267767037952";https://twitter.com/Lqrqs/status/1080689267767037952
Lqrqs;2019-01-03 11:55;0;1;"It's not because it happens pretty often. Exhibit A https:// twitter.com/ecwx48/status/ 1080645359691390976 …";;;;"1080689150141984769";https://twitter.com/Lqrqs/status/1080689150141984769
Lqrqs;2019-01-03 11:48;3;2;"That also happened to my neighbor di Purwokerto. She worked abroad as a housemaid. He didn't even feed her kids with that money. I know because one of the kids had to work for my mom";;;;"1080687347606245376";https://twitter.com/Lqrqs/status/1080687347606245376
Lqrqs;2019-01-03 05:58;962;515;"The audacity to even ask about this pic.twitter.com/UlKjflJxw7";;;;"1080599116030173184";https://twitter.com/Lqrqs/status/1080599116030173184
Lqrqs;2019-01-02 22:48;0;0;"Edit waeee~";;;;"1080491064195047424";https://twitter.com/Lqrqs/status/1080491064195047424
Lqrqs;2019-01-02 22:46;0;0;"Kalo di shopee wajib pake gambar mbak, kalo ga pake ga bakal dibaca sama user lain~";;;;"1080490400702377985";https://twitter.com/Lqrqs/status/1080490400702377985
Lqrqs;2019-01-02 22:13;0;0;"Oh iya";;;;"1080482150145712128";https://twitter.com/Lqrqs/status/1080482150145712128
Lqrqs;2019-01-02 22:00;0;1;"Eh SD";;;;"1080479072042373126";https://twitter.com/Lqrqs/status/1080479072042373126
Lqrqs;2019-01-02 21:59;0;0;"Dulu SMP renangnya ke sini https:// twitter.com/ainurohman/sta tus/1079971741789650944 …";;;;"1080478581896048641";https://twitter.com/Lqrqs/status/1080478581896048641
Lqrqs;2019-01-02 21:42;1;0;"Don't feel bad la... I know you tip your gojek drivers... just not with gopay";;;;"1080474371397832704";https://twitter.com/Lqrqs/status/1080474371397832704
Lqrqs;2019-01-02 21:12;0;0;"Di yutub aku malah jarang gan, seringnya kalo mau dapet bola, koin, nyawa, dll di game lain ekekeke";;;;"1080466775102316546";https://twitter.com/Lqrqs/status/1080466775102316546
Lqrqs;2019-01-02 21:11;0;0;"Terbukti efektif ya cara pervasif gitu. Seaneh apapun >.<";;;;"1080466503105794048";https://twitter.com/Lqrqs/status/1080466503105794048
Lqrqs;2019-01-02 20:53;0;0;"Kayanya udah liat semua iklannya aku... mulai dari princess yang mau nurunin berat badan sampe Sultan Pencumbu... tp gmn :( unskippable";;;;"1080461994321309697";https://twitter.com/Lqrqs/status/1080461994321309697
Lqrqs;2019-01-02 20:46;0;0;"Gundul aja gan~";;;;"1080460205102489600";https://twitter.com/Lqrqs/status/1080460205102489600
Lqrqs;2019-01-02 20:45;0;0;"NGA https:// twitter.com/Lqrqs/status/1 080459805616070656 …";;;;"1080460097204019201";https://twitter.com/Lqrqs/status/1080460097204019201
Lqrqs;2019-01-02 20:44;0;1;"Milih istri pake gacha. Punya anak kalo jelek, ada pilihan COBA LAGI anjenggg wkaka true utopia";;;;"1080459805616070656";https://twitter.com/Lqrqs/status/1080459805616070656
Lqrqs;2019-01-02 20:42;1;0;"Game of Sultans ngajarin harem ke cowo cowo inferior indonesia buat poligami alias ngaca gan, situ bukan sultan";;;;"1080459316581158914";https://twitter.com/Lqrqs/status/1080459316581158914
Lqrqs;2019-01-02 20:38;4;6;"Ganteng sih... tapi main Game of Sultans";;;;"1080458428294676480";https://twitter.com/Lqrqs/status/1080458428294676480
Lqrqs;2019-01-02 17:49;0;0;"You are strong, you'll meet again";;;;"1080415742955159552";https://twitter.com/Lqrqs/status/1080415742955159552
Lqrqs;2019-01-02 16:53;0;0;"Gokil. Bisa bikin tumpeng siomay juga";;;;"1080401789227126784";https://twitter.com/Lqrqs/status/1080401789227126784
Lqrqs;2019-01-02 15:28;1;0;"Keburu diaduk, jd ga estetik :( pic.twitter.com/svKADKEATw";;;;"1080380199596785664";https://twitter.com/Lqrqs/status/1080380199596785664
Lqrqs;2019-01-02 12:55;0;0;"Dicocol :(";;;;"1080341902690373633";https://twitter.com/Lqrqs/status/1080341902690373633
Lqrqs;2019-01-02 11:32;0;0;"Ene neeeh https:// twitter.com/Lqrqs/status/1 080320166112636928 …";;;;"1080320997918527488";https://twitter.com/Lqrqs/status/1080320997918527488
Lqrqs;2019-01-02 11:29;1;1;"Ngapain i pake resolusi resolusi an ya... lakuin mah tinggal lakuin aja hadech";;;;"1080320166112636928";https://twitter.com/Lqrqs/status/1080320166112636928
Lqrqs;2019-01-02 10:16;4;2;"Ish. Typical military guy yang IG captionnya selalu overproud. https:// twitter.com/PriyoBudiS/sta tus/1079646074086682625 …";;;;"1080301756360216576";https://twitter.com/Lqrqs/status/1080301756360216576
Lqrqs;2019-01-02 06:57;0;0;"https:// twitter.com/redditships/st atus/1080191961913528322 …";;;;"1080251689884499969";https://twitter.com/Lqrqs/status/1080251689884499969
Lqrqs;2019-01-02 06:51;0;1;"Mimpi matiin alarm... bangun-bangun panik, ga taunya masih jam segini";;;;"1080250161714974720";https://twitter.com/Lqrqs/status/1080250161714974720
Lqrqs;2019-01-02 01:13;0;0;"Iya, yang bikin aku beli novel lanjutannya... bagus >.< ternyata ada universenya. Banyak judulnya";;;;"1080165072020729856";https://twitter.com/Lqrqs/status/1080165072020729856
Lqrqs;2019-01-02 01:04;1;3;"Andai film The Golden Compass bagusan dikit, mungkin bakal ada sekuelnya >.< karena storywise, bagusan subtle knife dan amber spyglass";;;;"1080162789291782144";https://twitter.com/Lqrqs/status/1080162789291782144
Lqrqs;2019-01-02 00:44;0;0;"Yhaaa steril sih udah bisa dr umur 8 minggu. Idealnya umur 6 bulan atau setelah berat badan 2 kg Kucing adekku tiap hari pipis di kasur, hampir dibuang ibu >.<";;;;"1080157720076902400";https://twitter.com/Lqrqs/status/1080157720076902400
Lqrqs;2019-01-02 00:31;0;0;"Caper lagi puber >.< kucingnya adekku juga grgr nunda2 steril, keburu puber deh";;;;"1080154674093686784";https://twitter.com/Lqrqs/status/1080154674093686784
Lqrqs;2019-01-01 23:07;0;2;"The president of the most powerful country in the world tweeted this https:// twitter.com/realDonaldTrum p/status/1080088373451206656 …";;;;"1080133454791008256";https://twitter.com/Lqrqs/status/1080133454791008256
Lqrqs;2019-01-01 23:05;1;1;"Kalo versi strategi_bisnis "Prefer to ngegoblok2in those who can afford those." https:// twitter.com/QusyairiH/stat us/1078586526966018048 …";;;;"1080132876383936513";https://twitter.com/Lqrqs/status/1080132876383936513
Lqrqs;2019-01-01 22:21;0;0;"Bear brand sama hydro coco";;;;"1080121858421211136";https://twitter.com/Lqrqs/status/1080121858421211136
Lqrqs;2019-01-01 20:44;2;1;"Ga percaya >.< https:// twitter.com/Mentimoen/stat us/1080040062136602624 …";;;;"1080097541927067648";https://twitter.com/Lqrqs/status/1080097541927067648
Lqrqs;2019-01-01 11:59;0;2;"Is this Zura's Elizabeth https:// twitter.com/platypuslamp/s tatus/1079716739707858944 …";;;;"1079965363985477633";https://twitter.com/Lqrqs/status/1079965363985477633
Lqrqs;2019-01-01 00:08;0;0;"Is it happening";;;;"1079786319390199808";https://twitter.com/Lqrqs/status/1079786319390199808
Lqrqs;2018-12-31 23:20;2;0;"Padahal ya yg diserang gak cuma Mekkah. Vatikan dan India juga... https:// twitter.com/azizulbonyot/s tatus/1079350788953014272 …";;;;"1079774277354676224";https://twitter.com/Lqrqs/status/1079774277354676224
Lqrqs;2018-12-31 21:16;1;4;"Togel sama gacha ga ada bedanya";;;;"1079743028477059073";https://twitter.com/Lqrqs/status/1079743028477059073
Lqrqs;2018-12-31 19:17;0;1;"Suicidal kok takut salmonella";;;;"1079713073735188480";https://twitter.com/Lqrqs/status/1079713073735188480
Lqrqs;2018-12-31 14:26;0;0;"Ih akh kira namanya Adot";;;;"1079639940420386816";https://twitter.com/Lqrqs/status/1079639940420386816
Lqrqs;2018-12-31 10:24;0;0;"Hahahaha :))";;;;"1079579095338430464";https://twitter.com/Lqrqs/status/1079579095338430464
Lqrqs;2018-12-31 10:19;1;3;"This sprained ankle keeps me from: -Watching I Want to Eat Your Pancreas -Going dancing tonight -Going to samsat to pay taxes But fortunately it gives me a valid reason not to come to the neighborhood celebration (which is nasi timbelan, i haaaate sharing plate with strangers)";;;;"1079577814238543872";https://twitter.com/Lqrqs/status/1079577814238543872
Lqrqs;2018-12-30 17:25;3;1;"Di blog nya Mb fathman, ada biodatanya gitu. Di bagian dislikes... ada ini :)) Alias... ga salah tuch mbbbb pic.twitter.com/ktFbYQNJMU";;;;"1079322632267264002";https://twitter.com/Lqrqs/status/1079322632267264002
Lqrqs;2018-12-30 16:51;0;4;"This entire thread creeps me out https:// twitter.com/ValeeGrrl/stat us/1078475664586625024 …";;;;"1079314064575127554";https://twitter.com/Lqrqs/status/1079314064575127554
Lqrqs;2018-12-30 16:34;0;0;"Udah mau dimakan/mati/ketembak/kakinya buntung, tp selamaaat mulu";;;;"1079309677417062400";https://twitter.com/Lqrqs/status/1079309677417062400
Lqrqs;2018-12-30 16:30;0;0;"Mati ajalah Eren. Ga jelas bat dr season 1";;;;"1079308765759819783";https://twitter.com/Lqrqs/status/1079308765759819783
Lqrqs;2018-12-30 15:47;0;0;"I approve";;;;"1079297824662073344";https://twitter.com/Lqrqs/status/1079297824662073344
Lqrqs;2018-12-30 15:46;1;0;"If you look back to what you did and feel stupid... it only means that you're one step smarter and/or wiser. https:// twitter.com/Nurairan/statu s/1078665327527976961 …";;;;"1079297654947901440";https://twitter.com/Lqrqs/status/1079297654947901440
Lqrqs;2018-12-30 15:41;0;1;"((Ternyata))";;;;"1079296516898975744";https://twitter.com/Lqrqs/status/1079296516898975744
Lqrqs;2018-12-30 15:01;0;0;"Dokternya aja geleng-geleng pic.twitter.com/3u21L1s0at";;;;"1079286330050326530";https://twitter.com/Lqrqs/status/1079286330050326530
Lqrqs;2018-12-30 14:31;0;0;"Pertama kali keseleo. Alhamdulillah";;;;"1079278877602541569";https://twitter.com/Lqrqs/status/1079278877602541569
Lqrqs;2018-12-30 14:30;0;2;"I sprained my ankle dan gak jadi nonton I want to eat your pancreas :(";;;;"1079278540091154432";https://twitter.com/Lqrqs/status/1079278540091154432
Lqrqs;2018-12-30 13:16;0;5;"Hayo tebak siapa~ pic.twitter.com/He4X3zsZxo";;;;"1079260019848241152";https://twitter.com/Lqrqs/status/1079260019848241152
Lqrqs;2018-12-30 13:15;0;0;"I want to laugh too";;;;"1079259707632582656";https://twitter.com/Lqrqs/status/1079259707632582656
Lqrqs;2018-12-30 11:53;0;0;"";;;;"1079239067609456645";https://twitter.com/Lqrqs/status/1079239067609456645
Lqrqs;2018-12-30 02:28;0;2;"Jahitannya Taco harusnya dilepas besok. Tp ini udah pada dia lepas sendiri......... badass banget sih pic.twitter.com/9aQ98npou6";;;;"1079096947611291648";https://twitter.com/Lqrqs/status/1079096947611291648
Lqrqs;2018-12-30 01:55;0;0;"Aku ga seneng cuddling. Sumuk.";;;;"1079088620122693632";https://twitter.com/Lqrqs/status/1079088620122693632
Lqrqs;2018-12-30 01:30;0;0;"As long as I'm the big spoon";;;;"1079082344978345990";https://twitter.com/Lqrqs/status/1079082344978345990
Lqrqs;2018-12-30 00:22;0;0;"Mending mana sama zigot ayam?";;;;"1079065050407550976";https://twitter.com/Lqrqs/status/1079065050407550976
Lqrqs;2018-12-29 22:15;0;0;"Mung 10 menit og";;;;"1079033169976934400";https://twitter.com/Lqrqs/status/1079033169976934400
Lqrqs;2018-12-29 20:50;0;0;"Senengannya daughter #1 ya mbnoi~";;;#1;"1079011845585813504";https://twitter.com/Lqrqs/status/1079011845585813504
Lqrqs;2018-12-29 20:36;0;0;"Follower sak iprit kok sok2an decide for me. SnK S3 wae lah";;;;"1079008361922752512";https://twitter.com/Lqrqs/status/1079008361922752512
Lqrqs;2018-12-29 20:35;0;0;"Decide for me";;;;"1079007914210209794";https://twitter.com/Lqrqs/status/1079007914210209794
Lqrqs;2018-12-29 16:47;0;0;"Alone bukaan? Yang ceritanya mereka operasi pisah kembar siam terus satunya meninggal tapi ternyata ______";;;;"1078950724933804032";https://twitter.com/Lqrqs/status/1078950724933804032
Lqrqs;2018-12-29 15:10;1;1;"Admin-admin yang begini ditinggal aja di 2018 https:// twitter.com/Ternoda_/statu s/1078905190474870789 …";;;;"1078926192835584000";https://twitter.com/Lqrqs/status/1078926192835584000
Lqrqs;2018-12-29 15:09;0;0;"I only use Google Drive and flash drives yes I need to reorganize my files too pic.twitter.com/WS53KVTLwI";;;;"1078925997242605568";https://twitter.com/Lqrqs/status/1078925997242605568
Lqrqs;2018-12-29 15:07;0;0;"pic.twitter.com/kZxjkQlaLa";;;;"1078925573139849216";https://twitter.com/Lqrqs/status/1078925573139849216
Lqrqs;2018-12-29 15:07;12;1;"Iya iya aku tau ayam tu ga kawin, cuma disuntik biar bertelor. I was referring to this pic.twitter.com/PjWlD3QJUH";;;;"1078925365400109056";https://twitter.com/Lqrqs/status/1078925365400109056
Lqrqs;2018-12-29 15:05;7;1;"Soalnya ayam di Indonesia dibatasi 1 pejantan cuma bisa kawin sama 4 betina https:// twitter.com/ngabdul/status /1078614322253688832 …";;;;"1078924942387736581";https://twitter.com/Lqrqs/status/1078924942387736581
Lqrqs;2018-12-29 14:00;0;2;"guA tuH sUka dArk jokEs https:// twitter.com/QntuinTarantin o/status/1078875255504916480 …";;;;"1078908710448095239";https://twitter.com/Lqrqs/status/1078908710448095239
Lqrqs;2018-12-29 13:58;0;0;"Ngaaaa kerasa";;;;"1078908218032644096";https://twitter.com/Lqrqs/status/1078908218032644096
Lqrqs;2018-12-29 13:58;0;1;"I think I'm spending my NYE data cleaning";;;;"1078908129868279808";https://twitter.com/Lqrqs/status/1078908129868279808
Lqrqs;2018-12-29 13:15;0;0;"Memetwit ya ini";;;;"1078897310547890176";https://twitter.com/Lqrqs/status/1078897310547890176
Lqrqs;2018-12-29 13:14;0;0;"It's almost always followed with... "What do I do to prevent that? What do I do to have that?"";;;;"1078897004028223489";https://twitter.com/Lqrqs/status/1078897004028223489
Lqrqs;2018-12-29 13:13;1;0;"There is this one question that's been popping up this past month... "Do I want that..?" as I play a thousand imaginary scenarios in my head";;;;"1078896698770878464";https://twitter.com/Lqrqs/status/1078896698770878464
Lqrqs;2018-12-29 11:04;0;0;"Nello dan cap ibu dan anak pingsan lgsg";;;;"1078864301845172224";https://twitter.com/Lqrqs/status/1078864301845172224
Lqrqs;2018-12-27 00:40;0;0;"Dingin and kangen don't even rhyme";;;;"1077982584959774721";https://twitter.com/Lqrqs/status/1077982584959774721
Lqrqs;2018-12-26 23:49;0;1;"((Ketuker))";;;;"1077969745872183296";https://twitter.com/Lqrqs/status/1077969745872183296
Lqrqs;2018-12-26 23:38;0;1;"Cantik banget siapa sih ini";;;;"1077966866222526464";https://twitter.com/Lqrqs/status/1077966866222526464
Lqrqs;2018-12-26 23:34;0;0;"Hary Tanoe ngomong sama kaca https:// twitter.com/rani_anns/stat us/1077965729901629440 …";;;;"1077966000534908930";https://twitter.com/Lqrqs/status/1077966000534908930
Lqrqs;2018-12-26 23:34;0;0;""Lo harusnya bersyukur. Banyak yang masalahnya lebih berat dar-";;;;"1077965788424749056";https://twitter.com/Lqrqs/status/1077965788424749056
Lqrqs;2018-12-26 23:24;1;0;"Tumben tweetnya bener";;;;"1077963362607087617";https://twitter.com/Lqrqs/status/1077963362607087617
Lqrqs;2018-12-26 23:23;0;0;"Ngakak out loud";;;;"1077963232835321856";https://twitter.com/Lqrqs/status/1077963232835321856
Lqrqs;2018-12-26 23:22;0;0;"Mulai deeh :(";;;;"1077962959433883649";https://twitter.com/Lqrqs/status/1077962959433883649
Lqrqs;2018-12-26 23:12;0;0;"My anthem pas kelas 5 SD Pesan nabi Jangan takut mati Meski kau sembunyi Ia menghampiri";;;;"1077960265608585216";https://twitter.com/Lqrqs/status/1077960265608585216
Lqrqs;2018-12-26 23:09;0;0;"yang itu dad";;;;"1077959516136689665";https://twitter.com/Lqrqs/status/1077959516136689665
Lqrqs;2018-12-26 23:08;0;0;"Kamu kan pro bono";;;;"1077959434146525184";https://twitter.com/Lqrqs/status/1077959434146525184
Lqrqs;2018-12-26 22:57;3;2;"DM yang kamu terima langsung dari HP aq looochhhh~ ketik REG spasi";;;;"1077956587849797632";https://twitter.com/Lqrqs/status/1077956587849797632
Lqrqs;2018-12-26 22:55;1;1;"Aq bisa kasih wasapnya Mas GP 500rb aja. https:// twitter.com/GelarPrakosa/s tatus/1077955308494843904 …";;;;"1077956123322286080";https://twitter.com/Lqrqs/status/1077956123322286080
Lqrqs;2018-12-26 22:48;7;3;"#PSA Kalo u anak UI dan butuh jasa konseling, bisa ke klinik satelit yang deket Teknik. Gratis tis. Daftar dan cari jadwal. Konsultannya baiiiik banget. Gak judgmental (apalagi condescending) sama sekali.";;;#PSA;"1077954221951991808";https://twitter.com/Lqrqs/status/1077954221951991808
Lqrqs;2018-12-26 22:44;0;0;"Dr kmrn i happy happy aja liat org buka jasa DM-DMan. Tp kalo oknum yg itu lgsg kezel aq, hadeeecchhhh";;;;"1077953368197234688";https://twitter.com/Lqrqs/status/1077953368197234688
Lqrqs;2018-12-26 22:21;0;0;"Curhat psikolog beneran https:// twitter.com/kesh_chia/stat us/1077940313883168770 …";;;;"1077947415250984960";https://twitter.com/Lqrqs/status/1077947415250984960
Lqrqs;2018-12-26 22:13;7;7;"Kirain orang-orang pada ngequote apaan/siapa yak ini dari tadi... Kok aku diblock... ternyata netizen yg itu";;;;"1077945410918858755";https://twitter.com/Lqrqs/status/1077945410918858755
Lqrqs;2018-12-26 22:10;543;428;"Nyinyirin Gen Halilintar yang kalo mau vidcall harus bayar jutaan, tp sendirinya buka jasa DM-DMan sampe setengah juta gitu.";;;;"1077944751591051264";https://twitter.com/Lqrqs/status/1077944751591051264
Lqrqs;2018-12-26 22:08;0;0;"Waktu itu kuis di kelas. Soalnya banyak, tp waktunya sedikit. Dikumpulin via email in pdf. Ga boleh pegang hp. So I and my girls did this. https:// twitter.com/KingHarry__/st atus/1077334278202163200 …";;;;"1077944297595392000";https://twitter.com/Lqrqs/status/1077944297595392000
Lqrqs;2018-12-26 22:00;0;0;"Hahahahaha i miss youuu pic.twitter.com/CB8SSbbFUB";;;;"1077942262460428288";https://twitter.com/Lqrqs/status/1077942262460428288
Lqrqs;2018-12-26 21:10;0;0;"Looking good as always!!";;;;"1077929675299536896";https://twitter.com/Lqrqs/status/1077929675299536896
Lqrqs;2018-12-26 21:08;0;0;"Yg bulet di atas tuh";;;;"1077929242879381504";https://twitter.com/Lqrqs/status/1077929242879381504
Lqrqs;2018-12-26 20:25;0;0;"Haaahhh Depok???? Mana tuuuchhhhh *unmatch*";;;;"1077918431121272834";https://twitter.com/Lqrqs/status/1077918431121272834
Lqrqs;2018-12-26 19:26;0;2;"Ada ga ya... orang nanya stay dmn, terus dijawab Depok.. eh lgsg di-unmatch :(";;;;"1077903591661322240";https://twitter.com/Lqrqs/status/1077903591661322240
Lqrqs;2018-12-26 16:38;0;1;"I let out an audible laugh https:// twitter.com/rheechis/statu s/1077371650713120768 …";;;;"1077861108063428608";https://twitter.com/Lqrqs/status/1077861108063428608
Lqrqs;2018-12-26 16:02;0;1;"What happens regularly that would horrify a person back in 1900? by Tamara Mitrofanova https://www. quora.com/What-happens-r egularly-that-would-horrify-a-person-back-in-1900/answer/Tamara-Mitrofanova?ch=2&share=65bc8029&srid=u9M6v …";;;;"1077852043161653248";https://twitter.com/Lqrqs/status/1077852043161653248
Lqrqs;2018-12-26 15:06;0;0;"Tp kalo GO-BILLS bisa sampe 35++ nih";;;;"1077837942691774464";https://twitter.com/Lqrqs/status/1077837942691774464
Lqrqs;2018-12-26 15:01;34;16;"Pemerintah bayar utang negara pake Gopay aja nih mumpung cashback";;;;"1077836695456763904";https://twitter.com/Lqrqs/status/1077836695456763904
Lqrqs;2018-12-26 10:32;0;0;"Masa sih? ._. Aku dulu engga. Dia kan cuma stay di notif bar aja...";;;;"1077768990078849024";https://twitter.com/Lqrqs/status/1077768990078849024
Lqrqs;2018-12-26 10:29;1;0;"Bagaimana kalau Amerika saja https:// twitter.com/temponewsroom/ status/1077756703456735233 …";;;;"1077768327928328192";https://twitter.com/Lqrqs/status/1077768327928328192
Lqrqs;2018-12-26 10:23;1;2;"Dulu aku pake ini, Kak. Ga sampe 1 MB. https:// play.google.com/store/apps/det ails?id=net.hyx.app.volumenotification …";;;;"1077766871561072640";https://twitter.com/Lqrqs/status/1077766871561072640
Lqrqs;2018-12-26 10:08;0;0;"Ga usah dibenerin, adjust volume pake layar. #PoorMentality";;;#PoorMentality;"1077763026244198400";https://twitter.com/Lqrqs/status/1077763026244198400
Lqrqs;2018-12-26 00:12;0;0;"Emang maksudmu bukan? ._. Setauku persia bulu pendek ya exotic shorthair";;;;"1077612946602188800";https://twitter.com/Lqrqs/status/1077612946602188800
Lqrqs;2018-12-25 23:48;0;0;"Kepala lebih bulat. Hidung pesek. Badan cebol. Kaki pendek. Bulu jg helainya lebih tipis/halus.";;;;"1077607116548919296";https://twitter.com/Lqrqs/status/1077607116548919296
Lqrqs;2018-12-25 22:55;2;0;"Aku abis nonton trailer US: pic.twitter.com/9Ig26PayyK";;;;"1077593629202366466";https://twitter.com/Lqrqs/status/1077593629202366466
Lqrqs;2018-12-25 22:45;0;0;"Gaya bebas. Apalagi pas boomerang";;;;"1077591069716402176";https://twitter.com/Lqrqs/status/1077591069716402176
Lqrqs;2018-12-25 22:42;0;0;"This guy I've been seeing thinks this way too";;;;"1077590299088543744";https://twitter.com/Lqrqs/status/1077590299088543744
Lqrqs;2018-12-25 18:46;0;0;"Bayar air juga kmrn cashback 30rb. Feels unreal.";;;;"1077531123872223233";https://twitter.com/Lqrqs/status/1077531123872223233
Lqrqs;2018-12-25 18:22;0;0;"Pasien: "D- Mas Kosa: "Ssssst..!!! Aq introvert."";;;;"1077525097773031424";https://twitter.com/Lqrqs/status/1077525097773031424
Lqrqs;2018-12-25 18:16;0;0;""Dok, kenapa ya flu saya gak sembuh-sembuh?" "Lahacia™"";;;;"1077523556706050049";https://twitter.com/Lqrqs/status/1077523556706050049
Lqrqs;2018-12-25 17:59;0;0;"(((Sorting master)))";;;;"1077519289681248256";https://twitter.com/Lqrqs/status/1077519289681248256
Lqrqs;2018-12-25 17:46;1;2;"Dr aku SD ibu dah bilang, "Jangan dokter ya, Kak. Kuliahnya mahal~" sejak saat itu q kubur dalam dalam mimpi itu~~~";;;;"1077515937245364224";https://twitter.com/Lqrqs/status/1077515937245364224
Lqrqs;2018-12-25 16:29;0;0;"Reminds me of this https:// twitter.com/RinaKum0630180 7/status/1076003972966637569 …";;;;"1077496494117203971";https://twitter.com/Lqrqs/status/1077496494117203971
Lqrqs;2018-12-25 16:27;0;0;"What's with the music https:// twitter.com/kissycrush/sta tus/1075064394663497728 …";;;;"1077496004172107776";https://twitter.com/Lqrqs/status/1077496004172107776
Lqrqs;2018-12-25 16:24;0;0;"Ih ga bisa diretweeeet";;;;"1077495290481917957";https://twitter.com/Lqrqs/status/1077495290481917957
Lqrqs;2018-12-25 16:07;2;2;"Kumpul keluarga pas natal tu ada acara sungkem gak sih?";;;;"1077491077622358017";https://twitter.com/Lqrqs/status/1077491077622358017
Lqrqs;2018-12-25 15:59;0;0;"This is the only viable solution";;;;"1077488961709207562";https://twitter.com/Lqrqs/status/1077488961709207562
Lqrqs;2018-12-25 15:25;0;1;"Christmas miracle";;;;"1077480481812168705";https://twitter.com/Lqrqs/status/1077480481812168705
Lqrqs;2018-12-25 14:32;0;1;"What is the saddest thing you have seen a parent do to their child? by Ai Qi Tan https://www. quora.com/What-is-the-sa ddest-thing-you-have-seen-a-parent-do-to-their-child/answer/Ai-Qi-Tan?ch=2&share=1b3b6bcf&srid=u9M6v … Gypsy Rose Blanchard's mom made her a murderer.";;;;"1077467117316759552";https://twitter.com/Lqrqs/status/1077467117316759552
Lqrqs;2018-12-25 09:08;0;0;"Zootopia, where anyone can be anything Gak deeeeng";;;;"1077385573910831105";https://twitter.com/Lqrqs/status/1077385573910831105
Lqrqs;2018-12-25 09:04;0;0;"Add this to your dumb cats thread";;;;"1077384556586520582";https://twitter.com/Lqrqs/status/1077384556586520582
Lqrqs;2018-12-25 00:18;0;2;"Maple :((( https:// twitter.com/AcousticTrench /status/1076996677062610944 …";;;;"1077252132569370625";https://twitter.com/Lqrqs/status/1077252132569370625
Lqrqs;2018-12-24 23:01;0;0;"Makaciiiii Raniii";;;;"1077232884514078720";https://twitter.com/Lqrqs/status/1077232884514078720
Lqrqs;2018-12-24 22:59;0;0;"Sedih banget personel Seventeen (ga tau apa posisinya) IG post terakhirnya foto di motor sama anaknya. Captionnya, "Hore Bapak pulang"";;;;"1077232423484645378";https://twitter.com/Lqrqs/status/1077232423484645378
Lqrqs;2018-12-24 22:53;0;0;"Makasih Kak Nuruuul~~ >.<";;;;"1077230903028375553";https://twitter.com/Lqrqs/status/1077230903028375553
Lqrqs;2018-12-24 22:53;0;0;"Wkwk thank u cesss";;;;"1077230849387458560";https://twitter.com/Lqrqs/status/1077230849387458560
Lqrqs;2018-12-24 22:53;0;0;"Iya Dani makasih ya";;;;"1077230808035803137";https://twitter.com/Lqrqs/status/1077230808035803137
Lqrqs;2018-12-24 21:44;0;0;"Headline-nya gimana? Kayaknya udah dihapus tweetnya";;;;"1077213434226208768";https://twitter.com/Lqrqs/status/1077213434226208768
Lqrqs;2018-12-24 21:26;1;0;"In case ada yg tanya... Kolom #aku pake randbetween. Kolom nama dan kontak pake vlookup ke sheet hasil kuesioner. Terima kasih sekali lagi semuanya tgl 27 aku sidang, mohon doanya hehe";;;#aku;"1077208784970207232";https://twitter.com/Lqrqs/status/1077208784970207232
Lqrqs;2018-12-24 21:23;0;3;"[PENGUMUMAN] Karena ini udah tanggal 24, seperti yg kujanjikan... Ini hasil undian hadiah kuesioner di thread ini. Selamat @hscryo , @wiwigaga_ , dan @horrorette ! Aku DM ya hehe Sisanya aku hubungi via Whatsapp pic.twitter.com/YDkSDPKrv9";;@hscryo @wiwigaga_ @horrorette;;"1077208067933036544";https://twitter.com/Lqrqs/status/1077208067933036544
Lqrqs;2018-12-24 20:59;0;0;"Ohya!!!! Aku umumin skrggg!!!! Td sore ketisuran";;;;"1077202149912731648";https://twitter.com/Lqrqs/status/1077202149912731648
Lqrqs;2018-12-24 20:35;6;2;"Aku ga mau ngucapin natal soalnya masih besok.";;;;"1077196126472695808";https://twitter.com/Lqrqs/status/1077196126472695808
Lqrqs;2018-12-24 20:26;1;8;"Mau punya istri 4 itu artinya berniat selingkuh minimal 3 kali.";;;;"1077193844893003776";https://twitter.com/Lqrqs/status/1077193844893003776
Lqrqs;2018-12-24 20:26;2;3;"Bilang aja hobi selingkuh, sok sok bilang poligami.";;;;"1077193706992631808";https://twitter.com/Lqrqs/status/1077193706992631808
