username;date;retweets;favorites;text;geo;mentions;hashtags;id;permalink
netmediatama;2019-01-23 22:52;3;20;"WIT udah selesai.. Tapi, jangan sedih, karena program-program baru dari kami siap menemani weekend kamu! https:// twitter.com/JT18Tajo/statu s/1088018382845165568 …";;;;"1088102054449557505";https://twitter.com/netmediatama/status/1088102054449557505
netmediatama;2019-01-23 22:50;1;15;"Haha, oh ya? Jangan dibiasain dong.. Semoga besok2 bisa nonton ya.. https:// twitter.com/kookie_anisa/s tatus/1088045202135146496 …";;;;"1088101550906470401";https://twitter.com/netmediatama/status/1088101550906470401
netmediatama;2019-01-23 22:30;108;217;"Cewek kalo lagi bete, semuanya jadi serba salah! Tapi, kalo kamu berhasil bikin dia senyum, itu baru prestasi.. Hihihi pic.twitter.com/yxfxRwai70";;;;"1088096519289360384";https://twitter.com/netmediatama/status/1088096519289360384
netmediatama;2019-01-23 22:04;6;27;"Ternyata @desta80s menebak Abangnya @vincentrompies ! @TonightShow_NET pic.twitter.com/sA04mdW3u3";;@desta80s @vincentrompies @TonightShow_NET;;"1088090011654713344";https://twitter.com/netmediatama/status/1088090011654713344
netmediatama;2019-01-23 22:00;3;19;"Waktunya merapat, Commenters! Nona-nona cantik @angelicaaMP & @pammybowie siap meramaikan malam kalian sambil bersantai di rumah, nih! Jangan ditonton ya @TheComment_NET , jam 23.00 WIB! pic.twitter.com/vMR4l28psY";;@angelicaaMP @pammybowie @TheComment_NET;;"1088088973509947392";https://twitter.com/netmediatama/status/1088088973509947392
netmediatama;2019-01-23 21:23;5;36;"Kalau berhasil jawab, jangan Lupa Selebrasi ya Tonight Lovers! @TonightShow_NET pic.twitter.com/mkpN0Q8MTk";;@TonightShow_NET;;"1088079834012471298";https://twitter.com/netmediatama/status/1088079834012471298
netmediatama;2019-01-23 21:15;8;23;"Setelah pemain ditukar.. Ternyata @desta80s penyebab masalahnya! @TonightShow_NET pic.twitter.com/OzjqysWOo9";;@desta80s @TonightShow_NET;;"1088077789851336704";https://twitter.com/netmediatama/status/1088077789851336704
netmediatama;2019-01-23 21:15;4;19;"Mereka berhasil jawab juga nih! Waah! @TonightShow_NET pic.twitter.com/UnvGroBSLm";;@TonightShow_NET;;"1088077644506161152";https://twitter.com/netmediatama/status/1088077644506161152
netmediatama;2019-01-23 20:30;7;31;"YUHUU @TonightShow_NET LIVE malam ini bareng duo mama cantik yang bisa bikin Tonight Lovers nostalgia sama lagu-lagu mereka dulu. Yes! @tentangtiwi & @Tikaramlan ! Ada @TheOvertunes juga yg bakal bawain single terbaru mereka. Jam 21.00 WIB merapat di TONIGHT SHOW!!! pic.twitter.com/sGLvODHDIE";;@TonightShow_NET @tentangtiwi @Tikaramlan @TheOvertunes;;"1088066319478444032";https://twitter.com/netmediatama/status/1088066319478444032
netmediatama;2019-01-23 20:26;15;74;"Nih Mas Saifulbed kasih liat barang bawaannya. Eiya, selain jago makeup Mas Saifulbed juga jago olah vokal! Minat berguru sama dia? @Ini_Talkshow pic.twitter.com/HKcW3mKik5";;@Ini_Talkshow;;"1088065448485122048";https://twitter.com/netmediatama/status/1088065448485122048
netmediatama;2019-01-23 20:14;15;41;"Hayooo.. siapa yang mau ikut dimakeupin juga sama Mas Saifulbed? @Ini_Talkshow pic.twitter.com/mCjIdfGaXX";;@Ini_Talkshow;;"1088062494394900481";https://twitter.com/netmediatama/status/1088062494394900481
netmediatama;2019-01-23 20:07;7;37;"Mbak Iin mau main di Drama Musikal. Cocok? @Ini_Talkshow pic.twitter.com/cL1xk3iow0";;@Ini_Talkshow;;"1088060640160182272";https://twitter.com/netmediatama/status/1088060640160182272
netmediatama;2019-01-23 19:21;23;115;"Siapa yang paling jago akting? @Ini_Talkshow pic.twitter.com/gJdUPExeEr";;@Ini_Talkshow;;"1088049006414942208";https://twitter.com/netmediatama/status/1088049006414942208
netmediatama;2019-01-23 17:30;8;45;"ALAT TRANSPORTASI YANG TIDAK BOLEH BEROPERASI DI JALAN-JALAN PROTOKOL KOTA JAKARTA _ E _ _ _ Ada yang bisa jawab? Cari tau jawabannya di @WIB_NET , jam 18.00 WIB! Dan sore ini, akan ada Waktu Indonesia Berkunjung ke Komunitas Plus Size Jakarta! pic.twitter.com/Z8mxnAWEXA";;@WIB_NET;;"1088021021200793601";https://twitter.com/netmediatama/status/1088021021200793601
netmediatama;2019-01-23 16:30;333;1453;"Welcome to Breakout! Siapa nih, yang udah nungguin bocoran playlist sore ini? Akan ada @BTS_twt , @sheilaon7 , @AnneMarie , @taylorswift13 , @YG_WINNER , @jazhayat dan masih banyak lagi! Jangan sampe ketinggalan @BreakoutNET jam 17.00 WIB! Siapatau ada lagu favoritmu! pic.twitter.com/8Pqo6c9xjM";;@BTS_twt @sheilaon7 @AnneMarie @taylorswift13 @YG_WINNER @jazhayat @BreakoutNET;;"1088005921815506944";https://twitter.com/netmediatama/status/1088005921815506944
netmediatama;2019-01-23 15:00;44;117;"Katanya lagi promo... tapi kayak ngasih kode minta ongkos ya @Ini_Talkshow pic.twitter.com/4ToohWUKXf";;@Ini_Talkshow;;"1087983272410431490";https://twitter.com/netmediatama/status/1087983272410431490
netmediatama;2019-01-23 14:30;2;25;"Kevin Levin melawan Ben Tennyson! Tim manakah kalian? Ben 10 Omniverse, jam 15.00 WIB! #NETtoon pic.twitter.com/GdntjHlZz8";;;#NETtoon;"1087975721593491457";https://twitter.com/netmediatama/status/1087975721593491457
netmediatama;2019-01-23 13:30;9;44;"Waduh, kayaknya Darwin masih marah sama Gumball.. Gumballnya keberatan, nggak dibantuin tuh The Amazing World of Gumball, jam 14.00 WIB #NETtoon pic.twitter.com/XRTiBzC86C";;;#NETtoon;"1087960622090936324";https://twitter.com/netmediatama/status/1087960622090936324
netmediatama;2019-01-23 13:09;383;449;"Mari berdoa untuk saudara-saudara kita di Sulawesi Selatan yang sedang dilanda banjir, semoga diberikan keselamatan dan perlindungan. NET. mengucapkan turut berbela sungkawa yang sedalam dalamnya untuk saudara kita di Sulawesi Selatan. #PrayforSulSel pic.twitter.com/1EUTfbT7m7";;;#PrayforSulSel;"1087955459749879814";https://twitter.com/netmediatama/status/1087955459749879814
netmediatama;2019-01-23 13:00;5;35;"We Bare Bears jam 06.00 WIB yaa https:// twitter.com/rachmawatidewi /status/1087943160700063745 …";;;;"1087953072884772864";https://twitter.com/netmediatama/status/1087953072884772864
netmediatama;2019-01-23 12:15;7;37;"Jake mau menularkan penyakitnya pada tubuh Finn. Apa yang bakal terjadi pada mereka berdua, ya?! Adventure Time, jam 13.00 WIB! #NETtoon pic.twitter.com/t98Li4qcLA";;;#NETtoon;"1087941747554959360";https://twitter.com/netmediatama/status/1087941747554959360
netmediatama;2019-01-23 12:07;7;43;"Waktunya jam makan siang nih! Masih bingung mau makan apa? Nih, Mimin kasih refrensi... makanan enak, NO MSG! Yang punya aja sampe ngiler sendiri.. @OKfood_NET pic.twitter.com/XsLFAoFYSU";;@OKfood_NET;;"1087939734557491200";https://twitter.com/netmediatama/status/1087939734557491200
netmediatama;2019-01-23 12:00;29;64;"Official Seat Plan STRAY KIDS UNVEIL TOUR ‘I am...’ in JAKARTA 2019 , Saturday 26th January 2019 at Indonesia Convention Exhibition Hall 3A #UNVEILTOURinJKT @mecimapro pic.twitter.com/4JlxtwNrvf";;@mecimapro;#UNVEILTOURinJKT;"1087937973490835456";https://twitter.com/netmediatama/status/1087937973490835456
netmediatama;2019-01-23 11:03;19;78;"Apapun yang terjadi, tetap selow aja kayak @wahyuselow14 ! Setuju gak? @Ini_Talkshow pic.twitter.com/pKMbMHZqxi";;@wahyuselow14 @Ini_Talkshow;;"1087923775931338758";https://twitter.com/netmediatama/status/1087923775931338758
netmediatama;2019-01-23 09:00;10;51;"Boo, Anjing yang dijuluki "The World Cutest Dog" meninggal dunia. Uniknya, Anjing ini memiliki fans dan followers di instagram. @IMS_NET pic.twitter.com/4O50c9Pkdd";;@IMS_NET;;"1087892675846656000";https://twitter.com/netmediatama/status/1087892675846656000
netmediatama;2019-01-22 22:30;10;45;"Karena ulah Mas Fajar, semua jadi berantakkan.. @TheEast_NET pic.twitter.com/v0RQX7LbOm";;@TheEast_NET;;"1087734131268771840";https://twitter.com/netmediatama/status/1087734131268771840
netmediatama;2019-01-22 22:00;8;36;"Yooot.. menjelang waktu istirahat bersiap buat @TheComment_NET ! Mas @danangpostman & @yukikatou2 ditemenin @kvinjulio nih! Ada Nona @keirashabira juga! Matiin TV-nya 23.00 WIB! pic.twitter.com/j552JTufAG";;@TheComment_NET @danangpostman @yukikatou2 @kvinjulio @keirashabira;;"1087726583308120064";https://twitter.com/netmediatama/status/1087726583308120064
netmediatama;2019-01-22 21:19;8;40;"Tonight Lovers tolong fokus sama pertanyaan dan jawaban untuk @duljaelanii dan @aaliyahmassaidd , ya! :p @TonightShow_NET pic.twitter.com/CftAM11mi7";;@duljaelanii @aaliyahmassaidd @TonightShow_NET;;"1087716324879433728";https://twitter.com/netmediatama/status/1087716324879433728
netmediatama;2019-01-22 20:01;1;15;"Itu setiap Sabtu dan Minggu :P https:// twitter.com/zizahiro/statu s/1087695846416646145 …";;;;"1087696792966201344";https://twitter.com/netmediatama/status/1087696792966201344
netmediatama;2019-01-22 19:55;39;133;"Saymochi aja mendukung Pak @nurhadi_aldo ! Cocok kan jadi Menteri Penerangan? @Ini_Talkshow pic.twitter.com/rFC7ao9mIF";;@nurhadi_aldo @Ini_Talkshow;;"1087695156722036736";https://twitter.com/netmediatama/status/1087695156722036736
netmediatama;2019-01-22 19:35;171;310;"Siap dukung @nurhadi_aldo ? Capres biasa cuma urus 1 negara, Pak Nurhadi urus satu dunia, Dunia Maya! @Ini_Talkshow pic.twitter.com/SqyyBNCInp";;@nurhadi_aldo @Ini_Talkshow;;"1087690107786715137";https://twitter.com/netmediatama/status/1087690107786715137
netmediatama;2019-01-22 19:17;19;57;"Hayoo.. pada ikutan nyanyi bareng @wahyuselow14 ? @Ini_Talkshow pic.twitter.com/f1pGTAtgNO";;@wahyuselow14 @Ini_Talkshow;;"1087685619252228097";https://twitter.com/netmediatama/status/1087685619252228097
netmediatama;2019-01-22 19:12;12;36;"Sekarang @KimmyJayanti ikutan goyang "Kumadinya Welah"! Penonton udah pada ikutan belom? @Ini_Talkshow pic.twitter.com/PB9bLJCrjN";;@KimmyJayanti @Ini_Talkshow;;"1087684447997050881";https://twitter.com/netmediatama/status/1087684447997050881
netmediatama;2019-01-22 19:09;22;80;"Gimana lagu dan goyangannya Kang @newsuleprikitiw ? :D @Ini_Talkshow pic.twitter.com/Pt3P5TLjq1";;@newsuleprikitiw @Ini_Talkshow;;"1087683761997701121";https://twitter.com/netmediatama/status/1087683761997701121
netmediatama;2019-01-22 18:40;7;35;"Semua bingung, kenapa jawabannya harus ituuuu.. @WIB_NET pic.twitter.com/WK536vMq7r";;@WIB_NET;;"1087676250775113728";https://twitter.com/netmediatama/status/1087676250775113728
netmediatama;2019-01-22 18:30;15;35;"Penontoon.. @KimmyJayanti mau main ke Rumah Kang Sule! Si cantik Kimmy nggak sendirian, ada yang nemenin biar makin selow @wahyuselow14 & Capres yang kalian tunggu-tunggu kedatangannya @nurhadi_aldo ! @Ini_Talkshow jam 19.00 WIB :) pic.twitter.com/yk5meaYB3N";;@KimmyJayanti @wahyuselow14 @nurhadi_aldo @Ini_Talkshow;;"1087673731579670534";https://twitter.com/netmediatama/status/1087673731579670534
netmediatama;2019-01-22 18:26;4;16;"Pertanyaan gampang nih... Kira-kira jawabannya bener gak ya? Kalo menurut kamu jawaban yang benar apa ya? @WIB_NET pic.twitter.com/dOlMcUqlpV";;@WIB_NET;;"1087672725051600896";https://twitter.com/netmediatama/status/1087672725051600896
netmediatama;2019-01-22 18:17;4;19;"Waaah.. belum apa-apa kepintaran Nadine udah berhasil curi poin! @WIB_NET pic.twitter.com/t347GfGoC1";;@WIB_NET;;"1087670679296569344";https://twitter.com/netmediatama/status/1087670679296569344
netmediatama;2019-01-22 18:16;7;22;"8 Huruf, Huruf kedua A JALAN TOL YANG MENGHUBUNGKAN KOTA JAKARTA, BOGOR, DAN CIAWI NAMANYA... Siapa yang bisa bantuin Nadine? @WIB_NET pic.twitter.com/yxGBTVcvJI";;@WIB_NET;;"1087670250689093632";https://twitter.com/netmediatama/status/1087670250689093632
netmediatama;2019-01-22 18:00;5;35;"Mantan dia mau balikan sama mantannya, dan mantan dia adalah mantan Rina. Pertanyaannya, udah nonton "DI BALIK KUBIKAL" Episode 1 belum? Yg belum, buruan cek: http:// bit.ly/dibalikkubikal biar kamu #JadiBisa tau cerita & keseruan mereka #DiBalikKubikal sebelum Episode 2 tayang! pic.twitter.com/H8Prulb5Jr";;;#JadiBisa #DiBalikKubikal;"1087666183728316420";https://twitter.com/netmediatama/status/1087666183728316420
netmediatama;2019-01-22 17:30;9;42;"KERETA API BIASA BERHENTI DI... _ _ _ _ _ _ N Ada yang bisa jawab? Bercanda sama siapa sore ini? Sore ini akan ada Nadine Alexandra di @WIB_NET , jam 18.00 WIB! pic.twitter.com/RiZo1GYbYe";;@WIB_NET;;"1087658633012244480";https://twitter.com/netmediatama/status/1087658633012244480
netmediatama;2019-01-22 16:53;11;41;"Kangen sama Dilan? Simak cerita Vanesha Prescilla yuk, yang kembali memerankan Milea di Dilan 1991 nanti @GoodAfternooNET pic.twitter.com/TNd0D15G1k";;@GoodAfternooNET;;"1087649518319939585";https://twitter.com/netmediatama/status/1087649518319939585
netmediatama;2019-01-22 16:30;16;58;"Sore ini biar makin semangat ada @BreakoutNET yang siap nemenin kamu, Good People! Ini nih bocoran Playlist-nya! Ada @ygofficialblink , @DMASIV , @LiamPayne , @JonasBlue dan masih banyak yang lainnya! Stay tuned, 17.00 WIB ;) pic.twitter.com/8JKfTPXJD9";;@BreakoutNET @ygofficialblink @DMASIV @LiamPayne @JonasBlue;;"1087643533442539520";https://twitter.com/netmediatama/status/1087643533442539520
netmediatama;2019-01-22 15:00;21;50;"Kamu bingung mau berangkat ngantor/ngampus di Jakarta naik transportasi apa? Ditengah macetnya Jakarta, sekarang ada opsi tambahan transportasi di Jakarta! Migo Bike, layanan transportasi listrik berbasis aplikasi.. Cuma 3000 rupiah saja @OfficialNETNews pic.twitter.com/t60wJO4dcR";;@OfficialNETNews;;"1087620884066697216";https://twitter.com/netmediatama/status/1087620884066697216
netmediatama;2019-01-22 12:00;8;43;"[OFFICIAL GREETINGS] STRAY KIDS UNVEIL TOUR 'I am...' in JAKARTA 2019 - STRAY KIDS is coming back to JAKARTA for #UNVEILTourinJKT ! Indonesia STAY! Make sure you don't miss out :) @mecimapro https://www. youtube.com/watch?v=nxJXUR 6XqZQ&feature=youtu.be …";;@mecimapro;#UNVEILTourinJKT;"1087575585319088129";https://twitter.com/netmediatama/status/1087575585319088129
netmediatama;2019-01-22 10:02;63;131;"Hindari mencuci wajah dengan facial wash pada pagi hari. Kenapa ya? @PagiPagi_NET pic.twitter.com/He1e9RGwSR";;@PagiPagi_NET;;"1087546023788961792";https://twitter.com/netmediatama/status/1087546023788961792
netmediatama;2019-01-22 08:00;9;47;"Adu gombal Wendy dengan si Eneng.. @NET_Alkisah pic.twitter.com/7tsCjWvvDS";;@NET_Alkisah;;"1087515187337445378";https://twitter.com/netmediatama/status/1087515187337445378