username;date;retweets;favorites;text;geo;mentions;hashtags;id;permalink
S_SiscaJKT48;2018-12-18 13:04;19;108;"Wkkwk kocak dah kesel.. nah abis itu nih dalam hatiku kayak aduuh pgn banget foto.. tp pasti gakboleh karna kan mereka dijagain banget kan.. Yaudah kita pulang nih jalan keluar gerbang aquatics.. EH EMANG JODOH GA KEMANA YA aku papasan sama si ben hardy ini dong wkwk";;;;"1074908329896337408";https://twitter.com/S_SiscaJKT48/status/1074908329896337408
S_SiscaJKT48;2018-12-18 13:00;17;112;"EH PAS DILUAR kita melihat si ben hardy ini belum pulang gais.... dia lagi ngobrol ama temen2nya.. Yang bikin aku kesal Teman2nya ini sudah menggendong tas ransel ud siap pulang tapi belum pakai jubah panjang sama jaket mereka";;;;"1074907121387327488";https://twitter.com/S_SiscaJKT48/status/1074907121387327488
S_SiscaJKT48;2018-12-18 12:57;21;115;"Yauda setelah perbincangan blablabla akhirnya masnya ga foto. Terus yaudah kita melanjutkan meneriakan si atlet "Ben hardy" ini kan.. "BEN HARDY AISHITERUYOOOooooOooOooo" udah deh tuh dia dadah2 tp senyumnya kaya dipaksakan mungkin dia serem kali ya ama aq Lalu kita keluar nih";;;;"1074906357965324293";https://twitter.com/S_SiscaJKT48/status/1074906357965324293
S_SiscaJKT48;2018-12-18 12:46;34;144;"Terus ada mas2 volunteer aquatics deketin aku bilang "kamu jkt48 ya?" mampus ketauan pas lagi begini adu gmn ini yha ayo sisca berfikir Trs aku bilang "ga mas saya fans nya" Masnya "oooo gitu.. bole foto g?" Dalam hati eug LHOKAN AQ BUKAN MEMBERR KNP DI MNT FTO??";;;;"1074903621928513536";https://twitter.com/S_SiscaJKT48/status/1074903621928513536
S_SiscaJKT48;2018-12-18 12:43;28;132;"Nah aku ikutan dadah2in juga kan ya wkwk dengan heboh terus aku ga sadar menyanyikan "I WANT YOU I NEED YOU" aku gatau motivasiku apa tp aku ingin jkt48 selalu berkumandang dimanapun aku berada Lagi dicari videonya smg masi ada ya wkwk";;;;"1074902944019968000";https://twitter.com/S_SiscaJKT48/status/1074902944019968000
S_SiscaJKT48;2018-12-18 12:40;18;104;"Atlet2nya keluar gt kan dr kolam... yaampun pusing aku gakbisa mendeskripsikan bagaimana keadaannya.. Terus mereka kaya siap2 mau balik ke backstage(?) Mau ke bis mereka tuh. Nah ini kesempatan penonton bs menyapa langsung atletnya dari deket kan tuuuuuh..";;;;"1074902299573551104";https://twitter.com/S_SiscaJKT48/status/1074902299573551104
S_SiscaJKT48;2018-12-18 12:35;18;121;"Singkat waktu akhirnya pertandingan selesai dimenangkan oleh teamnya ben hardy. LALUUU tiba2 gembruduk org2 yg duduk di belakangku turun ke arah balkon,mereka mau liat atletnya kluar dr kolam kan tuh.. Aku ikutan dan tida boleh terlewat dongpun... akhirnya aku kedepan jg kan";;;;"1074901002535395329";https://twitter.com/S_SiscaJKT48/status/1074901002535395329
S_SiscaJKT48;2018-12-18 12:23;25;138;"Ya kurang lebih begini ya keadaannya dari tempat aku duduk wkwkwkwkwkwkkwkwkwkwkwkwkwkwkwkwkw wkwkwkwkwkww wkwkwkwkwkwkwkwkwmwkwkwmxvwjsn suqndbx8172yegsvqiwjshisqj pic.twitter.com/a7ZYzvyNAN";;;;"1074897948188635136";https://twitter.com/S_SiscaJKT48/status/1074897948188635136
S_SiscaJKT48;2018-12-18 12:12;31;341;"GAIS AKU BLM SLESAI CERITA TP MAU NGERENDEM CUCIAN DULU BENTAR";;;;"1074895255474860032";https://twitter.com/S_SiscaJKT48/status/1074895255474860032
S_SiscaJKT48;2018-12-18 12:12;26;151;"Sumpa itu gimana ya aduh kayanya seperti kalo kalian di eyelock oshi gitu ngerti ga siii? Langsung mematung dan tercengang Wkwkwkwk abis itu aku langsung mempersudah sesi makan mie aku dan fokus mencari cara agar si ben hardy nengok ke kita lagi aduh bucheen";;;;"1074895059659542529";https://twitter.com/S_SiscaJKT48/status/1074895059659542529
S_SiscaJKT48;2018-12-18 12:08;26;140;"Terus aku kebetulan nontonnya sama kaka staff yg modelan kaya aku juga kan.. eh kaka staff ini tiba2 teriak dong "BEN HARDYY AISHITERUYOOO" terus si ben hardy ini nengok ke kita trs senyum kecil trs aq kaya lupa bagaimana caranya mengunyah mie dan menelan nya";;;;"1074894261278060544";https://twitter.com/S_SiscaJKT48/status/1074894261278060544
S_SiscaJKT48;2018-12-18 12:07;27;125;"Kebetulan dan memang sudah kehendak alam, aku duduknya deket balkon gais.. jadi deket tempat duduk pemain2nya gitu kan. Yaudah deh tuh aku melanjutkan makan mie dalam cup sambil melihat punggung ben hardy yg jauh dan tidak bs kucapai hanya bs menunggu kamu berbalik";;;;"1074893773392367616";https://twitter.com/S_SiscaJKT48/status/1074893773392367616
S_SiscaJKT48;2018-12-18 11:53;21;127;"Pertandingannya tuh 3 jam gitu tapi ganti2 negaranya. Nah abis teriak itu, akhirnya aku keluar gais cari makan karna aq lapar. Yaudah terus aku masuk lagi dengan mie dalam cup ditangan.. Eh ternyata pas aku masuk, si ben hardy ini lg istirahat, jadi duduk dipinggir kolam gt";;;;"1074890480754733056";https://twitter.com/S_SiscaJKT48/status/1074890480754733056
S_SiscaJKT48;2018-12-18 11:51;29;143;"Akhirnya dengan keberanian tinggi aku memutuskan untuk berdiri dan teriak sekenceng2nya "BEN HARDY DAISUKI GANBATTE NEEEEEEEEE" tapi gak ternotis karna dia lagi ngoper bola Terus kayak semuanya ngeliatin aku tp gpp aq pede trs abis itu aku duduk lg lalu aku minum air karna aus";;;;"1074889867379671041";https://twitter.com/S_SiscaJKT48/status/1074889867379671041
S_SiscaJKT48;2018-12-18 11:49;22;128;"Mba2 depanku tuh pada teriak2 semangatin atletnya gitukan.. aku pengen bet tp kayak malu gitu.. Nah tapi si mba2 ini ternotice sama ben hardy. Dan di dadah2in. Wah mulai panas dong eug mulai membara";;;;"1074889258500911105";https://twitter.com/S_SiscaJKT48/status/1074889258500911105
S_SiscaJKT48;2018-12-18 11:46;21;118;"Ternyata si ben hardy ini pemain cadangan... nah beberapa menit kemudian, akhirnya dia nyebur. Byurrr kaya lumba2 gitu, khawatir aku dia tenggelem gak ya.. Udahkan yauda aku liatin tuh dengan khidmat pertandingannya..";;;;"1074888729569812480";https://twitter.com/S_SiscaJKT48/status/1074888729569812480
S_SiscaJKT48;2018-12-18 11:43;21;114;"Tibalah hari dimana aku nonton pertandingan waterpolo. Sebutlah si atlet yg udah ku browsing ini namanya "ben hardy" Nah pas nonton lha ini mana ya si ben hardy kok ga keliatan hmm ya emg susah ya mereka kan berenang udagitu pake helm(?) lagian jd ga keliatan mukanya";;;;"1074887820169248768";https://twitter.com/S_SiscaJKT48/status/1074887820169248768
S_SiscaJKT48;2018-12-18 11:39;21;120;"Terus aku akhirnya beli tiketnya sendiri.. nah 1 hari sebelum nonton, aku browsing lah di web asiangames yg bagian foto2 nama2 atletnya WKWKKWKW terus nemu yang lucu kan.. yaudah tuh aku afalin namanya hmm agak susah.. lalu.......";;;;"1074886729885077504";https://twitter.com/S_SiscaJKT48/status/1074886729885077504
S_SiscaJKT48;2018-12-18 11:36;21;125;"Kayaknya memang semua org berusaha menjauhiku dari cabor yang berurusan dengan air dan pemandangan indah WKWK akhirnya karna penasaran, dengan kegihihan tanpa batas, aku memutuskan untuk beli sendiri tiketnya!!! Wkwkw";;;;"1074886085409366016";https://twitter.com/S_SiscaJKT48/status/1074886085409366016
S_SiscaJKT48;2018-12-18 11:34;22;117;"Ya kalian pasti tau apa motivasi aku ingin nonton berenang aduh maaf ibuk LALUUU kan Jeketi dpt kesempatan tampil di setiap cabor asian games.. terus aku menunggu2 saat team K3 kebagian tampil di cabor berenang. Eh tau2nya gak kebagian di cabor itu...";;;;"1074885662631817217";https://twitter.com/S_SiscaJKT48/status/1074885662631817217
S_SiscaJKT48;2018-12-18 11:33;21;127;"Jadi.. pas udah deket2 Asian Games 2018 tuh ya aku kaya ud excited banget udah gembar gembor ke semua orang "GUA HARUS NONTON BERENANG POKOKNYA" Nah trs salah 1 staff ngomong.. "eh sis kalo mau nontonnya waterpolo aja" NAH aku gatau kl ad olahraga namanya waterpolo wk";;;;"1074885230207488002";https://twitter.com/S_SiscaJKT48/status/1074885230207488002
S_SiscaJKT48;2018-12-18 11:29;93;499;"Mau aku ceritain ga ttg peristiwa aku nonton waterpolo 2 hari berturut2 pas asian games 2018?? KWKKWKWK tergabut";;;;"1074884222827941888";https://twitter.com/S_SiscaJKT48/status/1074884222827941888
S_SiscaJKT48;2018-12-18 11:28;14;212;"Siang siang gini enaknya nonton waterpolo";;;;"1074883961610854400";https://twitter.com/S_SiscaJKT48/status/1074883961610854400
S_SiscaJKT48;2018-12-17 23:25;38;374;"Sungguh akutuh kayak lg pengen ngulik lagu nih tp tiba2 kayak ngerasa laaah ini lagu yg ini bagus ini yg ini jg bagus ini juga lebih bagus jadinya aku ngafalin smua trs bingung pusing ga afal2 karna numpuk aduh aq sok pintar deh";;;;"1074702249798975488";https://twitter.com/S_SiscaJKT48/status/1074702249798975488
S_SiscaJKT48;2018-12-17 23:01;31;268;"Sebelum berganti hari~~ selamat ulangtahun kak @soniaJKT48 Smoga sehat selalu.. sukses karir dsn kuliahnya.. lancar rejeki.. yg baik2 deh pokoknya.. God bless youuuu #Ama21ngSonia";;@soniaJKT48;#Ama21ngSonia;"1074696042455564288";https://twitter.com/S_SiscaJKT48/status/1074696042455564288
S_SiscaJKT48;2018-12-17 17:43;49;296;"DON'T MISS IT!!!! 22 Desember 2018. JKT48 7th Anniversary Concert at Balai Sarbini pic.twitter.com/m5hBEZh7XF";;;;"1074616132294692864";https://twitter.com/S_SiscaJKT48/status/1074616132294692864
S_SiscaJKT48;2018-12-17 16:19;22;254;"Udh selesai betenya skrg mau nonton ourskyy dulu daaaaaadah";;;;"1074595026909356032";https://twitter.com/S_SiscaJKT48/status/1074595026909356032
S_SiscaJKT48;2018-12-17 15:17;34;365;"Mau bete ah";;;;"1074579409972080640";https://twitter.com/S_SiscaJKT48/status/1074579409972080640
S_SiscaJKT48;2018-12-17 15:00;21;226;"Ya sy jg dong tolong di mention thx";;;;"1074575140925595648";https://twitter.com/S_SiscaJKT48/status/1074575140925595648
S_SiscaJKT48;2018-12-17 11:34;17;229;"Tercengang akutu https:// youtu.be/ATOTl1x83o0";;;;"1074523259884851200";https://twitter.com/S_SiscaJKT48/status/1074523259884851200
S_SiscaJKT48;2018-12-17 11:17;29;284;"Yaampun dengerin ini dong merinding terus https:// youtu.be/ENteMb91jF0";;;;"1074518914816606208";https://twitter.com/S_SiscaJKT48/status/1074518914816606208
S_SiscaJKT48;2018-12-16 19:39;26;309;"Apaan org ga kemana2 kok WKWKWKWKWKKWWKWKKW amin doain ya supaya aku bs nyusul kesayanganku yg nomer berapa aja dahh wkwk";;;;"1074282893554286592";https://twitter.com/S_SiscaJKT48/status/1074282893554286592
S_SiscaJKT48;2018-12-16 19:23;48;325;"Our skyy pic.twitter.com/ZzrF29cGe7";;;;"1074278750265602048";https://twitter.com/S_SiscaJKT48/status/1074278750265602048
S_SiscaJKT48;2018-12-16 16:55;30;351;"yaampun kesayangan nomer 7 lagi fanmeet... andai punya kekuatan teleport..";;;;"1074241676984479744";https://twitter.com/S_SiscaJKT48/status/1074241676984479744
S_SiscaJKT48;2018-12-16 16:36;34;348;"ya jd spt yang sudah kalian tau kalo poni aku mengalami kecelakaan.. jadinya utk beberapa bulan kedepan akan lebih sering mengangkat poni sampe dia kembali seperti semula....";;;;"1074236785616609282";https://twitter.com/S_SiscaJKT48/status/1074236785616609282
S_SiscaJKT48;2018-12-16 16:15;53;382;"Disini aku keliatan gak tembem yey wkwk pic.twitter.com/4cKtz3JCmr";;;;"1074231586231484416";https://twitter.com/S_SiscaJKT48/status/1074231586231484416
S_SiscaJKT48;2018-12-16 12:15;22;315;"Mimin lg rekoleksi nih gais di Gereja sama tmn2 mimin hehehhe.. krn hari ini libur jadinya pulang ke Bekasi~";;;;"1074171069160861698";https://twitter.com/S_SiscaJKT48/status/1074171069160861698
S_SiscaJKT48;2018-12-16 12:10;24;253;"Yaampun ngantuk bgt";;;;"1074169880889323520";https://twitter.com/S_SiscaJKT48/status/1074169880889323520
S_SiscaJKT48;2018-12-16 08:21;32;314;"Selamat pagi! Minggu Adven ke 3 wuooo 2 minggu lagi udah natal can't wait~ Jangan lupa ke Gereja bagi yg melaksanakan!";;;;"1074112249768292352";https://twitter.com/S_SiscaJKT48/status/1074112249768292352
S_SiscaJKT48;2018-12-15 23:43;36;330;"hari iniii seru.. tadi pagi kan JKT48 Akustik tampil di SMA Ananda Bekasii uuu ketemu dedek2 gemas abis itu theater~ rame... aku terharu deh kalo pas Mushi No Ballad, kalian lighsticknya banyak trs warna ijo gt ih kaya konser.. amin";;;;"1073981947829936128";https://twitter.com/S_SiscaJKT48/status/1073981947829936128
S_SiscaJKT48;2018-12-15 23:41;26;262;"Hummmmm";;;;"1073981423680315393";https://twitter.com/S_SiscaJKT48/status/1073981423680315393
S_SiscaJKT48;2018-12-15 10:35;35;223;"Jengjengjengjeng~~ Ada JKT48 Acoustic tampiiiillllll~ ayo datang siapatau ad yg rumahnya deket sini pic.twitter.com/x1nqrX4BEi";;;;"1073783547033501698";https://twitter.com/S_SiscaJKT48/status/1073783547033501698
S_SiscaJKT48;2018-12-15 08:44;55;472;"morning!!!!!! pic.twitter.com/WcWH9ggM1S";;;;"1073755671609274370";https://twitter.com/S_SiscaJKT48/status/1073755671609274370
S_SiscaJKT48;2018-12-14 23:32;26;311;"Tp aku susah bikin lirik...... bisa nya nada.. ah pasti ini wacana.. tp pengen.. kalo ariana grande di lagu "Thank u, next" nyebut nama mantan2nya.. aku pgn bikin lagu nyebut kesayangan2nya.. wadadaw... 1 jam lagunya kali ya";;;;"1073616778931011585";https://twitter.com/S_SiscaJKT48/status/1073616778931011585
S_SiscaJKT48;2018-12-14 23:24;45;435;"mau bikin lagu temanya 'jatuh cinta padanya yang tak tau aku ada'";;;;"1073614666025189377";https://twitter.com/S_SiscaJKT48/status/1073614666025189377
S_SiscaJKT48;2018-12-14 22:17;132;779;"Meskipun ga centang biru tp aku sisca jkt48 team k3 anak ibuk pic.twitter.com/whz9dKrn8n";;;;"1073597952357089280";https://twitter.com/S_SiscaJKT48/status/1073597952357089280
S_SiscaJKT48;2018-12-14 22:13;40;332;"Kpn y https:// twitter.com/H_EliJKT48/sta tus/1073595865313423364 …";;;;"1073596784310513665";https://twitter.com/S_SiscaJKT48/status/1073596784310513665
S_SiscaJKT48;2018-12-14 13:22;16;194;"https:// twitter.com/ArianaGrande/s tatus/1073442482506092544 …";;;;"1073463142968045568";https://twitter.com/S_SiscaJKT48/status/1073463142968045568
S_SiscaJKT48;2018-12-14 12:11;78;500;"twitter lucu bgt dah thread2nya wkwkwk bangga jadi anak twitter";;;;"1073445265208557568";https://twitter.com/S_SiscaJKT48/status/1073445265208557568
S_SiscaJKT48;2018-12-14 11:08;23;313;"See u today at theater~♡♡";;;;"1073429512988180481";https://twitter.com/S_SiscaJKT48/status/1073429512988180481
S_SiscaJKT48;2018-12-14 00:46;35;339;"haha https:// twitter.com/R_AninJKT48/st atus/1073261731252559874 …";;;;"1073272999841693696";https://twitter.com/S_SiscaJKT48/status/1073272999841693696
S_SiscaJKT48;2018-12-13 22:32;25;277;"Ini gak ada yg mau belain aku?????!!!!!";;;;"1073239246729764864";https://twitter.com/S_SiscaJKT48/status/1073239246729764864
S_SiscaJKT48;2018-12-13 15:45;46;432;"PAH AKU DIGANGGUIN!!!!! @ChrisEvans Nih @M_DesyJKT48 @R_AninJKT48";;@ChrisEvans @M_DesyJKT48 @R_AninJKT48;;"1073136793816420352";https://twitter.com/S_SiscaJKT48/status/1073136793816420352
S_SiscaJKT48;2018-12-13 15:28;33;377;"Chris evans dan sisca memang cocok sudah skakmat, Bodo amat https:// twitter.com/M_DesyJKT48/st atus/1073112467801174016 …";;;;"1073132604809928704";https://twitter.com/S_SiscaJKT48/status/1073132604809928704
S_SiscaJKT48;2018-12-13 13:38;25;326;"Ah takut ah ntar beneran di iyain lg :( wkwkwkwkwk";;;;"1073104736570626048";https://twitter.com/S_SiscaJKT48/status/1073104736570626048
S_SiscaJKT48;2018-12-13 13:30;77;606;"Gaseru gaada verif nya aku beneran kayak fan account atau akun RP............ wkwkwwkwkwkwk";;;;"1073102892712620032";https://twitter.com/S_SiscaJKT48/status/1073102892712620032
S_SiscaJKT48;2018-12-13 13:30;13;177;"Telat";;;;"1073102718854516736";https://twitter.com/S_SiscaJKT48/status/1073102718854516736
S_SiscaJKT48;2018-12-13 12:07;53;339;"YAAMPUN PANAS BANGET DUNIA";;;;"1073082053581668357";https://twitter.com/S_SiscaJKT48/status/1073082053581668357
S_SiscaJKT48;2018-12-13 10:36;33;265;"Pagi2 di gombalin pic.twitter.com/c1ixvrPuPx";;;;"1073059017616834562";https://twitter.com/S_SiscaJKT48/status/1073059017616834562
S_SiscaJKT48;2018-12-12 21:04;38;256;"Wew besok udah Kamis nih itu artinyaaaaa besok ada #48Show ! Tapiii sebelum menyambut hari esoo jangan lupa tonton video kita minggu lalu ya~ asik nih dangdutan wkwk https:// youtu.be/FSZ9p0B80fE";;;#48Show;"1072854666726129669";https://twitter.com/S_SiscaJKT48/status/1072854666726129669
S_SiscaJKT48;2018-12-12 20:51;34;261;"WOW 2WISH WOW IM SHOOK";;;;"1072851490123870208";https://twitter.com/S_SiscaJKT48/status/1072851490123870208
S_SiscaJKT48;2018-12-12 20:21;38;456;"Hhhhhhhhh aku lg di mol nih senyum2 sendiri tp aku menyembunyikannya ayo tebak karna apaaaaa aaaaaaaaaa";;;;"1072843962707206144";https://twitter.com/S_SiscaJKT48/status/1072843962707206144
S_SiscaJKT48;2018-12-12 17:42;21;227;"Ganbatte https:// twitter.com/jamesdrodrigue z/status/1072577090183155714 …";;;;"1072803846433366016";https://twitter.com/S_SiscaJKT48/status/1072803846433366016
S_SiscaJKT48;2018-12-12 16:50;38;304;"Seluruh dunia uda mendengar kalo ben hardy punya aku hehe maaf sekadar mengingatkan https:// twitter.com/zaraJKT48/stat us/1072790207823458304 …";;;;"1072790780094275584";https://twitter.com/S_SiscaJKT48/status/1072790780094275584
S_SiscaJKT48;2018-12-12 16:47;37;239;"Ijinkan aku tuk menghapus air mata di pipimu alias IYA AKU UDAH NONTON TRAILER AVENGERS 4 SEBELUM REHEARSAL CONCERT DI SURABAYA KEMARIN TRS AKU AMBYAR INSIDE AGAK GAK FOKUS AJA PAS NARI pic.twitter.com/CLZLT5NAks";;;;"1072790155176505344";https://twitter.com/S_SiscaJKT48/status/1072790155176505344
S_SiscaJKT48;2018-12-12 16:40;38;299;"Sama hehehe ya ga pah? @ChrisEvans https:// twitter.com/zaraJKT48/stat us/1072786470698541056 …";;@ChrisEvans;;"1072788195031506945";https://twitter.com/S_SiscaJKT48/status/1072788195031506945
S_SiscaJKT48;2018-12-12 12:06;39;298;"eheheeh aku udah makan siang soalnya halu butuh tenaga juga";;;;"1072719381992370176";https://twitter.com/S_SiscaJKT48/status/1072719381992370176
S_SiscaJKT48;2018-12-12 12:00;23;301;"kalo nonton mad max fury road nanti malem bisa mimpi dikejar Tom Hardy gak ya??";;;;"1072717851209781248";https://twitter.com/S_SiscaJKT48/status/1072717851209781248
S_SiscaJKT48;2018-12-11 23:12;28;363;"Sedih aku beneran deh... tanya aja kak rona aku sedihnya sedih bgt deh...jd ga pede Gimana sik biar bisa numbuhin rambut cepet.. pake sampo kuda??";;;;"1072524479090302978";https://twitter.com/S_SiscaJKT48/status/1072524479090302978
S_SiscaJKT48;2018-12-11 23:07;51;334;"Aku salah potong poni gais wkWKKWWKWw sumpa setiap bangun tidur langsung menuju cermin menatap nanar dgn pandangan tak percaya kayak plis ada keajaiban yg bs mengembalikan poniku Poniku jd kroak pic.twitter.com/J6ZjD7BJMi";;;;"1072523320854220808";https://twitter.com/S_SiscaJKT48/status/1072523320854220808
S_SiscaJKT48;2018-12-11 23:02;17;281;"Ada gak sih ekstensyen poni.... cuma poni aja...";;;;"1072522068992901120";https://twitter.com/S_SiscaJKT48/status/1072522068992901120
S_SiscaJKT48;2018-12-11 21:21;3;17;"Saran ditampung";;;;"1072496632099467270";https://twitter.com/S_SiscaJKT48/status/1072496632099467270
S_SiscaJKT48;2018-12-11 21:20;2;11;"Telan :(";;;;"1072496276808323072";https://twitter.com/S_SiscaJKT48/status/1072496276808323072
S_SiscaJKT48;2018-12-11 21:06;43;437;"Pgn cover lagu thailand ah soon ya";;;;"1072492892797747201";https://twitter.com/S_SiscaJKT48/status/1072492892797747201
S_SiscaJKT48;2018-12-11 19:53;26;251;"!";;;;"1072474524258631680";https://twitter.com/S_SiscaJKT48/status/1072474524258631680
S_SiscaJKT48;2018-12-11 19:29;75;602;"Iyaa centang birunya ilang hahahah tapi centang nasinya gak ilang kok.. sabar yaaaa smua butuh waktu";;;;"1072468313496793088";https://twitter.com/S_SiscaJKT48/status/1072468313496793088
S_SiscaJKT48;2018-12-11 19:28;37;342;"Lama2 akun ini jadi akun fan account HAHAHAH5555";;;;"1072468121435467777";https://twitter.com/S_SiscaJKT48/status/1072468121435467777
S_SiscaJKT48;2018-12-11 19:17;64;325;"AKU TUH PUSING 2 MINGGU GABISA NGETWIT JD slama gabisa twiteran aku nulisnya di notes semua teriakan hatiku pic.twitter.com/XcA38Ajj2q";;;;"1072465461714010113";https://twitter.com/S_SiscaJKT48/status/1072465461714010113
S_SiscaJKT48;2018-12-11 19:10;37;329;"HSBSJWJNXNWJWNSNSJKZJNEJWJZBWHJDN";;;;"1072463669286572032";https://twitter.com/S_SiscaJKT48/status/1072463669286572032
S_SiscaJKT48;2018-12-11 19:10;86;570;"SAWADIKHAAAAAAAAAAAAAAAAAAA";;;;"1072463640958263296";https://twitter.com/S_SiscaJKT48/status/1072463640958263296